از جمله کسانی که در رأس این جنبش قرار دارند	that there has always been such a man among those who stood at the head of the movement.
خدا نخواسته باشد که من در حضور آقایان محترم خود خلاف واقع بگویم	I assure you I had no idea of insulting the court
بر طبق قول رسمی خویش وی را حاکم آن جزیره گرداند.	to make him governor of, as he had promised.
به جای نام خانوادگی را نیز سفید گذاشته بود به این امید که روزی بتواند نام خود را در کنار آن حک نماید.	a blank left for that which he hoped one day to have bestowed upon her
من بدون اینکه احساسش کنم صدای حبس شدن نفسم را شنیدم.	I heard my breathing stop without feeling it.
بلکه وقتی هم به نزدیکی آسیاهای بادی رسید باز نتوانست به کنه حقیقت پی ببرد.	nor perceived, near as he was, what they were
شخصیت او به وضوح در برابر دیدگانم ظاهر شد.	the analysis of his nature was proceeding before my eyes.
اما نباید هیچ کس را به اتاق او راه بدهند.	but they were not to be admitted to him.
اما به وی مشکین وحشی حیوانی آن را استشمام کند	but only smells its wild animal muskiness
از هرچه تا آن وقت شنیده بود دلپسند تر بود	the pleasantest he had ever heard.
اکنون دکان نانوایی خود را در مرکز شهر تأسیس کرده بودند .	now had opened a bakery downtown.
به هر حال فرصت فکر کردن به این چیزها را نداشتند.	in any case, they had little time for speculating on such things now.
که با آسودگی بر روی قالی قرمز ایستاده است	stood out in relief against the red tapestry
آنجا دیده گشودم و چشمان خود را مالیدم و به خوبی احساس کردم که در خواب نیستم و کاملاً بیدارم.	I opened my eyes, I rubbed them, and found I was not asleep but thoroughly awake.
لکن شهرت دارد که کم و بیش به انسان شباهت پیدا کرد!	but it is alleged that he grew into something more or less resembling a man.
قضات غافل از ین معنی نیستند که باید بر حسب این سوابق حکم کنند.	the judges never fail of directing accordingly.
من بار دیگر فریاد برآوردم که این راز را فاش نخواهم کرد.	while I shouted after her once more that the secret should be kept sacred.
هستی موجود به تمامی در تپش آهستهٔ آن متمرکز گشته است.	in its slow beat the whole creature seems to be absorbed.
خود را برای ابد از همسری با خواستگار دیگر محروم خواهید ساخت	you forever lose the chance of marrying the other
کار ممکن نیست یک قانون بشمار آید بی آنکه یک حق شمرده شود.	labor cannot be a law without being a right.
کاترین در آخرین لحظه برگشت و چنان نگاهی به سویم افکند که قلبم به درد آمد و بسیار اندوهگین شدم.	he casting back a look that cut my heart she obeyed.
باید طوری باهاش تا کنم که خیال کنه مثل سابق دوستش دارم.	be very nice as though he cared for her as much as ever now
در وجودش ندایی بانگ برمی داشت که بیش از هر کس اوست که باید همسر خویش را در سیه روزی یار شاطر باشد و نه بار خاطر.	so strong was the voice within her, representing that it was she of all the world who must uphold him in his misery and not augment it
بلکه محض از برای اینکه اسباب آزادی خودش شود.	but because it would also set her at liberty.
اما بار دوم خاطرنشان مرسده کرد که او را دوست دارد	at the second he reminded her that he loved her
او بانوی بسیار مهم و محبوب و مهربان است و مرا از صمیم قلب دوست دارد.	she is such a grande dame, so kind, and evidently likes me so much.
در آن تصویر آرایش اما تند و غلیظ و نگاهش ملایم و ترحم انگیز آمد.	her toilette seemed to him pretentious, and her languishing look in the worst possible taste.
چون قسمت پیشین آن به زیر درختان ساحل رسید	the bow had struck among the shore side trees
بلکه در عوض نامه را همراه با نیم دلار پول به دست او داد	but instead had handed himthe letter and half a dollar.
گرچه کام لا از فرد خستگی از پای درآمده	though certainly exhausted
اما در مقام اجرا بسیار صعب و سخت است که از قوه به فعل آید	but more difficult to conduct to an end
برای فهمیدن بهتر کاملاً به او نزدیک شده بود	inclining her head to catch the words
گرچه در دورترین کنج میز ایستاده بودم و فاصله من تا او شانزده گز بود.	though I stood at the farther end of the table, above fifty feet off.
پسر این زن با آن نگاه به تصویر ورانسکی استفهام آمیز و خصمانه.	her son with his questioning hostile, as he fancied eyes.
زیرا امکان داشت که ناخدا روزی پس از صرف ناهار به طور شوخی او را تا سرحد مرگ شلاق بزند	the probability being, that the skipper would flog him to death, in a playful mood, some day after dinner
لازم بود که افراد بیشتری به خدمت پذیرفته شوند.	it had been necessary to raise more recruits
من باید پشت در منتظر بمو نم و در رو باز کنم	I'll be waiting to open the door.
بارها پیش من آمده و با من مشورت کرده بود	came to consult me once
گویی که بیشتر با خود بود تا با او.	more to herself than to him.
خاسکتری رنگ با ته رنگی از شامگاه زیر درختان در آن	grey with the hue of twilight under the trees they seemed to be
اکنون چندین و چند دست در لگام اسبان آویخته بود.	there were twenty hands at the horses' bridles.
هری نتوانسته بود از نوشتن جزئیات پیروزیش با شاخ دم بگذرد.	the letter attached to his leg was much longer and heavier than usual
تا روزی که مرور زمان یا مرگ آتش خشم والدین او را فرو نشاند.	for time or death will put an end to the wrath of her parents.
ترتیبی داد تا مریدان او متوجه تغییر حالتش نشوند.	making certain that his pupils would not notice any gesture of his
این نوعی آنفلانزای روسی بود و دلیلی نداشت که مردم نگران باشند. فقط افراد خیلی پیر و خیلی کم سن و سال در معرض خطر جدی بودند.	nothing to really worry about except for the very old and the very young.
من وظیفه شرکت در جلسات و رای دادن در مورد اسب فلان دهاتی را به اندازه هر کار دیگری مهم می شمارم	I consider that for me the duty of being present at the session, of judging some peasants' quarrel about a horse, is as important as anything I can do.
خلاصه آن مانند چیزهائی که پیش از آن گفته بودم برای سایر دوستان ترجمه شد	the sum of my discourse had been interpreted, as before, to the rest of the company
تنها و آزاد و بدون شک حاضر و آماده برای تسلی دادن او.	alone and free and doubtless ready to provide him with the compassion he needed
رون چنان ناگهانی فریاد کشیده بود که صدای بلندش در غار پیچید	so loudly that his voice echoed all around the cave
دادستان مدعی بود که جرم این مرد ریشو و این قاتل سنگدل را به کمک همین مدارک و شواهد کوبنده قطعا به اثبات رسانده است.	where with the prosecution had proved this bearded man to be the red handed murderer that he was.
هر چند که او دیگر بدان گونه که در آیینه به چشمش آمده بود نبود.	although she did not look in the least like what he had seen in the mirror.
سر خود را که با موهای بور کوتاه پوشیده بود فرود آورد	his head bent low into the thick mass of her golden hair.
بدین ترتیب همگی یک دور کامل گرد کشتی چرخیدند.	so that they performed a complete circuit.
یکسره تاختم و اگه زودتر از اینجا نرم پوستمو می کنن.	I've ridden hard and it'll cost me my skin if I don't get out of here quick
پسر جان هر کسی آن درود عاقبت کار که کشت.	so shall you drink, my boy.
زیرا به حکم شرح و وصفی که درباره آنان کرده بودم	as these lawyers, by the description I gave of them
ولی من تقاضا دارم همه به حریم خصوصی خانواده و روند محرمانه تحقیقات احترام بذارن	but I ask that everyone respect the privacy of the family and the confidentiality of the investigation process.
حتی کل سطح آن نیز برای این شعار جای کافی نداشت.	its whole surface furnished very indifferent space for this legend.
من فقط جواب دادم که من هنوز خیلی برای هر کاری جوان هستم و همچنین میل ندارم که هیچ رازی را از تو پنهان کنم و او باید در این باره حتماً با پدر صحبت نماید.	I only said I was too young to do anything about it yet, that I didn't wish to have secrets from you, and he must speak to father.
گرمای امروز باعث شد یه لحظه خوابم به بره.	the heat of the day, you know'I drifted off for a moment
رها از افکار درهم و پریشان بر بستر آرمید و با حالتی آسوده و آرام به خواب رفت.	he lay down to sleep in a calm and peaceful mood, free from all unquiet or disturbing thoughts.
که همه چیز و سنگ بزرگ را هم از ذهنش محو کرد.	that everything vanished from her thoughts, even the stone.
اما سلطه بر کردارش مانند همیشه به یا ریش آمد.	but her habitual control of manner helped her.
آنجا که سه سپیدار بزرگ کنار دیوار تاکستان قد علم کرده بودند.	where three poplars stand near the wall of a vineyard.
رویهٔ سفید کاسکتش به روغن چرخ مالیده شده کثیف بود.	making the white linen cover of his cap oily with cart grease
اما همیشه این احتمال وجود داشت که به پلیس مراجعه کنند.	but there was a chance they could go to the police.
رعایت این احتیاط از آن جهت بود که هم قطارش سانکو در حین برخورد او را نشناسد.	that he might not be known by his gossip when they met
که از چند روز قبل به این طرف همیشه قفل بود	which of late had always been kept locked
در نوع خود همه گونه رفتار و مراسمی را دارند	they have all sorts of ceremonies and artifices of their own
راضیش کردید که بره پیش پدر و مادرش و بعدش هم ترغیبش کردید با شما به یاد سفر تا مثلا عقدش کنید.	you induced herfirst to go home and then later to go away with you on this trip inorder, as you told her, to marry her.
اگر بار اون سورتمه را سبک کن ین خیلی بهشون کمک کرده این.	you can help them a mighty lot by breaking out that sled.
باید خیلی خوشحال باشند که بتوانند کشتی را بردارند و فرار کنند!	they'll be glad to be packing in the schooner.
همه این مناظر دوران جوانی اثر شعری بدون شاعر را بر او داشتند	all these sights of his youth had acted on him as poetry without the aid of the poets
کلاید از دریافت این دعوت نامه شادمان شد و بی درنگ پیش خود نتیجه گرفت	clyde merely gave himself over to extreme rejoicing in regard to it all now
آنگاه با دو دست سر و گلوی او را گرفته	then, grasping her by the head and throat
گویی از کودکی خود را آموزش داده بود که تحت هیچ شرایطی نباید خوشبختیش به خطر بیفتد.	as if she had trained herself from infancy not to let circumstances affect her well being.
بلکه خود هم چون آنان مشتاقانه در بازی شرکت جوید.	but to watch with them in kindred eagerness.
ناگهان دو پیرزن وارد شدند و روی قالی بنای چرخیدن گذاشتند.	suddenly two old women began spinning round on the carpet?
سرانجام حاضر شد حضور کلاید را در آن مجلس تصدیق کند.	she at last condescended to evince awareness of his proximity.
اگر طبیبی یا جراحی یافتی از برای من بفرست.	should you meet a doctor you will do me a favor by sending him to me.
آنچه را که بر او گذشته بود برایش نقل کرد	told the man what had happened
حتی در واقع چندان سریع نبود که چند حباب پرنده را آن آب ممکن بود با تعمید مرگ آسای خود به دب نه او ترشح کرده باشند.	not so quick, indeed, but that some of the flying bubbles might have sprinkled her hull with their ghostly baptism.
تا لااقل از آمیزش کثیف و رنجش بیمارستان در امان بماند.	so that she might at least be spared the sordid promiscuity of a ward.
باز هم اکنون باید از ماهیت آن ماده که با آن نفوذناپذیری تمامی آن زنانگی را پوشانده است اطلاع یابید.	yet, you are now to be apprised of the nature of the substance which so impregnably invests all that apparent effeminacy.
که در ین اثنا دیدم یک کشتی بادی به سوی سمال شرقی رهسپار است	I saw a sail to the north north east
که چون دیدار آن بسیار غیر معمول است این وضع تا آن حد پیشرفت کرده که نوعی اثر شوم بدان بخشیده است.	that a glimpse of it being so very unusual, that circumstance has gone far to invest it with portentousness.
از فکر اینکه نتوانم قبل از فرا رسیدن شب کاترین را بیابم هراس سراپایم را فرا گرفت.	so I began to fear night would fall ere I could reach them.
یاد زمانی افتادم که دیده بودم پرستار واکسن هاری را تزریق کرده بود.	like I remembered seeing the nurse do before our rabies shots.
کلی هم از خوش طینتی و ادب و محبتش تعریف و تمجید کرد.	dwelt a good deal upon his being so very good humoured and obliging
بدون هیچ ارزش انسانی مثل یک حیوان در قفس نابود میشید.	with no dignity, just an animal in a cage!
تا وقتی من بذارم از این ور به یاد او نور.	as long as I can keep him from crossing over
گاه به یاد مادر پیرش و از خود پرسیده است	sometimes he would maybe think of his old mother
در حالتی که تمام ملازمان مشغول گریه و زاری بودند.	amid the tears and lamentations of the whole household
یک لنگه دستکش پوست آهوی بلند و صاف و قشنگ که هم رنگ پالتو پوست تازه عروس بودنش بود.	her beautiful gazelle skin glove, long, smooth, soft, the same color as her newlywed' s skin.
اوراق خود را جمع کنید و آن را به من بدهید شما اینجا در اطاق من خواهید خوابید و قبل از خوابیدن صحبت خواهیم کرد	give me the papers, and go to bed like a sensible fellow.
ارلاندو فهمید که سرنوشت مهت وم او رقم خورده بود.	he knew that his doom was sealed.
خیلی متأسفم که اسباب مزاحمت و بی خوابی شما را فراهم آوردم.	I'm sorry I disturbed you.
بعد با دلسوزی و نگرانی نگاهش را برگرداند طرف شوهرش.	turning her eyes with affectionate anxiety towards her husband.
بعد از پایان مراسم عبادی نیز شهر را ترک کرده بود.	he left town after mass.
با ین علت که به شما علاقمند هستم و میل دارم شما را نجات دهم.	because I like you and want to save you
کوشیدم به خود بقبول انم که احساس سر درگم طغیان آهسته آهسته در ذهن کند او نمو کرده اکنون سر بر آورده بود	I tried to persuade myself than an obscure feeling of revolt had been gradually coming to a head in his slow mind
قرار نیست بابت اینکه بیرون باشی بهت پول بدهم	I'm not paying you to do whatever it is you're doing out here
با یک خیز از چپر گذشت و ناپدید شد.	cleared it at a bound, and was gone.
حتی عقلت نرسید که حروف اول اسم خودتو برای اون دو تا اسم مستعار به کار نبری	what a poor plotter, without even the brains not to use your own initials in getting up those fake names you had hoped to masqueradeunder
من هم ون جا نشسته بودم و منتظرش ون بودم.	I was sitting there waiting for them.
سرانجام چمدان از پنجره بیرون رفت و بر روی صندلی عقب اتومبیل افتاد.	it slid out of the window into the back seat of the car.
زیرا برای وی مسلم شد که همه اطرافیانش امید شنیدن خبر مهمی را از دهان او دارند	for it appeared to be plain that everyone expected something of him
فوراً از جا جست و به اطراف نگریست تا ببیند که صدا از کجاست.	rising up startled, he listened and looked in the direction the noise came from
جدا از دیگران روی نیمکت کوتاهی که پشتی مقوایی سبز داشت نشسته بود.	to the back of which a piece of green cardboard was glued.
بعد صدای سنگین افتادن چیزی به گوش رسید و در پس آن صدای آهی آکنده از خستگی.	then there was the sound of a heavy fall, followed by a weary sigh.
ممکن است در تمام جهان من تنها کسی باشم که حقیقت را دوست داشته و صادقانه بخواهم نیکی کنم	I am perhaps the one man in all creation who loves the truth and genuinely desires good.
هری تای روزنامه را باز کرد و شروع به خواندن آن کرد.	unfolded it, and read it
که جای دور افتاده عاری از تمدن بود و هیچ موجود متمدنی در آن ساکن نبود.	a savage, solitary place where no civilized creature resided.
دوزش را که هنگام خوردن صبحانه به روی پایش گذاشته بود و از سر گرفت.	she had kept on her lap during breakfast.
اما همین که صدای خشمگین مادرشان را شنیدند کز کردند	but as her rage broke over them.
نزد یکی از همکاران خود شتافت و او را با خود آورد.	he ran and fetched a colleague.
برای ارائه دادخواست و چکیده پرونده به دادگاه استیناف یک سال و یا دستکم ده ماه فرصت داشتند.	that there was anentire year or at least ten months before it was necessary to filethe record and the briefs in the case.
از قرار معلوم خودتان از همه چیز خبر دارید.	you seem to know as much as I do already
حتی هرگز میل به انتقام در من نبوده است	I never particularly desired to avenge myself even
پس از صرف غذا فورا به اتاق خود رفت.	retired to his apartments directly after dinner.
بعد از این همه فداکاری که برای ما کرد !	after all she's done for us!
از شاخه غربی خاندان گریفیث ذکری به میان آید.	there lay a deepobjection to bringing on any member of this western branch of thefamily.
باز هم اثری از هیچ والی پدیدار نشده بود.	yet not a single jet was descried.
اونها مثل گرگینه های واقعی نسل خودش ون رو با آلوده کردن دیگران ادامه نخواهند داد	they do not continue their species by infecting others the way true werewolves do.
تا این آپارتمان را برای مستأجر بعدی قابل سکونت کند.	she has to render this flat habitable for the next tenant.
که به نظر او من نه تنها لیاقت همسری بلکه کلفتی پسر او را هم ندارم	that he would think I was not fit to be even a servant to his son, much less wife?
که قبلاً به سبب کم توجهی در نظرش بی اهمیت بودند.	through his frivolous attitude to them, seemed of no importance,
که عبارت باشد از فرو بردن انگشتان مقدس و مبارک خود در قدح شیر نارگیل قبل از آنکه آن نوشباه به دور درآید	that is, dipping his consecrated and consecrating fingers into the bowl before the blessed beverage circulates.
زیرا سر سنجاق از پیراهن و کمربند شلوارم گذشت.	the head of the pin passing between my shirt and the waistband of my breeches.
انتظار نداریم مردم از آنچه غیرعادی نیست عمیقاً متأثر شوند.	we do not expect people to be deeply moved by what is not unusual.
دوست وفادار بود درمیان مجرمین همان قدر نادر است که در میان سایر طبقات مردم.	who could be trusted to stand by any one who was kind to him was as rare among criminals as among any other class of men.
در آن از من خواسته بود به خانه بازنگردم.	telling me not to come home.
هرگاه قصد دیدن جاویدانان را داشته باشم با کمال خشنودی مرا نزد آنان خواهد	he was glad of any occasion to keep me among them
دل و اندرونش را تکان داد تا روی پوست بیفتد	shook out the intestines onto the skin
توسط مرد باریک و لاغری که دستمالی بر چشم خود بسته بود و زیر تختش پنهان شده بود	by a tall man with a black patch over his eye, who had concealed himself under the bed
همین جبن ذهنی و اخلاقی بود که نگذاشت تا صریحا به ربرتا بگوید	from saying outright that hec ould not
شمع از آن بیرون برای آن است که نشان بدهد آذوقه را کجا باید ببریم.	his light out yonder is to show the spot to which to bring it.
بعید است که تا صبح بتواند نحوهی اجرای آن را بیاموزد.	he'd have a real job mastering it overnight.
تحولی رخ داد که سبب شد تا کلاید نزد خود چنین نتیجه بگیرد	a thing happened which caused him to think
کارت رایت هم غالباً تو را زیر نظر داشت تا در جریان همة امور قرار بگیرم.	so that I was able to keep my hand upon all the strings.
در این کت با برای همه گونه اشخاص لباس متناسب به حال ایشان پیش بینی شده است از جمله برای مرد حسود و برای عاشقی که مورد بی مهری معشوق قرار گرفته باشد و مرد فراموش شده و مردی که به فراق مبتلا است لباس وجود دارد و این البسه چنان به قامت ایشان برازنده است که حد و وصف ندارد.	I give the jealous, the rejected, the forgotten, the absent, what will suit them, and fit them without fail.
که لگن ادرار خود را از بالکن روی سر خاطرخواه نامطلوب خالی کند.	who emptied their chamber pots on the heads of unwanted suitors.
بسیار مایلم که اقلاً یک بار ایشان را ببینم.	I should like very much to see her once more.
من سه تا خریدم انتظار چنین واکنش پر شوری را از تو داشتم!	I bought three anticipating your less than enthusiastic reaction
پیش از این واقعه دیری بود که من از ین تصمیم بیم داشتم .	I had been long afraid of this resolution
در آنجا به جز یک پزشک پیر طبیبی نبود.	where there was only one old doctor.
26 نه متکبر و خودخواه است و نه حیله گر و مکار	26. he is not proud and selfish nor ostentation
این باورنکردنی است که او در نظر تو مرد محبوب و دل پذیری جلوه کرده باشد.	that you consider him an agreeable person!
به سنگینی پائین آمد و پاکشان خود را به محل گمرک کشید.	he got out heavily and dragged himself to the customs
از راهرو خود را به پلکان رساند و بالا رفت.	up the corridor, and back upstairs.
ولی توی آفتاب و هوای گرم نمی شه باهاشون راه رفت.	but they ain't no shoes to go walking around in on a hot day.
