اما این جا هوا هنوز مثل شب تاریک بود.	but here all was still dark as night.
با این علاقة وافر به گیاه شناسی و جانور شناسی در اینجا زمینة نامحدودی برای کار در اختیار دارم	with my strong tastes for botany and zoology, I find an unlimited field of work here
یعنی وقتی که همه گمان می کردن هیچ خطری او نارو تهدید نمی کنه.	just when everyone thought they were safe.
آن هم فقط به شرطی که کاملاً تسلیم بشوی و ساکت بمانی	it is only on condition of perfect submission and stillness
باتلاق عاقبت آن حیوان را به کام خود کشید.	it sucked him down at last.
من راحت اینجا لم داده بودم و منتظر بودم به پام بیفتند.	I was sitting here complacently, waiting to be kowtowed to
دی گه حاضر نیستم بیشتر از این صبر کنم.	hervoice had sounded excited and distressed.
اما قسمت خوبش این بود که از دست من عصبانی نبود.	but the sweet part was that he wasn't furious at me.
هر گرفتاری از این ماجرا به بار بیاید نتیجهء خرابکاری توست!	if any trouble comes of this, it's your doing.
جغدهای قهوه ای رنگ وارد شدند و ولوله کنان بیرون رفتند	the brown owls flew shrieking in and out again.
ولی مثل گذشته کثیف و گره خورده و چرب نبود.	but it was no longer dirty and clotted and tangled.
زیرا هنگامی که بیدار شدم تازه سپیده دمیده بود.	for when I awaked, it was just day light.
با بازوان در هم گره شده در نور مهتاب.	a tangle of arms in the moonlight.
به خاطر دارم که از مشاهدة کراوات او به یاد پرهای سفید قو افتادم.	reminding my strolling fancy I call to mind of the plumage on the breast of a swan.
بطری نوشابة لیمویی و گازدار مجانی ترس را تا ته نوشید.	finished his free bottle of fizzed, lemon flavored fear.
ولی نباید فکر کنند برای من هم لزوماً شادی و لذتی دارد.	but that they shall not chuse pleasures for me.
اما او از کشف اسرار درونی قلب این زن عاجز بود.	but he was unaware of the secret designs of that indecipherable heart.
هرکس چیزی نداند ولو خان و شاهزاده باشد باید در شمار مردم عامی محسوب گردد.	for everyone who is ignorant, be he lord or prince, may and should be included among the vulgar.
هنوز وجودش از خشم و جوش و خروش بود	anger still surging through him
هیچ نمی شه من یه ماشینو تعمیر کنم و زخمی نشم	I never fixed no car in my life 'thout cuttin' myself.
روی هم رفته کار عاقلانه اینست که اعلی حضرت با نخستین فرصت مناسب عذر مرا بخواهد.	it would be advisable in the emperor to take the first fair occasion of dismissing me.
آن وقت بود که فهمیدم ساعت از ده گذشته.	that I realized it was after ten o'clock.
بیش از این کسی حق ندارها چیزی به گه.	that's as far as any man got a right to say.
طبعاً من جا خوردم ولی چیز واقعاً تعجب آوری این بود که چنین اتفاقی قبلاً نیفتاده بود.	I was startled, naturally, but the really surprising thing was that it hadn't happened before.
مادرش در خانه حسابی روی تلفظ و معنی کلمات با او کار کرده.	his mother had worked hard with him at home on spelling and reading.
تا وقتی که همه چیز برای سفر دریا آماده شود.	but leaves her to the owners till all is ready for sea.
تا در تسلی و هم نوایی با مسئولان تشییع شرکت کند.	to confer and condole with the undertakers.
از کنار زمین تنیس و علف زار گذشتند و به بریدگی پرچین ضخیم رسیدند	past the tennis lawn, past the pampas grass, to that break in the thick hedge
لحن آرام او آکسینیا را از کوره بدر برد.	she cried fiercely.
به نظرم یه نفر داره به این سمت میاد.	I think someone is walking down the corridor right now.
ممکنه زیاد سواد نداشته باشم چون تا سال دوم هنرستان درس خونده ام ولی وحشی نیستم	I may never have gone any further than one year of vocational technical school but I'm no fucking barbarian
وقتی که از خو نه گذشتم به عقب نگاه نکردم.	I didn't look behind me as I passed the house.
یکی از آن استادان خشمگین سئوالاتی از منطق از وی پرسیده بود	some fellow in an outrageous collar was asking him questions in logic
آیا دلایلی دارد که با ابراز آن علیه حاکم قتل خود اعتراض نماید.	he was asked if he had anything to say why sentence of death should not be passed upon him.
اما همین که از مشاهده چهره دخترش دریافت که قصد شیطنت و مزاح را دارد	but seeing by her daughter's face that it was only mischief
باید از این جا بروم و کاری انجام دهم.	I've got to take care of something on the outside.
زیرا که حرکت جان انسانی و خفقان زندگی در آن محسوس بود با نظر دقت نگریست.	for the human soul could be felt fluttering there, and life was palpitating there.
او نیز دیگر بدون معطلی با شتاب تمام حرکت کرد.	he started off, without more delay, at the greatest speed he could muster.
بی شک تعداد حریق آنجا بیدرنگ افزایش خواهد یافت.	the number of fires in that district immediately increases.
هر لحظه آماده آنم که بر او نیز بشورم.	ready at any moment to rebel against him.
یه گربه خورشید و باورداشتن اینکه هیولایی درآسمان بولینگ بازی میکنه و به خاطر اینه که رعد وبرق اتفاق میفته	thinking monsters are rolling bowling balls across the sky when it thunders
با حرکت سر به او هشدار داد و به سوی نیمکت بعدی رفت.	they moved another bench further down the road.
زیرا دختران مجبور شدند از صبح زود در صف نوبت بایستند تا بتوانند لگن خود را در توالت خالی کنند و آن را بشویند.	because from dawn on there was a long line of girls, each with her pot in her hand, waiting for her turn to wash it.
لباده بلند کشیشان را در برداشت و بی شک شماس بود.	wearing a shabby blue cassock probably a church clerk and chanter
که اگر به وال سر زا پس از آنکه یک بار زوبین خورد فرصتی داده شود	that, if the sperm whale, once struck, is allowed time to rally
حالا در این فکر بود که چه راه درازی را باید طی کند تا به مقصد برسد.	before he recollected how much he must undergo ere he could hope to reach his place of destination.
یعنی از همان وقتی که او نوزاد کوچکی بود و پدر و مادرش در یک تصادف اتومبیل جان سپردند.	ever since he'd been a baby and his parents had died in that car crash.
زیرا در غیر آن همه ما محو و نابود خواهیم شد.	unless we would all go to pieces in company.
بلافاصله مواد منفجره را در محل مناسبی دربیرون سیلندرهای موتور لوکوموتیو قرار دادم.	I now put them in position on the outside cylinder.
درست مثل آنکه شاهد ریز بار تند و حیاتبخشی باشند.	it was like seeing the start of a good drenching rain.
من و مادرم خود را در وضع بسیار دشوار و خطرناکی یافتیم.	we saw ourselves at once in a difficult and dangerous position.
حق با تو است. من هیچ توجهی به احساسات تو نسبت به این بچه ندارم.	I feel no interest in your infatuation over this girl, that's true
در نتیجه لطف و مرحمت مادرش و از شدت شرم احساس بیماری کرد.	courtesy of his mother'and he was sick with shame.
ا زخود پرسید گفتار و احساسش در گفتگویی که به فوران خشمش منتهی شد تا چه اندازه صادق بوده است.	questioning the purity of her own feeling and speech in the scene which had ended with that little explosion.
نشستم و موهایم را از روی صورتم کنار زدم.	I sat up and pushed my hair away from my face.
من آن کسم که تو مرا فروختی و به دست دشمن دادی.	I am he whom you sold and dishonored
که مادرتان را منع نمایید از اخذ حق خود و رد نمایید تقدیم کسی را	to refuse the life of your mother at the hands of a man
داخل به ظلمات گذشته شده و زمان ماضی را نفوذ کرده	that you have penetrated into the darkness of the past
اما صدای زنگ از شمشیرش برخاست و شمشیر کما نه کرد و از دست لرزانش به زمین افتاد.	but his sword rang, glanced aside, and fell from his shaken hand.
اما او که نخست پلک برهم زده و آنگاه چشمانش را بسته بود.	but he had at first blinked and finally closed his eyes
معلوم بود که کاغذ و کارت را به آ به داده است.	he saw that his note had produced a good effect
آیا از روی عمد آن دختر را به دست مرگ سپرده بود یا از روی تسامح.	whether intentionally or unintentionally he had left herto die.
حتما به خاطر خواب عمیق بود که قبلا متوجه آن نشده بود.	he must have been mostly asleep before to have missed it.
من 37 خون آشام باقی مانده را ارزیابی کردم.	I evaluated the thirty seven vampires that stayed.
در حالی که شوکه شده بودم پلک زدم و بعد خودم را کنترل کردم.	I blinked in shock and then composed myself.
که دیگر وقت رفتن به خانه فرا رسیده است.	it was time they were starting home.
طبیعتا اولین اقدامات خود را از اینجا شروع کردند	they had naturally directed their first inquiries there.
او را دید که آهسته یک قدم دیگر برداشت	she saw him take another step in slow motion
که هرقدر ناله و زاری نمایم هرگز تسلی نخواهم یافت	I am indeed to be pitied I can never forgive myself
اعراب را تهدید کردند که اگر اندک صدایی از هر کدام از ایشان بلند شود	threatening them that if they raised any kind of outcry
اصلاً هم برای آرایش ساخته شده بود نه برای استفاده.	were built for style, not service
اما اینجا که تار عنکبوت پیدا نمی شه ولی شاش همیشه دم دسته	but there ain't no spider web, an' you can always get piss.
هرگاه مایل باشید در انظار عموم از شما پوزش خواهد خواست.	he will ask your forgiveness before every one if you wish it.
این زن پست و فرومایه و منفور چیده است.	the infamous, vile woman!
تمامی قسمت بالایی او و نیز قسمت زیادی که به طور معمول زیر آب قرار دارد به نحو آشکار پیدا شده بود.	the whole upper part of his form, with much of it that is ordinarily submerged, was plainly revealed.
اما دقیقاً به سبب شدت خطر قدرت عمل از او سلب شده بود.	but precisely because of the extremity of his danger he had lost the power to act.
که او وضعیت خود را زمین تا آسمان بهتر کرده است.	the rather admiring look she cast upon her that she was thinking of her as one who had vastly improved her state.
هم احساس خرسندی کرد و هم انصاف پیدا کرد.	the sense of pleasure and the sense of rendering justice
در داخل ارابه زیر پالتوی سربازی دراز کشیده بود.	lay covered with his greatcoat in the wagon.
اگه پدر و مادرش جادوگر با شن باید تو رو به شناسه.	if his parents are wizardin' folk.
بیم آن داشت که روزاموند را اندوهگین ساخته بشد.	her unhappiness was a power which he dreaded.
اطمینان یافت که برداشت نخستین درباره او نادرست نبوده است.	was convinced that her first impressions had been just.
مثل قطعات یک پازل که در جای خود قرار دارند.	like bits of a jig saw puzzle.
در تاریکی ماشین صورتش رنگ پریده و روح مانند بود .	his face pale and ghostly in the darkness of the car.
آنا پیش خود به این نتیجه رسیدند که مصلحت نیست همراه با هم به لیکرگس برگردند.	were dubious on the instant about the wisdom of riding back together.
که به هم بسته شده باشند و یکی از آن دو خوابیده و دیگری برپا باشد.	seemed yoked together like colossal bullocks, whereof one reclines while the other remains standing.
من بیشتر دوست داشتم دراز بکشم و فکر کنم.	I preferred lying still and thinking.
دیوانه دست احساسات پرشور عاشقانه غیرقابل کنترلی شده بود.	she had been carried off her feet by an ungovernable desire.
تا ببینند که آیا این بار شوهرانشان خیلی دمق هستند.	to feel whether this time the men would break.
راه را برای مراسم تشییع پیکر خوزه آرکادیو بوئندیا باز کنند.	rakes so that the funeral procession could pass by.
از پس موسیقی احتیاج به مدتی درنگ داشت تا بتواند دوباره به کار پردازد.	he always needed a certain time in which to shake free of the music before he could apply himself seriously to his work.
اما ا زر وی بو یقین داشت که پرنده آن جاست و بیش از پنج قدم فاصله ندارد.	but by the scent she knew it was sitting not more than five paces off.
اما چون به یاد آورد که سر میز شام نشسته است	but recollecting that he was at a dinner
ما یک ساعت قبل در حضور تمام این گواهان با هم ازدواج کردیم.	we were married an hour since, in the presence of all these witnesses.
که شاید عملی را مرتکب شده که سزاوار سرزنش است و به اطراف خود نگریست.	he had done anything reprehensible, looked round with a blush.
پانسیون رها از مشاهده این وضع به هم نگاه کردندو خنده را سر دادند.	burst out laughing at the sight of him.
روش او این بود که با یک آلت اعمال متناقض انجام دهد.	by contrary operations from the same instrument.
ای کاش به جای ده لیره فقط یک لیره به تو داده بودم.	I wish I had only offered you a sovereign instead of ten pounds.
نه یک جانی بالفطره سنگدل بلکه دچار ضعف ذهنی و اخلاقی است همین و نه بیش.	no more and no less not a downright, hardhearted criminal by any means.
چندین بار بی اراده کلاه از سر برداشته به خاریدن سر پرداخته بود.	several times, to take off his hat to scratch his head.
کودک را در خم بازویش از یاد برده بود.	with the baby forgotten in the crook of his arm.
با این حال حس باصره و سامعه او را در همین لحظه کاملاً گرفتار مصاحبت کسانی بود که تا آن روز با او آشنایی و شناسایی بهم زده بودند.	yet the self same senses were mentally engaged, at the same time, in busy action with almost everybody he had ever known.
بنابراین لازم نیست دیگر به مقر فعلی خود برگردید.	so there is no need for you to return to your present parish.
عیبی ندا ره یه دفعه دی گه بیایم اینجا	it won't matter to come here once more.
اما حالا قصه را دنبال کن قصه بازو را.	but go on go on with the arm story.
منتها این چند روزه به قدری حالم خراب بود که اصلا نای فکر کردن نداشتم.	only so tortured had he been for these last many days, thathe could scarcely think how to think.
رای نر او را در آغوش فشرد و بوسیدش.	he had her in his arms, and was kissing her.
تا آخرین وداع خود را با بستگان پیش از صبح روز بعد تمام کند.	before the following morning, asClyde later learned, last farewells, if any, were to be said.
اما با دیدن تغییر حالت شوهرش دفع تا ساکت شد.	but she stopped suddenly, noticing the changed expression on her husband's face.
دستش را دراز کرد و با همان یک دست ردا را روی سر اربابش انداخت و آن را پایین کشید.	got to his feet, reached up, and pulled them onehanded over his master's head.
زیرا این محل با آن جلوخانهایش خیلی اسرار انگیز و تماشایی بود.	because it was a mysterious place, with those dark arches.
دو بطری شراب غلیظ و یک شیشه خیار شور را در کیسه گذاشت	put two bottles of port and a jar of pickles in a shopping bag
در طول سفر هم فقط ماکارونی سرد همراه با پنیر کرم گذاشته خورد.	eating cold macaroni and wormy cheese.
خیلی خطرناکه چون ممکنه کسی نامه رو مخفیآنه بخونه.	it's too risky in case the owl is intercepted
ولی من فرصت تردید و ادامه ناراحتی به او ندادم و بلافاصله گفتار او را تصدیق کردم و با کمال تعجب در تأیید گفتار زن اسقف از زبان خود شنیدم که بلی.	but I agreed with her at once to save embarrassment, and I heard myself saying boldly, brazenly
با آرنج راستش روی یک سنگ قبر زیر یک بید مجنون تکیه داده بود	she was leaning pensive on a tombstone on her right elbow, under a weeping willow
ما را بگو که چقدر برای این مسافرت پول خرج کردیم	we've been at the expense of travelling
گاه به گاه به تندی برگشته بود تا مطمئن شود که کسی دنبالش نیست.	returning on his track at times, to make sure that he was not beingfollowed.
او حق داشت که بیش از این انتظار داشته باشد.	more than he had any right to expect.
لذا چنان به کوبیدن او پرداختند که کاروانسرا دار بدبخت مجبور شد کمک بطلبد.	so they began to lay on him in such a style that the poor man was forced to cry out, and call for help.
البته منظورم این نیست که پدران فرزندان خود را در انتخاب خواستگاران ناباب آزاد بگذارند	I do not mean that they ought to leave them to make a choice of what is contemptible and bad
دو سال بدین منوال گذشت و ما در خانه مثل سابق بودیم.	for two year going on, and we was just the same at home here as afore.
آیا آن شرکت به کارهای نادرست مشغول بود یا نبود	was that business or was it not a thoroughly dishonorable one nay,
شوهر خودباخته برای نخستین بار دریافت که وضعش چگونه است و به وحشت افتاد.	that for the first time he clearly comprehended his position, and was appalled by it.
من به زودی خود را با این نوع زندگی آشنا خواهم کرد. من تا امروز نوع دیگر بود	because this sort of life is new to me, I've lived rather differently.
نمی دونم اگه من توی گریفندور نیفتم او نا چی به هم می گن.	I don't know what they'll say if I'm not.
وظیفه شما آنست که با او بروید و قلبش را آرام کنید.	you must go off somewhere again to soothe and pacify her.
جز یک کپه خاکستر سرخ و آتشین بر روی زمین	but a smoldering pile of ash on the floor.
فروشنده مطلب را به اطلاع می سون رسانده بود.	this salesman chanced tosee it and recalling him at once made haste to communicate withMason
به طرف خود کشید و سیگاری از آن برداشت.	she pulled closer a tortoise shell cigar case and took a cigarette.
حالا صدا کم شده بود و از دور میامد.	now mercifully faint with distance.
در حالی که از کوتاهی مدت استراحت کمی گیج بودم.	a little giddy from the shortness of my night's rest
نگاهی اجمالی به صورت آدم گیج و مبهوتی انداختم که مرا مخاطب ساخته بود.	I caught a glimpse of the astonished face of the drummer who had announced me.
گویی سعی کرد چیزه ناخوشایندی را به خاطر بی آورد.	as though trying to remember something very unpleasant.
دستور دادند که بامداد روز دیگر درزی ای بیاید و اندازه مرا بگیرد تا یک دست رخت برایم آماده کنند.	ordered a tailor to come next morning, and take measure for a suit of clothes.
چاکران امر شاه را گردن نهادند لیکن من نتوانستم به سبب تنگی جا دو پاروی کوچک خود را در آنجا بکار برم.	by way of trial, where I could not manage my two sculls, or little oars, for want of room.
او تصمیم گرفته بود بلوایی به راه اندازد و من بر حسب اتفاق به زیر دست او افتاده بودم.	he was in a towering rage and happened to come upon me.
با توجه به احساسی که دارم مسلما نمرده ام و کل این ماجرا خانه شب تیره و تار بچه های ساکت در این اتاق تاریک حضور خود من در این جا	feeling for you is certainly not dead, and the whole thing, the house, the dark night, the silent children in this dim room, my very presence here
شهامت آن را خواهد داشت که برخیزد و در جایگاه قرار بگیرد.	he wouldhave the courage to rise and go on the stand
فقط ضعف و تب و لرز و هذیان آنی است!	it's simply the weakness of fever, a moment's delirium,
در دنیا بهیچکس حق داده نشده است که تا ابد پایدار بماند	one has not the right to cling eternally.
لنگ لنگان با آخرین سرعتی که در توانشان بود به پیش شتافتند.	they hobbled forward at the best pace they could manage.
هم ون دختر کوچولوی قبل از جنگ قبل از اینکه فقر و آتش و جنگ و الون روزهای بد از راه بر سه و تو رو در خودش غرق کنه .	a little girl again, before the war and poverty had done things to you.
با دست و بازو راه خود را به قلب جمعیت باز کرد.	shoved, butted, squirmed his way forward into the heart of the crowd.
به مادیانی که خدمتگار او بود فرمان داد که در اطاقی را بگشاید	ordered a mare servant to open a room
آنچنانکه انتظار داشت از برتری علمی شوهرش چندان نصیب نبرده بود.	she had not, as we know, enjoyed her husband's superior instruction so much as she had expected.
اثبات اتهام قاتل واقعی در واقع غیر ممکن است.	for really it would be almost impossible to make a case against the real murderer.
اگر رابطه با زن را به مرخصی سالانه دور از قلمرو خود محدود کند شاید برای همیشه موفق شود.	forever if one limited women to the yearly vacation away from the parish.
آنگاه هردو با هم این سرزمین مخوف را ترک خواهیم گفت	let us both leave this dreadful place
دکتر که حرف او را شنیده بود سعی کرد در کمال آرامش حرف بزند.	the doctor, who overheard the last word, made an effort to speak calmly.
در حالی که انتهای گسیخته طنابی که بدان سلاح بسته بود	while the free end of the rope attached to that weapon
روی سر او که از در جلویی بیرون آمده بود متمرکز شدم.	focusing on her head poking out of the cracked front door.
به حکم محیط زندگی و یا طبع خویش به دام جنون یا شهوت افتاده بودند.	had responded to some heat or lust or misery ofhis nature or his circumstances.
با احتیاط زنبور را در جریان باد قرار داد	carefully drove the bee into an air stream
فکر کرد وقت مطرح کردن آن مشکل رسیده است.	she felt that that particular source of worry had been placed.
در دنیای تجارت آدم باید برای اشتباهاتش تاوان زیادی به پردازه.	there are penalties in the business world for crooked dealing.
