هیچ انتظار نداشتم که همه چیز این قدر سریع اتفاق بیفتد!	I didn't expect it all to happen so fast!
در این اطاق بود که او آخرین نفس خود را کشید	it was in this chamber he breathed his last
اما قبلا کمین کرده بود که او برگردد تا مطمئن باشد که وی را در خانه خواهد یافت.	he had watched for him to come home so as to be sure of finding him in.
به همان حال باقی بود تا مدتی بعد از آن سر بالا کرد و با چهره پژمرده و رنگی پریده دوباره کاغذ را برداشته و باز مشغول مطالعه شد	but raised his head at the expiration of a few seconds and again perused the letter
ولی این بار به خاطر این که لرزیدن زانوانش را پنهان کند.	only now he did it to hide the trembling in his knees.
که ضربه نه عمدی بوده و نه دستکم در آن لحظه چنین گمان کرده بود آنقدر شدید که آسیبی به ربرتا وارد آورد.	not withsufficient force really to injure her, he thought at the time.
به طوری که روزی بتوانند شوهران مناسبی برای خود بیابند.	so that they could one day attract desirable husbands.
یشنهاد کرده بود تا با هم یک دست شطرنج بازی کنند	she invited him to play chess
که ریشه گرایی همه ی عناصر محافظه کار را تهدید به بلعیدن میکند	that radicalism was threatening to swallow up all conservative elements,
در هر صورت در دنیای علم جنب و جوش بزرگ یبرانگیزد.	at any rate, make a great stir in the scientific world.
معجون شبیه به لجن تیره رنگ و غلیظی بود	the potion looked like thick, dark mud
بیم دارم که حتی او هم اهمیت این جمله را کاملاً درک نکرده باشد.	I fear that even he has not quite grasped the significance of this sentence.
من بزودی حکم عفو شما را بوسیله او بدست خواهم آورد.	I will procure your pardon.
من نیز در ین باره دست کمی از آن گروه نداشتم	neither indeed was I much in their debt
در آن دم که من شتابان فرمان او را انجام دادم و پایین دویدم	then as I was hurrying off
همه از جای برخاستند و برای رفع خستگی به تراس رفتند.	the committee left their seats, and stretched their legs on the terrace.
اما با تمام وجود خود ناگهان احساس کرد که او دیگر نه آزادی تفکر دارد و نه آزادی عمل و همه چیز ناگهان و به طور قطع مقرر شده است.	but he felt suddenly in his whole being that he had no more freedom of thought, no will, and that everything was suddenly and irrevocably decided.
که اونها رو تا سرحد مرگ ترسونده ورویایی که به اونها ا حساس آرامش و امنیت داده.	that frightens the bejesus out of them and one that makes them feel safe and secure.
طناب را ربود و به طرف دشمن دست و پا بسته خود پیش رفت.	he snatched the rope and advanced to his pinioned foe.
به او گفتم جای زخم روی گردنش دست کشیدم.	I stepped forward and touched the end of my fingers to the scar tissue on his neck.
ناگاه صدای افتادن کتابی را به روی زمین شنید	she heard the loud bang of a book on the floor
شاید طوفان سهمگین آن شب وی را ناگزیر ساخته بود زودتر به خانه پناه آورد.	owing, I suppose, to the sudden storm.
پس من شما را در نیم ساعت بعد از این منتظرم	I shall expect you, then, in half an hour, baron
ملتفت این نکته هم شد و آن را به یاد سپرد.	he observed that, too, and took note of it.
تاب آن نداشت که دیگری در قلب استادش جای داشته باشد.	he could not bear any one else to have a place in his master's heart.
او هرگز وجود آن را پیش خود تصدیق نکرده بود	he had never acknowledged its existence to himself.
برای چند لحظه هاج و واج به او خیره شدم	I stare at her for a few silent seconds.
با اطاعت به صورت وحشتناک آقای دیویس دوخته شد.	were obediently fixed upon his awful countenance.
تا وقتی زیر نظر شما بود خوب بود و اخلاق خیلی خوبی داشت	he was grown so steady and such an excellent correspondent while he was under your care
او در ضمن عبور از مقابل نوانخانه چشمش به اعلانی که بر در نصب کرده بودند افتاد.	in a species of arithmetical desperation, he was alternately cudgelling his brains and his donkey, when passing the workhouse, his eyes encountered the bill on the gate.
هرکس به نحوی شادی عظیم خود را از بازگشت او اعلام کرد.	testifying in every way to their great joy at her return.
بعد شنیدم که کلید بار دیگر در قفل چرخید	then I heard the key turn once more
آمدند و به رقصندگان روی بهار خواب ملحق شدند.	came to join the dancers on the terrace.
بعد هم خیلی زود اِما را به داخل هدایت کرد.	then ushered her in too soon.
آن وقت به اندازه لباس عوض کردن هم معطل نشدم.	I have not taken the time to dress myself
اما از تظاهر به دروغ شرم کرد و با نگاهی سرد مستقیماً به چهره ورانسکی خیره شد.	but ashamed of making a pretense, she looked straight in his face with cold eyes.
که این یکی از متمولین بسیار با ثروت عالم است که	that he was in the society of some nabob
چون این جمله را با لحنی ادا کرد که انگار زیپ شلوارش باز بود.	because he suspected that she would have informed him that his fly was open in that same tone.
که امورات متوقفی بر وفق نظم و ترتیب صورت یافته	the affairs of the deceased are in perfect order
همیشه چلیکی پر از سیب روی عرشه قرار داشت	always a barrel of apples standing broached in the waist
رویم را برگرداندم و تظاهر به مرتب کردن کشوی بالایی کردم	I turn away and pretend to be reorganizing my top drawer.
که با آن فضای عامیانه و پرهیاهو کمترین تناسبی نداشت.	which was all out of proportion to the fragile, gimcrack scene.
قهوه به اتاق نشیمن منتهی شد تا آن را در آنجا بنوشد	as coffee led to a drawing room in which to drink it
اما من و شما داریم نهایت سعیمان را میکنیم حتی الامکان شام خوردنمان طولانی بشود.	while here are we trying to drag out our meal as long as possible,
بلکه با وجود برتری مقام خود چون گروهبانی مطیع اوامر او هستم.	but obey him like a corporal, though I am his senior.
تو مرا متهم به دروغ گویی و نادرستی کردی.	on that you told me I was lying, that I was not an honorable man.
نان شیرینی که مثل ابزار ماشین مهر خورده بود.	a piece of pie branded like an engine part.
که چه کسی را بپرستند و وجدان خود را به چه کسی تسلیم کنند	that is, some one to worship, some one to keep his conscience
چون هیچ معمول این گونه لویاتانهای سالخورده نیست که اجتماعی باشند.	for it is not customary for such venerable leviathans to be at all social.
کسی که نه مانند همسرش بلکه یک دانشمند و همکار باشد و مسئله را درک کند.	someone who, unlike his wife, was a fellow scientist and would under stand the problem.
من زیاد به ایرادهای او اهمیتی ندادم اما خوشحال شدم که و لم کردند.	I didn't care nothing for the compliment, but I was glad to be let off, anyway.
هرگز با هیچ زن دیگری رابطه برقرار نکرده بود	he had never known a woman.
فاصلهٔ وی بیش از آن بودکه بتواند خوب متوجهٔ آن گردد	he was too far away to tell
امروز می خوام یک خواهش بزرگی از شما بکنم. و در این حال یادگارهایش را از روی رضایت دوباره در جیب نهاد. از ین لحاظ بود که فکر کردم لازمه اطلاعاتی از زندگی من داشته باشید.	I'm going to make a big request of you today, he said, pocketing his souvenirs with satisfaction, so I thought you ought to know something about me.
موتور رو خاموش کردم. در سکوت گوش فرا دادم.	I cut the engine and listened to the quiet.
که تا وقت باقی است به دنبال محبوبش بدود.	urged her to run after him before it was too late, and he was gone.
شاید اگر در ین جا شرحی از کارهای خانگی و طرز زندگانیم در مدت نه ماه و سیزده روز اقامت خود در آن کشور بیان کنم خواننده را سرگرم کند.	here it may, perhaps, divert the curious reader, to give some account of my domestics, and my manner of living in this country, during a residence of nine months, and thirteen days.
اما از میان تمام اجناس چیز درد بخور تقریباً نبود.	but there was almost nothing in it of the slightest value.
قسم خوردند که برای آن کار یا هر دیوانگی دیگر یا خلاصه هر کار دیگری به جز تسلیم حاضرند.	they swore they were ready for that, or for any other mad thing, for anything in short but a surrender.
چه بهتر از آنکه شخص عمر خود را پایان برد	I ought to meet death on the same spot
باز هم به شنیدن این حرف به خودشان لرزیدند	quaked again under the inspiration of this remark
روز دیگر که محبس خلوت بود زبیده چندین بار با عصا و با دستمال برای ما تا حدود دو هزار اشرفی طلا پول انداخت.	thus the next day that the bano chanced to be empty she at different times gave us by means of the reed and cloth two thousand gold crowns and a paper
من هم وظیفه خودم دانستم که این امید را در دلش زنده نگه دارم.	I have made it my business to keep this very hope up.
شاید یک وقت دوباره به تو احتیاج پیدا کردم.	in case I want you again.
من آمده بودم این خبر را به تو بدهم.	I was coming to tell you so.
حیوان دمی عمیق زد و چشمان درشتش را چنان چرخاند که سفیدی آن بدل به کاسه ی خون شد	she drew in a deep breath, and, turning back her prominent eye till the white looked bloodshot,
بلکه این کینه ناشی از آرزوهای برنیامده او بود.	for her hatred was not in proportion to her love, but to her disappointed expectations.
مامانش یکی دو ماه بود که او را در خانه نگه داشته بود	his mama had taken him home for a month or two
ببینند همه چیز برای فردا آماده است یا خیر.	to check their things for the next day.
زیرا این صفاتی بود که با طبع آن جانوران ناسازگار بود.	which were qualities altogether opposite to those animals.
من فکرمی کردم که تو او ن کسی هستی که قرا ره جواب این سوال ها رو بدی.	I thought you were the one meant to provide answers.
ولی این دفعه دی گه تقصیر من نیست .	it won't be my fault!
پنجاه و سه سال و هفت ماه و یازده روز و شب بود که آماده داشت.	for fifty three years, seven months, and eleven days and nights.
این سعادت نصیبش شد صد وبیست سال پیش دیده بر جهان فرو بندد	had the happiness to be dead a hundred and twenty years ago
برای همین شوهر خواهر داشتن از شوهر داشتن بهتر است.	that is the good of having a brother instead of a husband.
تا سیاستمداران مزخرفی را قادر سازد که آن را به هدر بدهند.	to enable futile politicians and state managers to fritter it away on electorally useful white elephants.
ممکن بود کلاه را از او بگیرد و به دختر دیگری بدهد.	he might jerk the bonnet right off her head and give it to some other girl.
زن کوچک اندام به سرعت به سوی چادر رفت	the little woman walked quickly to her tent.
صدایی بیرون دادند که به غار غاری سوگوارانه شباهت داشت.	emitted a funereal shriek.
خواهید دید هم امروز هر گونه ارتباطی را قطع خواهم کرد.	 and I will do so this very day.
دی گه با خود ته که کی بخوای راه بیفتی.	I guess it's up to you when you want to leave.
برخی نیز به هواداری باز یل شمشیر کشیدند و به مقابله پرداختند.	in whose protection as many more swords were in an instant unsheathed
که در آن لحظه همچون سقفی بالای سرش قرار داشت.	which had now become the ceiling.
من یه اعلان دارم که می گه اونجا یه عالمه کارگر می خوان	I got a han'bill says they need men.
که به سال و به نیرو از او برتر است	, stronger and older stallion
که اگر هم این سعادت به شما روی آورد و چنین شمشیری بد ستتان بیفتد	that even if that happened and your worship found some such sword
نمی خوام با بحث برای منصرف کردنتان وقت را تلف کنم.	I'm not going to waste time trying to talk you out of it.
این مرا خیلی پکر کرد و علتش را هم نفهمیدم	which made me feel sorry and disappointed, I didn't know why.
چون دیگر این دو فرق چندانی برای من ندارند فایده بزرگ این کار آن است که مادرم هرگز راز مرا نخواهد دانست.	it doesn't make so much difference now she will never know
الغرض در هر چه که بتوان نام نیکی به آن داد او مقام اول را داشت	generous without limit, grave without arrogance, gay without vulgarity, and, in short, first in all that constitutes goodness
ضرورت داشت که درباره امر بسیار مهمی با وی مذاکره کنم.	I had to talk over a very important matter with him.
به هر حال اگر توضیحاتی بیش از این از من بخواهند	if anyone wants to know anything more about me
او هم صندلی خود را آورد و در کنارم نشست.	until he came out with another chair and joined me.
مادر با یک حرکت غریزی در برابر فرزند خویش بر زمین زانو زد و او را به سینه خود فشرد.	that her mother instinctively kneeled on the ground beside her, and held her to her breast.
مسلم بود که در مورد اخیر دلیل نامعلومی بوده که کام لا باعث آن زخم و برآمدگی که گفتیم شده است.	there must needs have been some other unknown reason in the present case fully to account for the ulceration alluded to.
همچنان که در رختخواب سفری خود دراز کشیده بودم یادآوری خاطرات گذشته را رها کردم تا بعداً به آن بپردازم.	laid down on my traveller's bed, I left reminiscence for anticipation.
این که اصرار کردی تا منتظر روز تولدم بمانی.	insisting on waiting for my birthday.
که بازوان جستجوگر در سرتاسر ساحل باریک پیچیدند و دیواره صخره و درها را لمس کردند.	when the groping tentacles writhed across the narrow shore and fingered the cliff wall and the doors.
در گذشته هرگز برایم اتفاق نیفتاده بود که چنین احساسی را تجربه کرده باشم.	I had never experienced the sensation.
پس از آن دیگر کسی با این گونه سؤالات مایه زحمت من نشد.	after which I was no more troubled with such questions.
اِما این را با چنان شور و حالی گفت	it was spoken with a sort of sighing animation
گفتم شاید یه جورهایی با خانواده خواهرت ربط داشته با شن.	maybe'it was something to do with'you know'her crowd.
مانند کسی که در آب غوطه خورده است هوش خود را از دست داد.	like a man plunged into water he lost consciousness.
سعی کردند دستش را در دست به فشارند و یا سپاسگزارانه شانه و بازویش را لمس کنند.	sought to seize him by the hand or place a gratefulpat upon his arm or shoulder.
تا ببیند واکنش او نسبت به این روش جدید پذیرایی چیست.	to see how she felt about this new and more complicated method of dining
رنگ باخته و لرزان در جای خود به پا خاسته بود.	pale and trembling, standing where he had been seated.
کاش اون سه نفر و تو جنگل ندیده بودم!	had not met those three menin the woods!
چیزهایی را گفتم که هرگز به کسی نگفته بودم.	I'm saying things I've never said to anyone.
سپس برای آنکه خاطر از هر تشویش و اندوهی آسوده سازد	to relieve himself of constant doubts and suspicions
به آشپزخانه رسیدم و فکر کردم شاید غذایی برای آرامش چیزی بود که به آن نیاز داشتم.	I ended up in the kitchen and decided that maybe comfort food was what I needed.
در همین موقع ناگهان زن جوانی به کنار او رسیده و با صدای بلندی جیغ کشید	when he was startled by a young woman screaming out very loud.
موفق شد با پسر خود در اتاقی سوای دار الموت قدیم دیدار کند.	she was permitted to see her son in a room entirely apart from theold death house.
اما از خوشبختی جوی کوچکی در آن نزدیکی جاری بود	but by good fortune there was a small brook hard by
آن کلاه خود را که در نظر من این مرد لگن سلمانی است به اینجا بیاور	fetch hither the helmet which this good fellow calls a basin.
او فرمان داد که دو تن از پاسدارانش که از همه بلند بالاتر بودند آن را بر تیری قرار دهند و بر شانه خود بگذارند و ببرند.	commanded two of his tallest yeomen of the guards to bear it on a pole upon their shoulders.
مقرر بود که مراسم عقد در آنجا به عمل آید	where they were to plight their troth
آن احساسی نیست که در این لحظه در تمام صورت تو نمایان است	it is not the feeling of which your whole face is full at this moment
در موقع بیماری و ناخوشی نیازهایت رت برطرف سازد و کمک کند زودتر خوب شوی.	to take care of your needs when you were ailing.
فقط بکشی دن علامت صلیب اکتفا خواهم کرد این طور!	I'll just make the sign of the cross over you, for now.
راز پدران ما در گورهای آن مادران نفهته است و ناگزیر بایست همان جا برویم تا راز را بیاموزیم.	the secret of our paternity lies in their grave, and we must there to learn it.
در آنجا به زمین خفتم و تا دو هفته هر شب کار من این بود.	where I lay on the ground, and continued to do so about a fortnight.
اگر واقعا جنون باشد یک جور ظاهر عقل دارد.	if it be really foolish, then has it a sort of wiseish look to it.
آن برتری اندیشه که در دلبستگی سوزان به کارهای علمی در او وجود داشت	that distinction of mind which belonged to his intellectual ardor
مثل این که دوباره باید از شنل قدیمی پدرم استفاده کنیم.	it's time to get my dad's old cloak out again.
ولی هنوز دل آن نداشت که از این رؤیا چشم بپوشد.	but she had not had the courage to renounce her dream altogether.
همراه با اشتباهات آشکاری است که غیر قابل چشم پوشی است	but with obvious errors that from every point of view are inexcusable?
مسئله بهتر کردن نیروهای نظامی فیصل خیلی مهم بود.	whose improvement was now our main effort.
گفت که سمت راست بدن شاهزاده فلج شده است.	said that the prince had had a seizure paralyzing his right side.
آن هم با دل و جرأت زیاد و خیال راحت.	had courage and leisure for saying it.
اگه دوست داشتی ساعت سه بیا پیش من که با هم عصرونه بخوریم.	so would you like to come and have a cup of tea with me around three?
خلاصه آن روز به اندازه مندرجات یک کتاب داستان کامل راجع به زندگی عشقی خود برایم حرف زد.	in short, a volume of a novel of fashionable life was that day improvised by her for my benefit.
به او اطمینان داد که چنانچه از شوهرش طلاق بگیرد با او ازدواج خواهد کرد.	he gave her to understand that in the event of her obtaining a divorce from her husband he would marry her.
چه کنم آن وقت از غیظ و دلتنگی دیوانه شده بودم	but I was mad
اگر سر و وضعم مناسب نباشد چه لذتی دارد با دوست و آشناها دیدار کنم.	I have no pleasure in seeing my friends, unless I can believe myself fit to be seen.
مشغول بافتن چیزی شبیه به چادر سیرک زرد رنگ بود.	sat knitting what looked like a canary yellow circus tent.
از تالار طویل به سوی اتاق خواب خود رفت.	she paced down the long gallery to her bedroom.
هنگامی که در این افکار مستغرق بودم و حیران و سرگردان مانده بودم	as I was thus deep in thought and perplexity
در نتیجه من تمام مدت بر نیمکتی لمیده بودم.	I lay on a sofa, almost from shore to shore.
سپس خم شد و تعداد از شیرها را باز کرد.	then knelt down and turned on a few of the taps.
که انگار همان لحظه یک راست و به تاخت از مرغزاری سبز از آن سوی دنیا آمده بود.	as though he had come this moment , straight out of some green meadow at the other side of the world.
با تقلای فراوانی کوشید به سمت او پرتابش کند اما توفیق نیافت.	threw it with a hard effort which was but impotence.
که پدرش تا به این درجه توضیح خواهد نمود	that his father would carry candor, or rather rudeness
باز هم با آن بسازم چون چیزی بهتر از این نیست که انسان با تمام ساکنان هر کجا که در آن اقامت کرده دوستی کند	would they let me since it is but well to be on friendly terms with all the inmates of the place one lodges in.
ولی البته به خرج ما و با غذایی که از سفره ما خواهد خورد.	on our victuals and our drink.
لوسی نه به کارهای معمول خود پرداخت و نه برای پدر چیزی خواند.	she had neither engaged herself in her usual work, nor had she read to him.
اما در ته دل از کیتی و از خود ناخشنود بود.	but he set off at the bottom of his heart dissatisfied both with her and with himself.
باید حکم اعدام را در عرض بیست و چهار ساعت آینده اجرا شود.	the execution was to be carried out within twenty four hours.
دیدم امید از نو زنده شد و حس کردم تولد تازه امکان پذیر ست.	I saw hope revive and felt regeneration possible.
حاضر به تحمل هرگونه سختی و هرگونه خواری است	that he was ready for any trial
از او دعوت کرد که به اتفاق به خانه ی ییلاقی وی و سپس به تماشای مسابقه بروند.	he invited him to drive with him to his country villa and to the races.
من مایل بودم به طبقه بالا بروم و لباسم را بپوشم.	I had a longing to go upstairs and put on my dress
من تا حالا ندیده بودم این جور ورجه ورجه کنه.	I never see him get around so since
محصور بود و دیگر به متحد ین خود اعتماد نداشت	losing confidence in its allies, suffering from shortness of supplies
مطمئنم که در سلامتی کامل به سر می بره.	I'm sure he is in excellent health.
از جیب کتش دستمالی بیرون کشید و سر و صورت نمناک خود را با آن خشک کرد.	he took from his pocket a handkerchief andbegan to wipe his moist, cold face and hands.
چه جفای عظیمی کردی که مرا از آستان خود راندی	a grievous wrong hast thou done me to drive me forth with scorn
