به هیچ وجه گناهی ندارد که قیافه من متأسفانه مورد پسند شما واقع نشده است.	is not at all to blame that my face has the misfortune to displease you.
به طوری که همسرش اورسولا با هزار مکافات توانست با یک چاقوی آشپزخانه ریش وی را کوتاه و مرتب نماید تا شبیه آدمیزاد گردد.	with a wild beard that 'rsula managed to trim with great effort and a kitchen knife.
روبه روی زن جوان قرار گرفت و در چشمان او چشم دوخت.	stood looking down into her face while she sat looking up into his.
با چند تا از دوستام صحبت کردم البته نگفتم چه کسی تو دردسر افتاده	I've talked with several fellows without saying who it's for, of course
فقط قدری اماج جلویش بگذارند و این برنامه را در تمام دوره کارآموزی ادامه دهند	keep him on gruel all through the apprenticeship.
خیابانی که خانه و محل اقامت وی در آنجا بود نام برد.	the street where the house was.
با همان اندازه خشونت در دیرهای دیگر بو جود نیامد.	with the same severity in other convents.
به عمرم نقشه به این خوبی به فکرم نرسیده بود.	I never was better pleased with a notion in my life.
پیش از آن که به چنگ عنکبوت بیفتد یک نظر چنگک تیزش را دید.	razor sharp pincers before it was upon him.
مطمئناً الآن هم یک فهرست درجه یک درست کرده.	I dare say she may have made out a very good list now.
طبیعتا منم مجبور شدم هم ون روز عذراونو بخوام و اخراجش کنم.	I got rid of her the same day as I found it out, naturally.
او را مشاهده کرد که در صندلی خود نشسته	he saw him sitting up in his chair
چنان یکه خورد که تعادلش را از دست داد	started so violently that he missed his footing
که اینک از رفقای همرزم دیروزش بسیار دور شده بود	whom he had been fighting side by side only the previous day
برای آن است که در جهان پراکنده شود و جزئی از دستاوردهای انسان باشد.	was meant to be spread over the world and become part of the human gain.
در این اندیشه بودم که این دو را به عنوان پیک به آنجا بفرستم	these two I had thought to send back there as messengers
تو برو پایین او را بیدار کن و به او بگو.	go thou down, and wake him, and tell him.
بلکه در را از جا کنده و به زور به جای ما نشسته است.	they have burst in and seated themselves in our seats.
این سه خانه را چنان خیس کند که آتش نگیرند.	keep those three homes so wet theyd never catch.
که عنایت و استعانت خود را از شما دریغ ندارم.	which is none other than to give aid to the weak and needy.
چون فورا منظور او را از آن همه خوش خدمتی حدس زد.	for she saw through all his devices, the object of his kindnesses.
اکنون تاکجا از او دور شده و فاصله گرفته بود.	how aloof and remote from him she had become now!
با مراقبت کامل که بچه را فشار ندهد و مجروحش نسازد.	taking care that it should nothurt the child
آسانسور و گوشه کنارهای اتاق ناهار خوری خصوصی را پر کردند.	they packed the elevator and the corners of the private dining room.
آن هم با توجه به اینکه ما واقعا معتقدیم پول ریشه همه خبائث روی زمین است	considering that we so earnestly believe money to be the root of all earthly ills
حال که او صادقانه تمامی حقیقت را بیان کرده بود	as now honestly and truly as he was trying to show
ناخدا را دیدم که دراز بدراز بر کف تالار افتاده است	beheld the captain lying full length upon the floor.
اگر معنیش ای نه که باید باز هم مارو ترک کنی.	if it means that you must leave us again.
وی آنچنان به گریه و زاری افتاد و آنسان به سر و روی خود کوفت که به شدت هراسانم ساخت و فکر کردم حتماً دیوانه شده است.	it terrified me. I thought she was going mad
چون زیاد هم همراه یک جنتلمن جوان به سواری رفتن کار صحیحی نبود.	not to drive too often with the young gentleman.
تا این که چشمان درشتش برقی زده و دهانش به لبخندی گشوده شد.	as the big eyes brightened and the mouth began to smile.
همه به حساط رفتند و زیر چنار گرد آمدند.	they went out under the plane tree
این قبیل شوخی و تفریحات در میان ملاحان رواج و شیوع کامل داشت.	both pastimes being, as is pretty generally known, very favourite and common recreations among gentleman of that class.
ولی احتمال هم دارد که در مواردی از پاسپورت خودش استفاده کرد باشد.	but the probabilities are that she also uses her real identity.
پیشخدمتی درست سر ساعت پنج شام را اعلام کرد.	which was announced at exactly five o' clock by a waiter
تکانش داد و نا امیدی را یکسره از قلبش بیرون راند.	thrilling her from despair into expectation.
سپس از اعلی حضرت تمنی کردم که فرمان دهد تا برای مجهز کردن کشتی مصالحی برای من فراهم آورند و خود جواز خروج مرحمت کند.	begged his majesty's orders for getting materials to fit it up, together with his license to depart.
که اینان دو دژ مستحکم دارند که در حداکثر امکان بشری تا ابد نفوذناپذیر خواهند ماند.	they have two firm fortresses, which, in all human probability, will for ever remain impregnable.
برای همین چیزهاست که کسی نباید تنهایی به دیدن مسآبقه به یاد!	is why you should never go for looks alone!
مجبور شدم از ماشین بگیرم تا خودمو سر پا نگه دارم.	I had to grab the car to hold myself up.
گویی اسبی است که بر دو پا ایستاده است.	like a rearing horse.
من از شما ممنون شده و شکرگزار شما خواهم بود.	I will bless you I
دستم را گرفت و سرش را برایم تکان داد	took my hand, and shook her head at me
خیلی سعی کردم راضیشون کنم که اجازه بدن یه ذره دندونامو کوچ یک کنم	I've been trying to persuade them to let me shrink them for ages
که در همین حال درختی جلو چشمش به حرکت درآمد.	but presently a moving object came into sight.
در اتاق او به کلی باز بود و در آستانة آن مردی کاملاً ناشناس ایستاده و با دقت مشغول تماشای او بود.	his door was flung open and a man whom he had never seen stood in the doorway watching him intently.
همه اختیاراتم رو سبک سنگین کردم و تصمیم گرفتم صبر کنم.	I weighed up all my options and I decided to wait.
خودش پنج شش میلی طول و نیم میلی عرض داشت.	it might be five or six miles long and more than half a mile wide.
بگذار اگر قرار است بمیرم باز نزد تو باشم.	he'll let me die with you!
پرستار بچه یا ماشین نویس و کتابدار هم نیستم.	I'm not anybody's nursemaid or typewriter or bookkeeper
آن عطش سوزان عشق مهیج و آمیخته به حق شناسی که میل دارند در طبق اخلاق نهاده و تقدیم کنند	they would only multiply their torments
لباس بعضی از کارگرانی بود که به فکر چیزهای شیک و ظریفند حرف او را برید.	as some workingmen dress who have instincts for finer things.
باید آب و هوایم را عوض کنم یا چیزی مثل این.	I need a change, or something.
او از آن فریاد وحشیانه شرمسار شود و دیگران از آن تعجب کنند	everyone else would have been amazed at it at any other time.
این وضع از روزی پیش آمد که او مرد!	he's looked like that ever since she died.
در صورت پهن او آثار همدردی و تأثر ظاهر شد.	his broad face expressed pity and sympathy.
چند لحظه بعد صدای تاخت اسب به گوش رسید و دوباره سکوت همه جا فرو افتاد.	that they could hardly realize he had been there at all until they heard the spattering of gravel and the mad pounding of a horse going off at full gallop.
به آهستگی روی خود را برگرداند تا با آن بیگانه خداحافظی و از زحماتش تشکر کند که او را تا خانه رسانده است.	turned to thank the gentleman for taking so much trouble as to bring her home.
بدون اینکه برای فهم او سخنی بگوید یا تقلایی کند	without extorting a change of countenance
در آنجا به روی پاهایش بر زمین نهاد تا به پایتخت برگردد.	until he put him down on his two feet on the swamp road.
نگاه انداخت و لبخند زنان برای او سر تکان داد.	he nodded to him, smiling.
بخار در جایی رقیق و در جایی دیگر غلیظ بود	thicker in one place and thinner in another
برای آنان در پیرامون خانه من چاد رهائی بسیار مناسب برافراشتند.	tents built for them very conveniently on each side of my door.
فرمینا داثا گذشته بود که یکی از آن مسائل محال پیش آمد.	an impossible coincidence occurred
که دیدند که آن جوان همان طور در محل خود ایستاده است	upon the menacing figure which pursued them and now stood out with a distinctness still.
لب خود را چنان گاز گرفت که خون افتاد.	bit her lip till the blood came.
گذشته از این جزئیات را برای تو فاش نخواهم کرد	I won't tell you everything.
لبخندی که مخاطب بزرگش آن را به پای تأیید هوشمندانه و تحسین آمیز سخنان خودش گذاشت.	which his big interlocutor took for a smile of discreet and admiring assent.
امّا کسی پاسخ نداد و چون به ساعتش نگاه کرد متوجه شد تازه ساعت نه و نیم است	but no one answered, and looking at his watch he found it was barely half past nine
من دیگر اینجا نیستم که به قول تو سر او کولی بازی در بیاورم!	for I am not likely to come soon again, as you say, to make scenes.
ممکن است اشخاص دیگری هم که با ما ارتباطاتی دارند لو بروند	it might be up with a good many more
خدا کنه زودتر برن سر اصل مطلب چون خیلی چیزهاست که باید یاد بگیریم.	I do hope they start right away, there's so much to learn
آشپز دستش را به علامت ادای احترام به طرف پیشانی خود برد	answered the cook, and touching his forelock
آهنگی که مشغول زدن آن بودم را با پایان نامطلوبی رها کردم و با عجله بلند شدم.	I let the song I was playing trail off to an unsatisfying end, and got hastily to my feet.
بساط اعدام یک مکانیک بی جان نیست که از چوب و آهن و طناب ساخته شده باشد.	the scaffold is not an inert bit of mechanism constructed of wood, iron and cords.
با این وصف اگر راستش را بخواهید تاکنون چنین نام و عنوانی به گوش من نخورده است.	though, to tell the truth, no such surname has until now ever reached my ears.
زمانی را به یاد آورد که در اوج ناامیدی آن شمشیر به کمکش آمده بود.	remembering how it had come to his aid when he had thought all hope was lost
هیرتن نیز تنها راه تلافی را در تنبیه بدنی وی یافته بود.	a physical argument was the only mode he had of balancing the account, and repaying its effects on the inflictor.
جمعیت تماشاچیان از دور به سوی زمین کوییدیچ سرازیر شدند.	the rest of the school spilling onto the lawn in the distance .
او را راهنمائی نکنند آن جوان در تنهائی خویش به چه وضع غیرعادی و دشواری خواهد افتاد.	here unless the family chose to show him at least some little courtesy or advise him cordially from time to time.
باز هم هواپیما تکان شدیدی خورد و بر اثر این حرکت من بالا و پایین شدم	I draw myself up short with a jolt.
که هر کدام مشخصات بنیانی یکی از 450 شرکت عامی را بر رویشان ضبط کرده بودند	each bearing the basic details of one of the forty five hundred public companies
به محض دیدن گدای کور سستی از سرش پرید	at one look the rum went out of him.
در واقع ما اکنون با آتش اردوگاه در یک سطح قرار گرفته بودیم.	indeed, we had already fetched up level with the camp fire.
توی دالان به عقب دویدم تا دورخیز کنم اما باز هم خانه صاحب خانه مرا گرفت	was running down the entry a little, for a good start, when the landlady caught at me
بلکه از فلزی شبیه به طلا یا از حلبی است.	but only brass foil or tin.
بعد پیرمرد میر سه و با گلوله کارشو می سازه.	the old man he rode up and shot him down.
او را با این فکر بزرگ کند که پدرش مرده است.	by rearing her in the belief that her father was dead
در تابوتی که مدت بیست سال در آن خفته بود دفن خواهد شد.	the coffin inwhich she has slept for the last twenty years.
که به اصطلاح کاکل آنان را در دست داشته باشیم	to take time by the forelock, as the saying is
زیرا که هرقطعه از او در دست دیگری فتوای قتلی بود برای تو	for that letter must have led to your condemnation
زیرا شما اکسیر یکی و عقل دیگری را دارید.	as you have the philosophy of the one and the wit of the other
من هم گرفتار عواقب نامطبوع فشار ذهنی زیاد هستم.	I also am feeling some unpleasant consequences of too much mental disturbance
گزارش خبری تو را از مراسم تشییع جنازه تماشا کردم.	I saw your broadcast of the funeral.
پیش از برخاستن فراموش نکردم که از او تمنا کنم در مرحله بعدی به من کمک کند	not forgetting, ere I rose, to implore aid on my further path
آن وقت شاید مرا از دفتر بیرون کنند تا شب را هم در خارج از آن محوطه به روز آورم	or should I be turned out every night
چون که خیلی مغرورتر از آن بودم که نزد کسی به ضعف خود اعتراف کنم.	for I was too proud to confess my weakness to anyone else.
تصور این هم که انسان در موقع عصبانیت چه کارهایی ممکنست انجام دهد	what a man will do, when his blood is up.
باید قبول کند خیلی کار کردم تا توانستم مدرکم را بگیرم.	she ought to acknowledge that I have worked in order to pass.
اگرچه آتش بخاری اتاق را اندکی زیاده از حد گرم کرده	though the room was a little overheated with the fire
از دیدن لباس کثیف به و نی زیاد خوشش نیامد .	I really must get her another habit, she thought.
در میان همهمه صدایی بم برخاست و دستورهایی صادر کرد.	amid the clamour a deep voice was raised in command.
در حالیکه پیش آمد که آند را را از چنگ این شخص خلاص نماید	endeavoring to rid his master of the troublesome intruder
من خودم هنگامی که با او آغاز دوستی کردم با ین صفات پی بردم	I was the first to show, when I very nearly made him a present of my friendship.
حالش طوری بود که انگار نه شک و تردید دارد و نه رحم و انصاف.	looked as if he had very little doubt and very little mercy.
در حالیکه پوزخندی روی لب داشت دهانش باز بود.	his mouth opening in a grin.
به رام مهم نیست که مردم چی می گن .	I don't care what people say
باید وقتی اینجا رسید ببینید چه قدر راحت است.	he'll see how restful it is when he gets here.
همان طور که بی سر و صدا وارد اتاق شده بود همان طور هم اتاق را ترک کرد.	left the room, as quietly as he had entered it.
از شیفون پیش از آن که شوهری داشته باشد	the crinoline being blushed for before the husband
پس از مختصری جستجو. نامه را در میان صدها کاغذ دیگر در کشوری میزش پیدا کردم.	I found the letter in a pigeon hole in her desk
از آن به بعد به عنوان یک همسر خوشبخت زندگی کن.	live henceforth as a happy wife.
قشون ما را دور بزنند و نیروی ایشان زیادتر است نیز صحیح و منطقی بود.	might outflank us, as they had larger forces.
دامن را زیرش جمع کرد و انگشتان را در هم افکند و بر روی یکی از زانوان گذاشت	the skirt of her dress tucked up, and her hands folded on one knee.
اگه این بچه بره به من صدمه خواهد خورد. من اینو از اول بچگیش دیدم.	I shall miss that child. I saw her first when she was atiny thing.
ولی اگر پهلوانانی برای کمک و دفاع از ایشان بیایند	if any knights come to their aid and defence
عطر کف دستش هم شکر و هم روغن و هم نمک مرا به یاد زندگی دیگری انداخت.	the scent on her palm, all sugar and butter and salt, reminded me of another life.
تهدید کرد که اگر حسابش را نپردازد به نحوی که دلش بسوزد از حلقومش بیرون خواهد کشید	threatened if he did not pay to compel him in a way that he would not like.
به قدری خسته شده بود که ناچار روی چهارپایة پشت میز تحریر دکان نشست.	though he still panted hard, and was so exhausted that he was obliged to sit on the stool of the shop desk.
من در مورد سوابق شما اطلاع دارم و خیلی متأسفم.	I know about your background, and I'm really sorry.
تا نشان دهد که او هرگز وجود نداشته است.	in order to perpetuate the certainty that he had never lived.
شوهرش نیز مانند مردهای دیگر او را بدبخت ساخت.	HE did what they all do made her wretched.
این جادوگر مشهور همچنین موفق به کشف دوازده کاربرد جدید خون اژدها شده	for the discovery of the twelve uses of dragon's blood
اما ما همه با چشم و گوش باز مراقب بودیم.	but the remark had set us all on the alert, straining ears and eyes
هیچ کس نمی تونس آن قدر به کاره که بتونه باهاش سوراخ مورچه رو پر کنه.	a man didn't get enough crop to plug up an ant's ass
هیکل او را دید و حالتی از سراسیمگی و حزن بر چهره اش نشست.	caught sight of her, and into the expression of his face there passed a shade of embarrassment and dismay.
من میرم ماشین رو روشن کنم تا هیتر گرم به شه.	I'll go start the car and get the heater going.
برای حفظ آبروی خود و ربرتا سفرش را با آن دختر پنهان نگاه دارد.	of course, but only to protect her name and his from notoriety.
اما امری لازم و مهم مرا امشب در پیش است	but an urgent and important affair
از این حرف یک دانشگاه با همه علم و دانایی تعجب خواهد کرد.	this is a thing that would astonish a whole university, however wise it might be!
ناگهان همه با هم دست به یکی کرده و به او حمله کرده بودند.	all attacked at the same time.
حالا دیگر احتیاجی نیست به امید لبخند بخت بنشینم.	I have no need to hang on the smiles of chance now.
مطمئنم که خیلی بهتر از من ماجرای خودش را تعریف کرده.	I am sure she tells her own story agreat deal better than I can tell it for her.
تا از اقامت همیشگی در یک محل کمتر جلب توجه کند	in order that he might attract less attention than if he were to remain always in the same quarter
دیگران نیز هنگام خوردن و نوشیدن باقی شب را ساعت به ساعت بین خود تقسیم کردند.	the others allotted hour long spans among themselves as they talked and ate.
همان عشق بود که این سرنوشت را برایش رقم زد.	the real reason for all this!
بلکه به جهت طبع پلید و آزمندی آن حیوان فرومایه است.	but by the nastiness and greediness of that sordid brute.
مثل کسی که مدام صدای خروش امواج دریا را بشنود.	as one listens to the sound of the sea.
تصمیم به فرار گرفتند تا پیش از آنکه شیران از قلس بیرون آیند از ارابه دور شده باشند.	all striving to get away from the cart as far as they could before the lions broke loose.
با این همه توانستم خونسردی خود را حفظ کنم.	but I kept my head, for all that.
باور کن حتما از رختخواب پریده بیرون و از پنجره هرچی جلوی دستش بوده طلسم کرده.	I'll bet he leapt out of bed and started jinxing everything he could reach through the window,
ابتد از طرف سرنوشت و بعد هم از پاسبانان.	first from destiny, and then from the police officers
جلو خواهرش شاید تند تر از آنچه لازم بود جوابش را دادم.	I answered him rather more hotly than I should perhaps, considering that she was standing by.
این دو رفتند و شکارچیان کار خود را از سر گرفتند.	they went away, and the hunters started afresh.
من یکی از دوستای قدیمیم با رفیقش و دیدم	I met this old friend and his buddy.
حتی نیمی از توانایی گربه ولگردی را هم در دفاع از خود نداری!	not half as capable of defending yourself as a stray cat!
آن دیگر که کمر اسب تناوری را در زیر فشار هیکل خود خم کرده است	the other, who burdens and presses the loins of that powerful charger
به قول شما تقصیر خودم بود که این موضوع را مطرح کردم.	I am aware, as you say, that I am in fault in having introduced the subject.
بدینسان هر دو موفق شدند لحظه به لحظه به هدف مشترک خود نزدیکتر شوند.	they contrived in the end to reach it.
اگرچه زندگی روزمره کوتاه مدتی آن را مختل کرده بود.	but it was still untouched within him.
دوست دارم پام را روی شکم گرم و نرم یک خوک بگذارم	I love a warm pig belly for my aching feet
زیرا اربابش به او دستور داده بود که هر وقت در صحرا به سر برند و شب را در زیر سقفی نیاسایند	as his master's express orders were, that so long as they were in the field or not sleeping under a roof
بهتر از همه چیز همین که که دی گه از سر نگیریم	the best thing we can do is to let it go at that.
آن چیزی نبود که با یک لحظه اخبار بپیچند و به کشتی دیگر بفرستند.	a thing not to be rigged and shipped in any other vessel at a moment's warning.
هنگامی که برگشت و به سمت شوهرش به راه افتاد	when she turned round and walked towards him
من در دستمال یک نامه و صد اشرفی طلا بدون پول خرد در آن یافتم.	I found another paper and a hundred crowns in gold, without any other coin.
که همیشه برای نظامیان پس از توقف طولانی در اردگاه بسیار دلکش و فریبنده است.	which is always so attractive to a soldier after camp life.
تمام اهل پانسیون درباره این پیرمرد متفقا دارای عقیده واحد و ثابت بودند.	every one in the house had come to have a very decided opinion as to the poor old man.
مشاهده این حال مرا در ین عقیده که از دیر بار وجود داشته است راسخ کرد	confirmed in me the old observation
چرا این همه مدت ما را تعقیب کرده است.	why he had dogged us so long.
اما احساس کرد که در کلمات نامفهوم وی قصد و غرضی ناشایسته و نابجا نهفته است.	but she felt that his incomprehensible words had an improper intention.
