به خاطر این که به چیزهای دیگر فکر نکند.	so that he will not have to think.
من گمان نمیکنم فعالیت اجتماعی بدون مبتنی بودن بر پایه ی سود شخصی دوامی داشته باشد.	I imagine,that no sort of activity is likely to be lasting if it is not founded on self interest,
که آنجا بروید و باید شما را آنجا ببینند.	that you should be seen there
گو اینکه این روح قدرت داشت خود را وقف هدف واحدی ساخته و آنی از آن غافل نشود.	though enabled to fix itself steadily on one object, and resolved not to be turned aside by any consideration.
حالا از دفتر ایستگاه سؤال کن که پیامی برای من رسیده یا نه.	ask at the station office if there is a message for me.
گذشته از این در آن زمان من هنوز بیمار بودم.	but then, I was ill at that time, of course!
تمام خیال او رفته بود به طرف این زن دلیری	but he thought of that courageous woman
از این که یک شکاربان توانسته بود او و پدرش را فریب دهد عصبانی بود.	seemed outraged that he and his father had been outwitted by a gamekeeper.
بلکه چون دوست داشت به هر حال عملی را مخفیانه انجام دهد و از آن لذت ببرد.	but because she associated the pleasure with secrecy.
آنگاه یک پنج کو پیکی از جیب خود درآورد و در دست دختر نهاد.	took out a five copeck piece and put it in the girl's hand.
نیروی زندگی چنان شدت گرفت که او را بار دیگر پیش راند	life being now strong enough to bear her on again
سخنان مردی را باورمی داشت که زندگیش سالیان سال در نظر او متوقف شده	bearing of the man whose life always seemed to him to have been stopped, like a clock, for so many years
ولی پس از آن که برگردد دیگر تمام مدمت زمستان به جائی نخواهد رفت.	but that when he came back he would not stir all winter.
حقیقتش این است که بچه هم برایم اهمیتی نداشت.	I honestly didnt mind the child.
اما بار دوم کند و کاوی چندان در کار نبود.	but, the last spell of work was feeble and fitful.
وقتی برای اولین بار سرگذشتش را برم تعریف کرد.	a long time ago when he first told me about himself.
لبخند ژان وال ژان مبدل به یک قطره اشک شد.	the smile ended in a tear.
دیگر مراقب این بود که زیر دست و پای مردم نیفتد	he even began to avoid being crushed
مطالبی که وقتی کشف شد و آشکار گردید برای فکر و حافظه مردم پشیزی ارزش ندارد.	after they are known and proved, are not worth a farthing to the understanding or memory.
وی چند ماه پس از فرارش صاحب پسری شد	she had a son born a few months subsequent to her escape.
چون بلافاصله حس کرد که چشمان آنا با سوء ظن به او دوخته شده است.	because as soon as he uttered his mother's name he was aware of her intent, suspicious eyes.
بعد هم صدای صحبتی که کاملاً برایش مسموع بود بلند شد.	directly afterwards of voices almost close at his ear.
از پذیرایی گرمی که در خانه شما از من شده است کمال تشکر و امتنان دارم	telling him he thanked him for the kindness and hospitality he had received in his house
با وجود این همین یک کار از او ساخته بود.	yet it was all he could do to help it.
که وقتی با پای ساخته شده از عاج عاقبت به ساحل قدم نهاد	that when with ivory leg he stepped ashore at last
اولین بار که تورور دیدم به نظرم او مد که تو هم یه ذره مث خودمی.	when I firs' met you, you reminded me o' me a bit.
خود را مفلوک دید و از ای نرو چه بسیار گریست.	he felt his pettiness, and many a time he wept.
این با مزایای یک اقتصاد اجتماعی جدید جمع آید	this being combined with the data of a now social economy
هری به سمت در سمت راست رفت آهسته به جلو خمشم	leaned close to it, and muttered the password
در سیمای گندمی رنگش این بار اثری از مضحکه نبود.	she saw in it none of the skepticism, the jeering humor she knew so well.
من با دو دست خود طناب لنگر را که برای اطمینان بیشتر آن را بریده بودم	the cut hawser in both hands for a last security
مانند آن بود که جوهری غیر مرئی بر لب کشیده و اکنون آن را در مقابل حرارت آتش گرفته است.	like a mark in invisible ink brought to the fire.
به جز د رم واقعی که لازم بود چیزی تعمیر یا نصب شود .	except when she needed something mended or installed .
او موافقت خود را به این شرط موکول ساخته است که عروسی زودتر از یک سال انجام نگیرد	has made it an express condition of his consent that the wedding is not to take place for a year.
باید به گم که مجبوری مدت زیادی توی این کلبه به مو نی.	I'm afraid you will be in this cabin for a very long time,
بلند شد و همگی به دنبال او بیرون دویدند.	darted out of the house in pursuit of him.
در را که باز کرد مرا این جا دید!	when he opened the door, at seeing me here!
منظورم ای نه که حداقل باید سعیمون رو بکنیم	I mean, we have to at least try
همین که ناله پدر را شنید آهی عمیق کشیده به خود گفت که هنوز تغییری روی نداده است.	, hearing him groan, said to herself with a sigh that things were still the same.
البته در آن موقع من با زندگی شکوهمندانه و مجلل چندان آشنا نبودم.	but then I was so little accustomed to grandeur.
که مرا بزرگ خانه خودم ندانند و مرا مستولی و غالب بر تو نشمارند.	who has not treated me as the master of the house,
اما عاقبت دامن قبای مرا که از ابریشم آن کشور ساخته شده بود و بسیار ضخیم و محکم بود گرفت و بیرون کشید.	he at length seized the lappet of my coat which being made of that country silk, was very thick and strong, and dragged me out.
هرکس چنین تصمیمی بگیرد از طرف نوانخانه پنج پوند به او داده خواهد شد.	that five pounds would be paid to anybody who would take possession of him.
با خود دو ظرف که یکی پر از شیر و دیگری پر از آب بود برداشتم.	took with me two vessels, one filled with milk and the other with water.
فکر کردم ممکنه صورت جدیدت رو کامل کنه و همین طور هم به نظر میاد	I thought it might complement your new face, and so it does.
البته هری هم حق نداشت در این باره چیزی بپرسد.	of course he was forbidden to ask questions.
در آن لحظه دخترک به زحمت توانست که به دنبال او ندود و با زور مانع از رفتنش نشود.	for the moment it was all she could do to keep from following him and by sheer force, if need be, restrain him.
مامانم هم رفته سر خیابون که به رام چوب دستی پیدا کنه.	mother's up the street looking at wands
هر شش ماه باید آزمایش بدهم تا ببینم سالم هستم یا نه	I have to take a drug test every six months just to make sure I'm clean
اما این اختلاف چهره که او با من داشت در همه اقوام وحشی تعمیم دارد	but these differences are common to all savage nations
کاری کردند که پهلوان مغلوب به صورت دوست عزیز من سام سون کاراسکوی دانشجو جلوه گر شود	arranged that the vanquished knight should display the countenance of my friend the bachelor
که مردم خشن و بی ترتیب اینجا میل ندارند بانوی من از ملک خود خارج شود	that the rude peasants here don't wish to let the mistress leave the estate
خشخش سورتمه های باریک یخشکن و زنگ صداهای شاد مردم به گوش میرسید.	the rumble of the sliding sledges, and the sounds of merry voices.
باد و بوران در تمام طول شب ادامه داشت.	the whirling storm continued all night.
پس به جای آن که سر در پی او گذارند و تعقیبش کنند	for which reason, instead of being followed and persecuted,
چنین کاری در آن خلنگ زار متروک برایش دشوار بود.	it would puzzle him to do so upon the lonely moor.
به نظرم یکی از بهتر تحات محافل سطح بالاست.	I consider it as one of the first refinements of polished society.
ثروت خود را فقط باید از راه کار خود بدست بیاورم.	I will owe my fortune to nothing but my own exertions.
فضا پر از صدای ناآرام موتورهایی بود که بیهوده روشن بودند.	the air was full of the impatient sound of idling engines.
همه می گن اون با یه مرده هیچ فرقی ندا ره.	they say he's half dead.
چون نسبت به تکالیف مذهبی هر کس احترام بسیار قایل هستم و لو اینکه آن تکالیف بسیار مضحک باشند	for I cherish the greatest respect towards everybody's religious obligations, never mind how comical
با یک نظر علمی به بررسی هیکل او از پشت پرداختم.	I got a kind of scientific kick out of studying her back view.
این به واسطه پارگی و پینه خوردگی پارچه اصلی بود که مدت چهار سال در دریا دوام آورده بود	so torn and bepatched the raiment that had survived nearly four years of cruising.
آیا خجالت نکشیدید مرده را هم در قبرش ناراحت ساختید!	were you not ashamed to disturb the dead?
در هر حال و به هر قیمت برای پیشگیری به نحوی از قایق به جایی پرتاب کرد	at all events, be anticipatingly tossed out of the boat
رویم را برگرداندم و دیدم او تنها در آستانة باغ ایستاد و نوزاد را روی دست بلند کرده است.	I looked out, and she stood at the garden gate alone, holding her baby up in her arms for me to see.
دنبال دسته خود دوید و با یک جست آهنگ پای خود را درست کرد و خشمناک به اطراف نگریست.	ran to catch up his line and, falling into step with a hop, looked back angrily
تا مبادا راه خود را گم کرده به دست دشمن بیفتد.	that he may not make a mistake and fall into the enemy's hands.
دهانش را پاک کرد و به او نگاهی کرد	wipes his mouth and looks at her.
واقعا چیزی از آن احساسات که گریبان گیر استروو شده بود به من رسید.	I really felt something of the emotion that had caught him.
به مناظر بی شماری پیوست که ارلاندو تاکنون دیده بود	attaching itself to the innumerable sights she had been receiving
گویی روحش در جست و خیز بود تا هرچه زودتر از قالب تن مفارقت کند.	as if the soul were struggling to free itself.
ولی برای این کار به گواهی شما احتیاج دارم.	but I'll need your testimony.
اما لازم نیست که حتما این کار را بکنی.	but you don't need to.
گفتی تمام بدن لاغر و باریک اما محکمش همچون ساقهٔ متمایل به سمت آفتاب به جلو میگرائید.	his whole body, lean and slender, but powerful, seemed to strive upward, like the stalk of a plant toward the sun.
در اولین فرصت به سمت راست تغییر مسیر بدهد.	go right again as soon as possible.
کمی که گذشت تمام صداها در دادگاه بند آمده بود	in a little while every sound ceased
بگذارید آن عشق دیرین به جای من با شما حرف بزند.	let your old love speak for me!
اجازه یافته است تا وجود داشته باشد یک معجزه بود	had been allowed to exist, was a miracle.
هرگز نخواهند توانست از من چنین اقراری بگیرند که این چیزی است غیر از لگن ریش تراشی و آن چیزی است غیر از پالان خر.	will not make me believe that this is not a barber's basin and that a jackass's pack saddle.
قول دادند که فردای آن شب به آنجا بازگردند.	promising to return the next morning.
فردا هوا بسیار توفانی و برای او نامساعد خواهد بود	it would be too rough for her tomorrow.
نها دو انگشت خود را به لبهٔ کاسکت برد	thrust two fingers under the peak of his cap
چون تعداد کشتگان جنگ خارج از حد و حساب است	that the dead cannot be numbered
وقتی سخن گفت چیزی بی رحم و موحش در صدایش بود.	when he spoke there was suave brutality in his voice.
زیرا فضیلت چندان که مورد بغض بدکاران است مورد مهر نیکان نیست.	for virtue is more persecuted by the wicked than loved by the good.
از جمله بنویس که خود در قفس را به روی شیر گشودی	to wit, that thou didst open for the lion
دریافت که از ساعتی پیش هوای صبحگاهی مه آلود تر شده است.	she saw that the morning had become more foggy there during the last hour.
وقت خودش من هم مثل تو بودم یه ولگرد بودم غیر از هرزگی و خوشگذرونی فکری نداشتم	I was a squirt jus' like you, a fartin' aroun' like a dog wolf.
بر اثر پافشاری بولست رود به هیئت مدیره بیمارستان پیوسته بود	had lately allowed himself to be put on the board of directors in his turn
خانه چون مکعبی از چوب تراشیده بود و انبار گندم به زیر سنگینی بام کوتاهش شکاف برداشته بود.	a square little box, unpainted and bare, and the barn, low roofed and huddled.
واسه این نیم تنه حاضرم از هر چیزی بگذرم!	what wouldnt I give for a coat like that!
از طریق قیاس علت این وضع خاص زندگی دریایی را که ذکر شد در خواهید یافت.	by inference, you will derive the cause of that peculiarity of sea life just mentioned.
فکر کردم شما هم با هم گرم صحبت هستید.	I thought you'd be all right together.
سپس معتقد شده بودم که برعکس خودداری از رفتن به آنجا و عدم دیدار لینتون کاری اشتباه و غیرعاقلانه است.	now it seemed wrong to refrain.
یا اگر هم خوشگل با شن آدم جرئت نمی کنه. باهاشون رلفیق به شه.	he was not interested or with whom he did not dare to develop a friendship.
بنابراین نگاهی کج کی به او انداخت و چیزی نگفت.	she gave him a startled sidelong glance and said nothing.
خاصه از آن رو که ورانسکی در یک لحظه بی خودی بر زبان آورده بود	especially as he had unwarily told her, in a moment of frankness,
زیرا فقط در این موقع دوستی و آشنایی ارزشمند است.	because only then does one get satisfaction from acquaintances.
ماکزیم به من ننوشته بود که با زن هنرمندی آشنا شده است.	I did not know you were an artist.
از راه لطف و احسان از کشیش تقاضا کرد که به وی اجازه دهد تا برود و از یاران دیوانه خود خداحافظی کند.	entreated the chaplain to permit him in charity to go and take leave of his comrades the madmen.
بی آن که دیگر توجهی به وی داشته باشد	without paying any more attention to him.
سر تا ماس فانی را سپاسگزار خود کرده بود.	he left her in a glow of gratitude.
لیکن بهر حال پاهای او از رکاب بدر آمد	the same time, however, he slipped his feet out of the stirrups and
من هرچه زودتر و بیشتر به پول نیاز دارم.	I am badly in need of money.
آنگاه سرش را جا انداخت و تنش را با دست راست کرد.	she had pushed the head back and molded the body with her hands.
سرانجام گفت که البته آن دختر بینوا را دیده است	at last he said that he had indeed seen the unhappy maiden
بیش از آنکه معصومیت یا ناآگاهی را توجیه کند.	too much so to preserve innocence or unawareness.
آنا از او راجع به حالش و کارهایش سؤال کرد و کوشید او را تشویق به گرفتن مرخصی و استراحت در ییلاق کند.	she questioned him about his health and what he had been doing, and tried to persuade him to take a rest and come out to her.
ولی آن را کاملاً و با دقت حفظ کرده بود.	but she had kept it safe
در انتهای حیاط سنگفرش هم خود کارخانه قرار داشت.	another section at the rear of a paved patio, where the factory had been located
من اینکار را از طرف پدر مرحومم که برای شما ارباب خوبی بود	I do it in the name of my dead father, who was a good master to you
مادرش به او گفت که بگذارد به کارش برسد.	she bade him be quiet, and to let her go on with her work.
اما مثل اینکه آشپز جدید هم چندان بد نیست.	but the standard of cooking remains the same.
وقتی این یادداشت تنظیم شد آن را به حضرت اشرف تقدیم کن!	then give it to his excellency.
با لباسهای نو و چهره های تابناک پای پله ی کالسکه در انتظار مادر خود ایستاده بودند.	the children in their new dresses, with beaming faces stood on the step before the carriage waiting for their mother.
من جامه دان کوچکی برداشته و مقداری اسباب و لوازم از نظر احتیاط همراه برداشتم.	I began putting things methodically in my suitcase.
دخترها خیال ازدواج ندارن. مردی هم نیست که به یاد او نارو به گیره.	none of her girls are married or got any prospects of catching husbands in this county
ضمن عبور از برابر پیشخوان دستور داد چیزی آشامیدنی برایش بیاورند	ordering something to drink, as he passed the bar
گسترش آن در جناح راست بیش از اندازه است. نه!	the right flank too extended, he went on.
زیرا فشار احساسات بیش از حد تحمل او بود.	because the stress of his feeling was more than he could bear.
البته لازم به تذکر نیست که شخص اخیرالذکر باخته بود و تا یک شاهی آخر پولش را از دست داده	which it is scarcely necessary to say the latter gentleman lost, and with it, his fifteenth and last sixpence
صدایی در عالم رؤیا در گوشش چیزی زمزمه کرد	murmuring something back into her dream
گویی با پیراهن توری حاشیه دوزی و زلفی دراز آراسته به یک گلسرخ و دو برگ کوچک زاده شده است.	as though she had been born in that tulle and lace, with her hair done up high on her head, and a rose and two leaves on the top of it.
که خواه به شوخی به کار گرفته شود خواه به جد و خواه به خشم و خواه در هر حال دیگر که باشد	that whether wielded in sport, or in earnest, or in anger, whatever be the mood it be in
زیرا اگر پدرم از این ماجرا با خبر شود فوراً مرا در چاهی خواهد انداخت و همان جا سنگسارم خواهد کرد.	because if my father knew it he would at once fling me down a well and cover me with stones.
هر گاه این بذر در روح روستائی افتد نخواهد مرد	drop it into the heart of the peasant and it won't die
پنج فرانک! من که شاخ درآوردم! پنج گو له!	five francs! the deuce, I should think so! five balls!
بلکه چون بار گرانی در دلش عقده شده است	weighed on his heart and poisoned
این بود که راه دهکده درست در سمت مقابل راهی بود که گدای کور در آن از چشم من ناپدید شده بود	it was in an opposite direction from that whence the blind man had made his appearance
پاها را زیر خود جمع کرده بود و سرش در کاسه توالت خم شده بود.	her legs folded under her, her head still hanging weakly over the bowl.
مطمئنم دیشب با اون همه خر و پف درست نخوابیده .	I'm sure she didn't sleep soundly last night, what with all the snoring.
پس دوربین دو چشمی برداشته و مشغول تماشا به سمت دیگر گردید.	he sat down, drew out his opera glass, and looked another way
این مسئول به نگهبانان گفت تا دروازه را بگشایند.	directed the guard to open the barrier.
ولی چون فرمودید که جادوگران موجب آزار و اذیت شما هستند	but as you say enchanters persecute you
یک زن چهارشانه جوان با صورتی که از خشم سرخ شده بود.	a heavyset young woman with a face made blotchy by rage.
که اگر دختری چون سوندرا به او دل ببازد	since she had troubled to recall herself to him
گاه نثر را آزموده بود و گاه درام را.	sometimes she had tried prose and sometimes she had tried drama.
دو خانم ما به هر زحمتی که بود با سقلمه راهشان را باز کردند.	the two ladies squeezed in as well as they could.
از صف بیرون آمده به فرمانده کل نزدیک شد و خبردار ایستاد.	stepped forward from the ranks, went up to the commander in chief, and presented arms.
در همان روز در ساعت دو بعدازظهر به آنجا رسیدم	I arrived the same day at two in the afternoon
با این همه مثل این بود که اصرار دارد راهش را از راه گذران نپرسد.	but he seemed bent upon not asking the way of the passers by.
نهً نرم و براق است سری که به شکل گلوله.	not something long and sleek and streamlined, furry and bullet shaped.
آنگاه از زیرکی و کاردانی شاگرد خود به وجد و نشاط درآمد.	chuckled with delight at his pupil's proficiency.
آنگاه انگشت خود را با وضعی خیلی رسمی به سوی ژاندارم گرفت	shaking his forefinger with great solemnity of manner
در اتاق مجللی از عاج پشت ارگ نشسته بود	sitting at the spinet in a huge ivory room
مطمئن نبودم چطور تغ یی رمی کنی و وقتی جادوت به کار بی فته چه کاری انجاممی دی.	I wasn't sure how you'd change, what the magic would do when it surfaced.
زیرا گناه او چنانکه گفتیم قبل از هوس ارتکاب آن برملا شد.	for, as I have already said, her misconduct was known before her passion.
زیرا آن دو روزی را که در ییلاق با وی گذرانده بود کسل کننده یافته بود	for he had found his two days with her in the country somewhat tedious
کیسه های مواد منفجره را بین پانزده نفر از افراد توزیع و شروع به کار کردیم.	I served out the explosives to the fifteen porters, and we started.
که تمثال پوشیده از خزه اسقفی قدیس با تاج اسقفی از آن محافظت میکرد تمثالی که در کمال تواضع رسوایی شکستگی بینیاش را تحمل میکرد و دستان زیبای سنگی اش روی سینه اش در هم قفل شده بود.	guarded by a moss stained effigy of some saintly bishop, mitred and staffed, and bearing the indignity of a broken nose meekly, with his fine stone hands crossed on his breast.
بلکه به خاطر ترس از این که مبادا کسی به راز او پی برده باشد.	but because of his overwhelming astonishment that anyone knew his secret.
شب کلاهی کوچک و سرخ رنگ و روغنی بر سر داشت که متعلق به میزبان بود	on his head he had a little greasy red cap that belonged to the host
گری گوری بارانی خیس خود راکنار بخاری آویزان کرد	. regor hung his wet raincoat to dry on the stove
روی گاری جز یک صفحة آهنی چیزی نبود که بر روی دو چرخ قرار گرفته بود.	which was nothing but a large wooden tray on wheels
دو برگ کاغذ پستی سراسر با خط ریز پر شده بود.	two large sheets of note paper were covered with very small handwriting.
بلکه حواس و فکر من کام لا جای دیگر بود.	I think I began to muse about something altogether different.
