چشمانش به دیوار سفید مقابل خیره مانده بود و حکایت از آن داشت که افکار آرام او در اثر یک خبر غیر عادی پریشان شده باشد.	her eyes, fixed on the blank wall opposite, expressed the surprise of a quiet mind stirred by unwonted tidings.
معتقد بود که از این برتری باید بهره بگیرد.	should of course profit by that notion.
تا هنگامی که به کلی خالی نشود آن را کنار نخواهم گذاشت.	I would not turn away from it till I had drained it!
آنقدر زیبا که آدمی بیم دارد درست شما را نگاه کند.	so beautiful that one is afraid to look at you.
در را نخواهم بست و به انتظارت خواهم بود.	leave the door open for you.
زیرا تمام دستورها صادر و حتی اینک اجرا شده بود.	for the orders had all been given and were now being executed.
پس همان نیمکت اولی را از جهت طولی رو به تنها قسمت دیوار که چیزی به آن نیاویخته بود گذاردم	I then placed the first bench lengthwise along the only clear space against the wall
او یک شب خوابیده بود و من در کنارش نشسته بودم.	I was sitting by him one night
آنگاه دو تن از یاران خود را در جلو مدخل دیر به پاسداری گماشت	he left two to guard the gate
که تقریبا یک صد هزار فرانک برای من صرف کردید	who placed at my disposal 100,000 francs
در چنین موقعی که غروب خورشید با مهتاب متقارن شده اصلاً نباید به فکر خوابیدن افتاد.	surely no one can wish to go to bed while sunset is thus at meeting with moonrise.
همان است که کار بسیار مهم و سختی بود	it was a very serious charge
چون من در وضعی نبودم که از چیزی برنجم	as I was not in a condition to resent injuries
منتها خانم گریفیث حاضر نبود چنین حقیقتی را تصدیق کند.	only she would never have been willing to admit that.
چوبدستیش را دوباره در ردایش گذاشت و به اطرافش نگاه کرد.	slipped his wand back inside his robes, and looked around, listening again.
تنها در بند این باشد که به خاطر کسب شهرت و افتخاری جاوید آن حوادث را حسن ختام بخشد.	bent on bringing them to a happy and successful issue, all to win a glorious and lasting renown.
آرزو میکرد ای کاش در همین لحظه میمرد و با مرگش همه چیز برای ابد به پایان میرسید.	wishing that he had died, and that everything would end forever at that moment.
از طرف من مطمئن باشید که این راز را ابداً به کسی نخواهم گفت و برای همیشه نزد من مکتوم خواهد ماند.	I won't say a word to anyone.
با من این طور برخورد کند و به من هیچ گونه محبتی نشان ندهد.	to give me such a greeting, and show me no affection.
فقط باید دعا کنم که اوضاع خوب پیش برود.	I'll just have to cross my fingers and hope for the best.
از این که این حرف را زدم همیشه خوشحالم.	I've always been glad I said that.
ذوب نماید و با آن برای کودکی که گذاشته بود از سرما یخ ببندد یک تابوت طلا بسازد	he had better melt it down and make a golden coffin out of it for his starved child
اما آیا ایپولیت به تو نگفته است که چگونه دلش از اشتیاق و علاقه به شاهزاده خانم عزیز ما شکسته است و چگونه شاهزاده خانم او را از خانه خود بیرون کرده است.	didn't he tell you how he himself was pining for the dear princess, and how she showed him the door?
همه از عالی و دانی از لحاظ سود نه به مزدهای ثابت است	all of whom, high or low, depend for their profits, not upon fixed wages
هر لرزش متناوب آن در حقیقت به همان اشتغال دارد	its every alternating vibration, indeed, only tending to that
من او را پنج دقیقه پشت در نگاه خواهم داشت.	I'll keep him out five minutes
که روی آن یک بطری آب معدنی سلتزر و یک تنگ براندی قرار داشت و تعادل میز را بر هم زد.	on which there was standing the seltzer water and the decanter of brandy, and almost upset it.
از روی جزیره سر از میان امواج دریا بیرون آورده است	since the island arose out of the seas.
قربان فکر کردم دندان اسب پیشکشی را نمی شمارند.	I thought I was not to look a gift horse in the mouth, sir.
منتها تا مجبور نشوم دیگر میل ندارم در هتل کار کنم.	though I don'twant to go back in the hotel business either if I can help it.
در ابتدای این قصه که او را دیدیم سی و شش سال داشت امروز قدم به پنجاه نهاده	who in his thirty sixth year at the opening of this history was now in his fiftieth
وقتی همه در تالار گرد آمدند کشیش دیر را بدرون آوردند	all being assembled in the hall, the priest of the parish came in
اما باز هم فرمان داد که طاغیان فوری به سر کار خود باز گردند.	but still commanded the insurgents instantly to return to their duty.
مغز هامون بیشتر از قبل با هم در ارتباط بودن. چون هردو سعی داشتیم مثل هم فکر کنیم.	our minds were more closely linked than they had ever been before, because we both were trying to think together.
امروز صبح دو تا گنجشک دیدم که زد و خورد می کردن.	this morning I came across two sparrows fighting
سرانجام نسبت به طبع بشری معرفتی شایان حاصل کرد	he at last arrived at a competent knowledge of what human nature
ولی هرگز رسماً و قانوناً او را به فرزندی نشناخت	he never recognized him as his son before the law
صدای بیرحمانة تق و تق پاهای دمپایی پوش بدون بدن به گوش رسید.	came the relentless slipslap of disembodied feet in slippers.
اما در چنین وقتی این کوشش فوق استطاعت او بود.	but this simple operation upon the most delicate organs of our frame
هری برای این که از او عقب نیفتد مجبور بود بدود.	he had to jog to keep up.
اما ترس از آینده مجهول در دل باک خانه گرفته بود	but the fear of the future was strong upon him
بعدها دکتر گتر خوش را در کهنه فروشی یافت و تنها کسی بود که آن را نشناخت و به آن نظری حاکی از تمجید فراوان انداخت و آن را از گتر سابق خویش بهتر یافت.	where such things were taken in exchange for gin, was more than once observed to handle them approvingly, as if admiring some curious novelty in the pattern, and considering them an improvement on his own.
یک اتاق غذا خوری مخصوص ساکنان و دو ااق خواب دارای حمام بود.	, a dining room where the boarders ate, and two bedrooms with bathrooms.
اون بهتون می گه در فلان ساعت برین فلان جا و بعد می ره	he'll tell you where to go, an' what time, an' then he'll go on.
چون اکنون که عضو جامعه شده است توجه دارد که بر ضد چنین شخصی عاجزو زبون است.	for, a member of society now, he realises accurately enough that against him he is powerless.
نگاهی به میز خود انداخت و پاکت مربع شکل نازک محتوی تلگرام را برداشت و به آنا داد.	glancing into his room, he took out and gave her the thin square envelope of a telegram.
این موضوع حسی را در او بیدار نکرده بود	although it in no way disquieted her
بعد از آن رفت به طرف کتابخانه و غایب شد	then he disappeared
اگر خود را در معبر او بگذاری و با او ترک ملاعبه ننمایی.	if you attempt to intercept their movements.
او هم در میان خندیدن بلندش پاسخ داد که برای مردان برازنده نیست که خرافاتی باشند.	she replied amid loud laughter that she did not think it was right for men to be superstitious.
به چه دلیل نبرد نهایی عمر خود را چنین به سرعت و ناتمام واگذاشته است.	had left the final battle of his life unfinished.
گاه ناجوذر و گاه به قوت و گاه بی قوت و به واسطه اختلافی که در ضربه آخر بود	sometimes hitting the woof slantingly, or crookedly, or strongly, or weakly
حالم از این زالوهای بوگندو به هم می خوره	I'm sick of all these reeking bloodsuckers.
این بود که به جای این که دل او را نرم کند	so, instead of winning him
لازم نیست در برابر من گریه کنی و خود را غمگین و متأثر نشان دهی.	don't snivel before me.
یک بطری له شده که تا نیمه پر از مایعی شیری رنگ فن یل بود با چترهای شناور سیاه رنگ در آن.	a squash bottle half full of a milky liquid phenyl with floaty black things in it
از زمانی که او یک سرباز در جوانیش بوده است	from having been a soldier in his youth
شام سبکی در زمین بازی دبستان محلی به همراه ۶ آبجو خورد.	inside he took a six pack of beer from the dead cooler.
به یاد آورد که یک آشنای نزدیک و گرامی وی در آن سر میز نشسته بود.	someone near and dear to him sat at the end of the table.
ولی کیفیت خاص خود را از زمان کودکی تا کنون حفظ کرده بود .	but the expression in them had not altered since the days of her unworried girlhood.
من نومید شده بودم که هم گنج را از دست بدهم	I was about desperate to lose that much blunt
ارباب دست فرزند را گرفت و وی را بر آن داشت تا با آن مرا آهسته نوازش کند.	which my master took, and made him stroke me gently with it.
از تأثیر آن تنها در طول یک روز یازده بار در لگن خودشان رفع حاجت کردند	they sat down at the same time on their pots eleven times in a single day
ما به پشتی تخت تکیه داده چهار زانوی خود را جمع کرده دو بینی خود را روی زانوان خود خم کرده بودیم	leaning against the head board with our four knees drawn up close together
او میل داشت با وضع آن خانه آشنا شود	he wanted to know it
شوهر بار دیگر طفولیت خود را که فرزندانش از او ربوده بودند به دست آورده بود.	because he had returned to the childhood his children had taken away from him.
مگر در آنچه نداشتنش مایه زیان من است یعنی در قدرت و سرعت و کار و کوشش	except where it was to my real disadvantage in point of strength, speed, and activity
برای اینکه به او کمک کنم اثر بزرگش را بنویسد	I might help him the better in his great works.
اما پس از فروش نخواست پول آن را با رفقا قسمت کند.	but would not share the spoil with his companion.
نخواهد توانست در پیرامون هیچ مرد دیگری قصرهای خیالی بسازد	that no other man could be the occasion of such delightful aerial building
فکر کردند بهترین کار برایش این است که برود بخوابد.	, and sleep seeming to be her likeliest friend,
تن و اندام او متناسب و موزون و حرکات او متین و رفتارش شاهانه است.	his body and limbs well proportioned, all his motions graceful, and his deportment majestic.
ولی اگر جلف از خود راضی وراجی بود زیاد برایش وقت نخواهم گذاشت و زیاد هم به او فکر نخواهم کرد.	but if he is only a chattering coxcomb, he will not occupy much of my time or thoughts.
چون تبریزی بلندی که جای خوابشان را پناه داده بود حالا افتاده بود.	because the great sycamore, the shelter of their beds, was a ruin now
که کنار پیشخوان طویل تالار بزرگ مرمری ایستاده بودند	who were standing nervously at the counter that ran all along the great marble hall
بار دیگر شما نیز ابتکار جدیدی به خرج دادید و نقشه آنان را نقش بر آب ساختید!	then you thought of another plan and hoodwinked them once again.
در همه عالم نه یک تن پروای مرا دارد و نه من پروای کسی را.	I care for no man on earth, no man on earth cares for me.
ولی در عین حال من خوش بین بودم و امید داشتم همان وضع مورد دلخواهمان عملی شود. زیرا در آن صورت من میتوانستم سر خانه و زندگی و کار خود باشم	yet I did hope, and began to cheer up under the prospect of retaining my home and my employment
سعی کردم یک بار دیگر او را ترغیب کنم.	I gave persuasion another try.
تازه آن وقت بود که انگار باکسر صدای جارو جنجال را شنیده باشد	just at this moment, as though he had heard the uproar outside
در حالی که با دریافت تنها هزار دلار هم حاضر به سپاسگزاری بود.	the while his hope would be immutably fixed upon a gratuity, at any rate, of no less than a thousand.
خود با مهربانی دست در بازوی او انداخت تا همراهیش کند.	put his hand beneath her elbow courteously to guide her
ولی امیدوارم شما هم به این اخبار توجه نشان بدهید.	but I hope you mean to take an interest in this news.
کنیزک را فراخواند تا موش مرده را با انبر بردارد	calling the maid to take up the dead rat with a pair of tongs
در همین لحظه چهار تا دستمال از جیبش بیرون کشید.	at the same time producing four pocket handkerchiefs.
من پرش زودتری انجام دادم تا از قدرت جدیدم برای شکست او استفاده کنم.	I took a chance and made my leap early, trying to use my extra strength to win.
اما مرا ترجیح داده و مرا طرف معامله قرار داده	he has given me the preference
در عین حال اطمینان داشتم که اثر الکل هنوز مانع از این بود که بتواند تصمیم فوری و قطعی بگیرد.	he was still not sober enough to carry it through.
در واقع آن رفیق به من گفت که پدرش تمام ثروت خود را مابین سه پسری که داشت تقسیم کرد	for he said his father had divided his property among his three sons
تراکتورها از راه رسیدند و در کشتزارها رخنه کردند.	THE TRACTORS came over the roads and into the fields
دو لحاف به روی او انداخت و خود برایش عرق بیدمشک آورد	covered her with two quilts, and herself brought her some lime flower water
اقدامات ضروری رو به انجام بر سونی ممکنه بتونیم این وضعیتو حفظ کنیم.	take the necessary measures, we may still be able to save the situation.
من این همه را بدین سبب گفتم که اگر اشتباه نکنم	I say this because, if I mistake not
بدتر آنکه صدای آهن و زنجیر همچنان بلند بود	more especially as they perceived that the strokes did not cease
اگر بخواهیم امور خطیر را با جزیی مقایسه کنیم	to compare great things with small
اما به هر حال جای هدر دادن یک لحظه هم نیست.	I don't know, but let it not be a minute later!
که جزئیات آن را کام لا به یاد ندارم.	I don't remember everything as it happened.
تفنگ را برگردانیده لولهٔ آن را گرفت و آن را همچون چماقی تاب داد.	reversed the gun, gripped it by the barrel, and swung it clubwise.
هر چیز دیگر را که دستشان بود به زمین انداختند.	dumped their other traps on the ground
در دو قدمی اطاق خانم اپانتچین شاهزاده ناگهان توقف کرد	but when he was two rooms distant from the drawing room, where they all were, he stopped
با این کار ممکن است دشمن از حضورمان با خبر بشود.	it might tip off our enemies.
من او را ترک کردم و به بازی پرداختم.	I went out then and ran to play.
زیرا من فریاد نزدم و فریاد زدن را دون شأن خود دانستم .	for I thought it below me to cry out.
ما همه از قراری که پس از تفکر بسیار در جلسات مشورتی خود با هم گذاشته بودیم نکته به نکته پیروی کردیم	all following out the arrangement and plan which, after careful consideration and many a long discussion, we had decided upon
بلکه بیشتر به فکر خود و قبولاندن توضیح نیم بند خود است تا به فکر او.	he was more concerned about himself and his own partially explained defection than he was about her.
وقتی زمستان بی بهار از راه برسد بهاری که شاید آمدنش را هرگز نبینم.	when winter comes without a spring that I shall ever see.
خیلی مختصر و رسمی عذرخواهی کرد که زودتر سر نزده.	she made a slight, formal apology, for not calling before,
صبر داشته باش! پیروزی خود را به آسانی خراب نکن.	don't be too certain of your triumph.
اما ممکنست در خلوت زن پرحرفی هم بوده باشد.	but it may be that in private she had a copious conversation.
سعی کردم بهش علامت بدم ولی لیا اصلاً منو ندید.	I gave her a warning glance she didn't see.
خودش پذیرفته بود و اجازه داده بود که با او همین طور حرف بزنم!	of her own accord she had allowed me to tell her as much .
خود من فکر خواهم کرد تا این گرهی را که در کار تو افتاده است و باعث آن شوهرت بوده است باز کنم.	I shall find my wits and unravel this skein of your husband's winding.
چنین قیاس گرفتم که باید مرد شوربختی را در آن گودال افکنده باشند.	concluded that some unhappy man must be shut up in the cavity.
تا دو ساعت دیگر آن قصه چندین بار گفته شد.	the story had to be told and retold for a couple of hours more.
که در آن زمان هفتاد و دو سال داشت	who at that time was seventy two years old
اما امشب به هیچ وجه اثری در او نکرد.	, but this evening he took no notice of theM
این از دنبال کردن وال در دریای آرام بدتر است.	this is worse than pulling after whales in a calm
در حالی که غرور و کبری که داشت او را وادار بر مقاومت کرد.	striving to struggle against this triple force and his own emotion
که بانوی فرمانروای مطلق زندگیم فرشته نجات بخش یا هلاک کننده با ظاهری متواضع در آن نقطه منتظرست.	my genius for good or evil waited there in humble guise.
کم کم راز این سرزمین جادوئی را بر او آشکار ساخت.	little by little delivered up to him the secret of the enchanted land.
وضع کلی تا در نظر والانتین تغییر کرده بود.	, and certainly it was less difficult now for her to believe
مردم به آن اوضاع و شرایط جدید عادت خواهند کرد	which will seem quite ordinary to others
اما عنصر اصلی سرنوشتش و اساس ضروری سیاستش نبود.	but was no longer the principal element of her destiny, and the necessary base of her politics.
سیگار برگی آتش زد و چشم انتظار آن بود که کسی پیدا شود و او را سرگرم کند و از فکر و خیال نجاتش دهد.	lighting a cigarand looking for some one who would come and play with him and save himfrom thinking.
همین که وی را نقش بر زمین دید بانگ بر کوبنده زد تا دیگر چماق خود را بلند نکند	seeing him fall, cried out to his assailant not to strike him again
دیروز من به کلی با او به هم زدم و بسیار متأسفم که چرا زودتر اینکار را نکردم شاهزاده!	I broke with him last night, and am very sorry that I did not do so before.
چند روز قبل از این تاریخ اتفاق افتاده است.	occurred a few days before that date.
هر یک ضمن شرح واقعه در وصف عرعر کردن همکار خود داد فصاحت دادند.	each crying up the other's perfection in braying.
پس شانه را بالا انداخته به اتاق خود رفت.	then shrugging his shoulders went to the door that led to his own apartments.
باز مؤدبانه از من دعوت کرد که به بستر بروم	again politely motioned me to get into bed
مأیوسانه به این زن خپله غر غر و با آن بازوهای پهن برهنه خیره شد و در حیرت بود که اصلا چطور شده که این زن اینجا پیدایش شده.	he stared bleakly at this plump and fussy woman with the broadbare arms, and wondered how she had ever come here.
حالا از شما تقاضا دارم بوی غذای کافی بدهید	I should like you to ply him well with the victuals, my dears
تختخواب بلند مباشر با لحاف چهل تیکه قرار داشت به دهلیز سر کشیدند.	where the steward's high bedstead stood with its patchwork quilt.
من تابه حال هم چه پولی ندیده بودم که به آسانی گیر کسی بیفتد.	I never see money hauled in by the wagon load like that before.
به نظر من بهتر است فقط باید متوجهش کرد که نباید خودش را خسته کند	I think it desirable for him to know nothing more than that he must not overwork himself
هیچ کس جرات نداشت از او بخواهد تمام کار چاپ را از سر بگیرد.	no one had the heart to ask him to redo the whole print order.
مستخدمه بی آنکه رویش را برگرداند پیچ آن را چرخاند.	the waitress, without looking, reached behind her and shut it off.
به قدری که از یک تا ده شمرده بشود	while one might count ten
اما هنگامی که روی تپه و زیر درخت بلوط تنها بود	but directly he was alone on the mound under the oak tree
چهره او بیش از اینکه شبیه قیافه انسانی باشد به حیوانی شباهت داشت که به تور افتاده باشد.	with a countenance more like that of a snared beast than the face of a man.
از هیچ روی نگاه غرض آلود و حسودانه جغدی نبود که به دو کبوتر بنگرد	it was not the least in the world like the scandalized and envious glance of an owl at two turtle doves
اما اگر این گروه را با کار مرد جنگی مقایسه کنند و با هم بسنجند	but, contrasted and compared with what the warrior undergoes
اما کشیش هردو را با عشق و احترام بوسید.	but the priest kissed them with love and respect.
با محبت و لطف تمام چنان نگاهی بر او افکند	looked so kindly and loving in his face
من فقط دارم چیزی رو بهت می گم که خودت هم می دونی	I'm just telling you what you already know.
به دلیل اینکه تو خواستی آمدن خود را از من پنهان داری	well you wished to conceal your journey from me
اما امکان نداشت بتواند تصویر وقایع اطرافش را از ذهن خود پاک کند.	but it was impossible to shut out the vision of what was happening all around her.
گوششان را تیز کنند تا صدای چکیدن آب را بشنوند	listen for dripping wate
من به گلم احترام میذارم و کاری رو انجام می دم که براشون بهترین با شه	I honor my pack. I do what's best for them.
هر چند در یک روز صبح بارانی چنان خیالی داشت.	as he attempted to do one rainy morning
معتقدم پیشنهاد او برای این کار به مورد بوده است.	I believe him to be proposed from unimpeachable motives.
به پوست سفتی که باران روی کشتزارهای ذرت گسترده بود حمله برد.	it worked at the rain crust in the corn fields.
قبل از من چیزی نبودند و بعد از من هم چیزی نخواهند بود	before me they were nothing after me they will be nothing
لابد تقریباً همان لحظه که به اتاق رفته مرده است.	she must have died almost the moment she retired.
