حل شده و تردید در صحت این تصمیم به مثابه ابراز حماقت و معرف عدم لیاقت برای زندگی در میان اشراف و طبقات ممتازهاست.	to doubt the correctness of that decision would be to risk exposing one's stupidity and incapacity to live in society.
چندین بار نیز مرا مجبور کرد به همراهش تا نزدیک در باغ بروم تا از مسافران استقبال کنیم.	she obliged me, by constant worrying, to walk with her down through the grounds to meet them.
یادم است که در یک شب پول کلانی باخت	I distinctly remember that in a single evening she lost an enormous sum.
به آرامی کنار هم در زیر یک تخته سنگ به خاک سپرده شدند	laid quietly side by side under one slab.
در وسط میزی قرار داشت که به روی آن چند سبد خالی گل گذارده بودند.	there were basket chairs stacked against the wall
اما با یک تکان روی نیمکت نشست و چشمانش را باز کرد.	but all at once he jumped up, sat up on the sofa, and opened his eyes.
همه خوش و خرم و کامیاب به اتاق نشیمن بازگشتیم.	we went down to the drawing room again, well pleased and gratified.
اگر به واسطه آن خصایص که در وال شمردیم و نیز به واسطه صدها رویداد ملازم چنان شغل خطیری است	as well as to the thousand concurring accidents of such an audacious enterprise
انگار میخو است آن را در بدن زن فرو کند.	as if to plunge it into her.
دم دمای آخر دیگر نای حرف زدن هم نداشت.	at the end, almost too weak to speak
بالاخره مردی که دفعه اول ظاهر شده بود قبول کرد که پیغام او را برساند.	the result was that the man who had first appeared undertook its delivery.
محصور شده بین مرز تاریکی و نوری که پیاده رو را در بر داشت.	fenced in by the line between dark and light that stretched across the sidewalk in front of me.
با این عمل یکی دو تنی را نفله کند.	crush a man or two below.
یا شادی شغالی که به دریدن گاو میش بیماری پرداخته باشد و آن گاو میش آنقدر مرده باشد که از خود دفاع نکند	the joy of a jackal which is beginning to rend a sick bull, so nearly dead that he can no longer defend himself
اما گرگ فقط از گوشه چشم نگاه سریعی به او انداخت	but the wolf turned its head to face her
تصور کردم که در لحن کلامش اندک اثری از کلافگی بود.	I fancied there was in his tone a slight note of exasperation.
شاید به این دلیل بود که مرا نشناخت یا مقصود مرا نفهمید.	I don't think she knew who I was.
قبل از اینکه شما بتوانید سالن را طی کنید و خود را به من برسانید	before you can come across the room to get it.
ظرف بزرگی پر از خوراک قلوه و جگر کپک زده	there was a great maggoty haggis
زیرا بی رحمیش خبر داشت ولی باز هم او را نگه داشته بود.	, for she had kept him in charge after learning of his brutalities.
که مرگ وارد آن خانه شده و منسوباتش را گرفتار کرده است	that death had suddenly and unexpectedly entered that house
شکی نیست که باید حمله از راه دریا صورت گرفته ومستقیما از دریا بر خود کاخ وارد آید.	there is no doubt the attack must be from the sea, and launched directly from the sea at the palace itself.
من اجازه نمی دم بیشتر از این برای بچه تعریف کنی.	I forbid you to tell the boy anything!
ناگهان به طور مطبوع و انامطبوعی بر وی چیره ساخت	suddenly affected her both agreeably and disagreeably
در واقع در بین این گروه به حرف مادرش اعتقاد نداشت.	she did not feel that way here.
نژاد آن بومیان به خباثت و زرنگی شهرت دارد	a race notorious for a certain diabolism of subtilty
اما چون روح حیوانات خالص نیست توی بدنش ون راحت نبودم.	but I was little better off inside them than as pure spirit
هرمیون بدون آن که حرف دیگری بزند با عجله به سوی خوابگاه دخترها رفت.	she swept off toward the girls' staircase without another word.
چند نفر دیگر هم هنوز در خرید مردد بودند.	more of the listeners plainly hesitated.
هشت یا ده آهن دوم در آن واحد گرداگرد وال در آب شناور باشند.	eight or ten loose second irons may be simultaneously dangling about him.
به آنان اطمینان داد که جناب دیوان بیگی همان برادر او است.	assuring them that the judge was his brother.
زیرا همان نیرو که از آغاز مرا واداشت تا تو را از آن خود کنم	for the same cause and force that drove me to make you mine
به هیچ قیمتی حاضر نبود با ایشان بدی کند.	no power on earth could have made her do anything to hurt them.
احساس کردم که باید از این هوای بهاری استفاده کنم.	I felt I'd got to get out and have a smell at the spring air
وصف طرز بیان عاری از احساس او در گفتن این جمله از من ساخته نیست.	I cannot describe the extraordinary callousness with which he made this reply.
معنا و مفهومی که باید همچون آب زاید هرز ناپدید شود.	a significance which is to vanish as the waters
دخترک از روی شفقت هم که شده نگاهی به او نینداخت.	who did not even respond with a charitable glance.
قادر نبودم که برای مدتی طولانی او را نزدیک خودم نگه دارم.	I wouldn't be able to stand being close to her for very long.
که مادر کروسیفیکسون طبق آرزوی خودش در تابوتش زیر محراب ما دفن شود.	have decided that MotherCrucifixion shall be buried, according to her wish, in her own coffin,under our altar.
سرانجام دیگر تاب نیاورد و خواست سرکشی آغاز کند.	finally he could stand it no more, and tried to revolt against it.
دهانش به یکی پاسخ نی گفت و نگاهش بدی گری.	her mouth replied to one, and her glance replied to another.
بلکه واقعیتی است که در حال حاضر وجود دارد.	but an immediate reality.
به خاطر خودش و از فرط غرور و تحریک عصبی بود.	by a diffusion of egotism, of nervous irritation.
همان انحطاطی که در هر عصر و زمان به حق مایه شکایت آدمیان شده است.	so justly complained of in all ages.
دستور داد از مدیر بیمارستان تقاضا شود که از راه لطف تا خانه او آید.	he had the director requested to be so good as to come to his house.
چون هیچ لذتی در کشتن یک حیوان بی احساس وجود ندارد.	there would be no satisfaction in killing a senseless animal.
در ضمن حاضر نبود از دیناری از طلب خود نیز چشم بپوشد.	it was obstinately unwilling to be content with less.
با انگشتم به او اشاره کردم که به من ملحق شود.	I motioned with my finger for her to join me.
بلکه خود گوسفند است. مثل اینکه خیال دارد داخل کلیسا شود و عذر گناه بخواهد و به راه راست هدایت شود.	but mutton half making up his mind to come into the church.
که تو می خو ای با من به مهمونی رقص بهاره بیای	if you would go to the spring dance with me?
حالا اهمیتی ندارد این دیدار چندان هم مهم نبود.	it is no matter I need not recall when.
نه برای اینکه پسری پدرش را به قتل رسانیده است من با این امر موافق نیستم	not better that a son should have killed his father, I don't defend that.
گفت که با کمال میل حاضر است حرکت کند.	said, somewhat hastily, that he was ready.
نشستیم در سکوت مطلق به کشیدن سیگار برگ پرداختیم.	sat smoking cigarettes without making the least sound.
چون به اندازهء کافی گرفتاری جواب دادن به این آقا را داری.	you'll have trouble enough with giving your attention to that gentleman.
طبیعت به من یک قلب خوب و بانشاط ارزانی داشته است.	I have naturally a kind and merry heart.
اما مهارتشان در ین بیش از آنست که نخستین بار دیده و گمان برده بودم.	this with greater dexterity than I could at first imagine.
دو برگ کاغذ را که تا کرده بود به دستش داد.	handed over the sheets of paper, folded small.
پس از اینکه مدتی با صاحب مهمان سرا مشورت کرد	after consulting awhile with the inn keeper
در حالی که باید چند ساعت پیش به خواب رفته باشند.	when they ought to have been asleep hours ago.
دیگران نیز هر یک دلایلی بر دلایل کشیش افزودند	they added to these such other forcible arguments
چند نفری را در راه رضای خدا بکشد من هیچ حرفی ندارم.	kill a few people for charity I have no objection.
فقط فکر کردم شاید بهتر باشد گفت و گویی با هم داشته باشیم.	I just thought we might have a talk.
انتظار داشتیم که به زودی از خط آهن عبور کنیم.	expecting in a little to cross the line.
از ین گذشته من نه تنها از نعمت قوه نطق و بیان برخوردارم	besides I was not only endowed with the faculty of speech
از زنجیر کندی که به چرخ زده بودند آویزان بود.	he swung by the chain of the shoe'the drag.
اما گاهی در مسائل بسیار ساده هم تحملی نداشت.	sometimes a little intolerant of easy going things and people.
که بازوی اولین راننده از جا در رفته بود.	that it had dislocated the shoulder of the first driver.
نیمی از صورتش پشت موهای صاف پنهان بود و نیمی دیگر پشت عینک ته استکانی مروارید نشانش.	half hidden behind lank hair and thick, pearly spectacles.
من با هشتاد و پنج کو پک سسی درست کردم که همگی پسندیدند.	I made them sauce for eighteen pence, and everybody was very much pleased with it.
او با ایشان تندی کرده بود و یا آنان کوشیده بودند او را فریب دهند	some whom he had treated with contumely, and who had tried to cheat him,
خوشحال بودم که از دست آن اندرزگوی پیر خلاص شدم.	glad to quit my gloomy monitress.
در نتیجه وقت برای گشت و گذار من مناسب بود.	so that the time was propitious for my excursion.
کنت و رکاب دارش چند لحظه خاموش گوش فراداده بود	the count and his attendant convinced themselves
فشار این محاکمه خاص بسیاری از کارهای آنان را عقب انداخته بود.	with many matters waiting on account of the pressure of this particular case
ناگهان فکری به ذهنم رسید و بعد هم نتوانستم از این فکر بیرون بیایم.	a suspicion darted into my head, and I have never been able to get it out again.
که برای ابراز خوشبختی خود کسی را بهتر از همسر و خواهر زن سویاژسکی نمیداند	it occurred to him that there was no one to whom he could more suitably speak of his happiness,
از لطف شماست که دوباره آزاد هستم و خوشحال.	I am free and happy once more, thanks to you, she said.
رقاصان حرکاتی چنان عجیب کردند و چندان مهارت و تردستی از خود نشان دادند	with so many turns and so great dexterity
مانعی در این راه به وجود نیاورد از هم امروز او زن من خواهد شد.	offers no impediment, this very day she shall become my wife.
ضم نا بدگمان شده و بیمناک بود که مبادا این مرد به او نا رو بزند.	she suspected and feared that this defendantwould fail her.
از تنفس هوایی که تازه آن زن با عطر خودش آن را تقدیس کرده بود خوشحال بودم.	happy to breathe the air consecrated so lately by her presence.
اما شما حتی در این مورد استثنائی جرئت نکردید مرا بزنید.	but you, even in an exceptional case, did not dare.
منظورم این است که هر چند او از نظر من نامزدی عجیب و بی نقص نبود	I mean, as if he wasn't already the perfect boyfriend
دوقلوها به زور بلوز بافتنی را تن پرسی کردند	as the twins forced the sweater over his head
درخشندگی نشاط انگیز روز پاییزی با خبر پیروزی موافق و سازگار بود.	the cheerful glitter of that autumn day was in keeping with the news of victory which was conveyed
اگه کسی تورو نشناسه فکر می کنه از مهم ون گریزونی.	one would almost think you didn't want visitors.
اما شما حالا یک خان وم جوان هست ین و به یک مستخدم خوب احتیاج دار ین.	but you a young lady now and needs a good maid
ولی در پایان آن با مداد شرحی نوشته شده بود که حاکی از عذرخواهی ایزابلا و تمنای بخشایش و آشتی از جانب وی بود.	but at the bottom was dotted in with pencil an obscure apology, and an entreaty for kind remembrance and reconciliation
سرت را از روی شانهء او برندار تا من بیایم.	don't move your pretty head from his shoulder as you have it now, till you see me again!
سعی کردند به عقب برگردند و خودشان را به میدان کوچک برسانند.	tried to go back to the small square
اما پر آشکار بود که از مرگ وحشت دارد.	but it was clear that he looked upon death with horror.
در آنجا من شمشیرم را که سراپا خون آلود بود به او بنمودم و با دامن قبا خون از آن ستردم و در نیام کردم.	where I showed her my hanger all bloody, and wiping it on the lappet of my coat, returned it to the scabbard.
اگر در حفظ و نگاه داری دارایی خود باهوش بود	had he been as clever in preserving his property
هم اکنون ورود شما را به او اطلاع خواهم داد.	I'll tell him at once
چنان که وقتی هم همین صحبت در میان بود.	as it was once proposed.
امّا تأثیری بر عشقش به او یا بر عشق او به خودش نداشت	but it did not affect his love for her, nor her love for him.
دیگر خورجین بزرگ دریا نوردی که به جای چمدان زمینی حاوی البسه زوبین انداز بود.	also a large seaman's bag, containing the harpooneer's wardrobe, no doubt in lieu of a land trunk.
من هم برای این که به احساسات وی با همان گرمی پاسخ گفته باشم چندین بار همین جمله را تکرار کردم.	I disliked being outdone, so replied with a dozen as solemnly.
متنفرم فکر کنم که تا دههی آینده زیر یه تخته سنگ قایم شده	I'd hate to think of him hiding under a rock for the next decade.
من یقین دارم این بهترین روشی است که باید در برابر تو پیش بگیرم.	this is the best plan to pursue with you, I am certain.
این دفعه که او را از دست داده بود حالت خیلی خطرناکی داشت.	he never was a wild man, but he got dangerous after he lost her.
خوشحالی زایدالوصف خود را با در آغوش گرفتن موجودی خیالی نشان داد.	literally hugged himself for joy.
سرزمینی پهناور متشکل از دشتها و کوه ها و مردمانی رنجور و خاموش که با صبر و تحملی آمیخته به سکون و رکودی رقت انگیز در انتظار آینده بودند.	a great land of plain and mountain and people, suffering and mute, waiting for the future in a pathetic immobility of patience.
در حدود ساعت یک و نیم و به اصطلاح دریانوردان زنگ سه بود	IT was about half past one three bells in the sea phrase that
بیوه ای پرزرق و برق را با املاک و سه پسری که داشت به زنی گرفته بود.	had married a florid widow with property and three boys
تنها نگرانی او از بی تکلیفی و تردیدی بود که در سرنوشتش وجود داشت.	agitated by no stronger feeling than a doubt where to go.
این زندگی کنونی و جهان گذران برایم کافی است.	this present life and passing world suffice to me.
از میان این پرده غبار رقیق و گرم خورشید مربی بود	through the screen of its hot fine particles one could look with naked eye at the sun
دست پیش برد و کشید به طرف راه پله	advancing towards the back staircase
جایی که نه پست وجود داشته باشد و نه تلگراف	where there was no mail and no telegraph
تا آنکه به دو برادر خبر دادم بیمار در حال موت است	until I had told the brothers she was sinking fast
این موضوعی است که دربارهٔ آن من باید اطلاعاتی کسب کنم و با شخصی مشورت نمایم.	I am going to see now if can get good advice about it.
زیرا به نظر خود دن کیشوت آن ماجراها ناشی از حقیقت و خیال هردو بوده است.	for to him they appeared to partake of both.
تا شاید بدین وسیله یکی از دشمنان جادوگر خود را که ممکن است در وجود او نهفته باشد بکشید.	perhaps in him you will kill one of your enemies, the enchanters.
فکر نکنم اگه اتفاق مشابهی پیش به یاد بتونم جلوی خودم رو بگیرم!	I don't think I could restrain myself if I ran into your other friends again.
او مردی قد بلند بود با هیکل لاغر و عضلانی.	he was tall and lean and muscular.
که در آنجا از اندوه و ناله خبری نیست و سراسر شادمانی و آسایش جاودانی است.	reaching at last the place where there is no more sorrow or sighing, but eternal joy and bliss.
من هم به اطاقم رفتم و همچنان که ایستاده بودم از در نیمه باز آن متوجه صدای رفتن او شدم.	I heard him go as I stood at the half open door of my own room, to which I had now withdrawn.
تا وقت یکه کنت به نام همسرش دستور نداد	she brought them until the count himself, in his wife's name
زیرا هر لحظه انتظار داشت طلسمی به بدنش برخورد کند.	feeling their curses following him
از بالای تخته سنگی به زیر افتاده و به پهلوهایش اندک آسیبی رسیده است.	only that he had fallen down from a rock and had his ribs a little bruised.
من تصمیم دارم علاقه و دوستی او را منحصراً معطوف به خود سازم	I'm jealous of monopolising his affection.
به مسافرخانه برگشت و دوباره به دفتر تئاتر رفت.	came back to the inn, returned to the theatre
این کار را در مدت دو سال شعر حفظ کردن کرده بود.	it was the patient work of two years
من درباره مطالب مختلف شرح مختصری بر او بیان کردم	I gave him a short account of some particulars
به داخل رفتم تا برای رفتن به مدرسه لباس عوض کنم.	I went inside to change into fresh clothes for school.
ولی اِما مطمئن بود هریت گلویش پیش کسی گیر نکرده	but she trusted there was no other hold
چون ته دلش تقریباً این پیرزن فلفلی مزاج را دوست داشت.	for in her heart she rather liked the peppery old lady.
اما عزیزان من بد وقتی است و این جزئی تنخواهی که دارم مال من نیست مال دیگری است پس مرا معذور دارید	but times are changed and the little money that remains to me is not my own
من می دونم این گستاخیه که چیزی بخوایم و وقتی شما می خو این در آرامش باش ین مزاحمتون بشیم.	I know it's bold to ask, to disturb you when you wish for peace
اما به نظرش سگ حق نداشت آن را بردارد و ببرد.	but he did not think it was upright in him to carry it off.
بعد از آن که او را به تالار خدمتکاران بردم	having directed him to the servants' hall
بلافاصله یک نفر دیگر دنبال دختر دوید و فرار کرد.	as a boy went rushing after her.
اما انتظار نداشت آن حالت نشاط و شادابی تأثیر گذار را در او ببیند.	but he was still unprepared for the overpowering vitality of the man.
حس کردم مثل یک برنامه کامپیوتری شده بودم که فقط کلمات را گفت.	I felt like a cad just saying the words.
بهتر است تا گردباد به شهر نرسیده سر پناهی برای خودتان پیدا کنید!	better get under cover before the cyclone hits town!
من که نمی دونم چی باید بهش به گم.	I wouldn't know what to say to him.
که این زن که صاحب دلی بس نجیب است	that so noble minded a woman should thus through selfishness
قبلا هم اینو بهت گفته بودم و تو اون قدر نجابت نداشتی که بفهمی .	I told you that once before and you weren't enough of a gentleman to understand.
من نمیدونستم با چه جور آدمهائی میخواد زندگی کنه.	I did the kind of people andall.
بر روی صفحه طلایی ساعت بر روی نه قرار گرفت	pointed to nine on its golden face
صدای شلیک کر کننده تپانچه که همه چیز را در دود باروت مستور ساخت به گوش رسید.	there was a deafening report, and all were enveloped in a cloud of smoke.
تعمدی در کار هست که من در دانستن آن راز با دیگران شریک نباشم.	that from participation in that mystery I was purposely excluded.
که چه بسا انسانی را متهم به کاری کنند که از او سر نزده است	is such that oftentimes a man may be accusedof something that he did not do
ناگهان به نظرش آمده بود که گویی قبلاً آن را حدس زدهاست.	she suddenly fancied that she had really foreseen this very thing.
برای او شرح داد که تمام شب نتوانسته به علت سکوت چشم برهم گذارد.	explained that he had not been able to sleep a wink all night because of the silence.
تمام مدارک همه جلسات هیئت مدیره را تا دوازده ماه قبل بررسی کن.	check through the documents of all board meetings over the past twelve months.
ولی خود او تغییر مکان داد و به اتاق خواب طبقه دوم رفت. جایی که اتاق زناشویی در نظر گرفته شده بود.	but he moved to the room planned as the conjugal bedroom on the upper floor.
به خدا اگر من حاضر باشم یک دینار برای شنیدن سرگذشت خود بدهم!	I would not give a farthing to be told what's past with me
فقط سعی کنید که سر ساعت معینی به او بخورانید.	he, evidently sincerely satisfied with his success.
اطمینان یابد که مدارک آن کامل بوده وبیمه باشد.	making sure it was licensed and insured.
چون خود او حاضر است به محض اینکه موقع را مناسب تشخیص داد شروع به اجرای آن کند.	for he would undertake the task himself, and would begin it as soon as he pleased.
در این موقع بود که اِما نشست و فکر کرد چه چیزی را از دست داده است.	she had then only to sit and think of what she had lost.
باز ضربه وارد آمد و باک سخت بر زمین افتاد.	again the shock came and he was brought crushingly to the ground.
چیزی شبیه به یک لنگه دستکش لاستیکی به رنگ پوست انسان	what looked like a thick, flesh colored rubber glove.
زیرا روز کوتاه بود و روز همه چیز بود.	for the day was brief and the day was all.
سعی کرد با نگاهش او را متقاعد کنند که چنین چیزی واقعیت نداشته است	tried to tell him without words that this wasn't true
در نتیجه به عمق عواطفی که در بالا به آن اشاره کردم افزوده شد.	thus evoking more decisively those affections to which I have but now referred.
پسرک چوپان در آفتاب دراز کشیده و سرگرم تخیلات خود بود.	the young shepherd lay dreaming in the sun.
