به نظرش آمد که در آن اتاق جنگی اتفاق افتاده.	with the expression of one who expects battle and welcomes it.
پس بهتر است هر سه نفر سواره برویم و این پل را بگیریم.	so let us three go and take it!
قبلاً برای جلوگیری از اشتباه یا عوضی بودن بطری قدری از مشروب را خودش چشید	previously taking a taste, himself, to prevent mistakes.
باید بر من رحم کنید و نگذارید بیش از این بدبخت شوم.	you can't help being sorry and pitying me.
دیدم که آن جسم عظیم چندان فرود آمد که با من هم طراز شد	saw this vast body descending almost to a parallel with me
از آن پس نیز دیرزمانی سخنان او را به خاطر داشت.	she remembered it long afterwards.
ناگهان به خود آمد و متوجه شد بدون آموزش دریافته است که چه باید بکند.	he realized he'd found something he could do without being taught
در اطاقی که بیرون از کاخ بود بر روی زمین و در کنار دیوار قرار دهند.	was placed on the floor, along the wall, in an outer room of the palace.
این دوستی دیرین اندک اندک به احساسی بدل شده که من حالا اصلا قادر به بیان آن نیستم.	past the friendship I have had in my heart for you has ripened into a deeper feeling, a
من امیدوار بودم که بشود ترتیب این طور کارها را داد.	I hoped that sort of thing could be arranged.
که به خوبی به یاد دارم که سه هزار دوکا به صورت نقد بود	which as well as I remember was three thousand ducatsa piece in cash
لازم است که یک دوربین هم روی چشممان ببندیم.	have a telescope at each eye
که برای ما خاطر ما از آزادی خود چشم بپوشند و در مقابل ما تسلیم شوند.	when they renounce their freedom to us and submit to us.
چیزی نخواهد گذشت که صدها تن به دنبالشان از راه برسند!	now we shall have hundreds of people pretty soon!
تا بفهمد آن تجلیل از طرف چه کسی است.	to know who was the sponsor of that uncommon tribute.
که کرارا فرزندان خویش را به جرک پیشنهادی مبنی بر بهبود بخشیدن قوانین و معادریفی که در آن عمری جای اعتراض بود	which did very often disinherit its sons for suggesting improvements in laws and customs that had long been highly objectionable
هر مرد با همه توان و نیروی خود به نشیمن خود چسبیده بود	each man with might and main clinging to his seat
یادتان باشد این پسر تنها خویشاوندی است که شما در این دنیای پهناور دارید و باید قدرش را بدانید.	he's all you have akin in the wide world, that you will ever know remember.
این مرد بر صندلی کذائی دم دکان خود نشسته و مشغول پیپ کشیدن بود.	was smoking a pipe at his warehouse door.
خودم رو روی ایوان پرت کردم و اجازه دادم گرما توی سرم به پیچه.	I hurled my body off the porch, letting the fire rip me apart midair.
من نمی تونم خودم را کنار بکشم و شاهد رنج بردن تو باشم.	I'm not going to stand by and see you suffer.
او دیگر آن را درک خواهد کرد و تحمل خواهد نمود.	he would understand it, and bear it.
هری مقاومت کرد و دست و پا زد و مرد او را زد.	he struggled, and the man hit him
اما از هر دستی که رسیده دست خدایی روی او است.	but that enemy is only the agent of providence
خود پسرک خواب را تکان داد تا بیدار شود.	shook the sleeper to rouse him.
یا گواهی جعلی و قلابی را به دولتی ارائه داده با نام و تضمین خود از آن پشتیبانی نماید.	or put the phony certificate to a government, with his name and guarantee backing it up.
فقط آرامش و یک قهوه در دستان من ولی نبود.	just the quiet and the coffee in my hands'but it wasn't.
او هنوز بشقاب پر از جوجه را در دستش نگه داشته بود.	she was still holding a plate heaped with chicken in aspic.
از اینکه جای عرق قبلی زود خشک نخواهد شد ناامید شود.	knowing the old one wouldnt dry out anyway.
باید این عبارت را چندین بار برای خود تکرار کنید.	repeated over and over.
در مورد اخیر است که لیاقت و شم قضایی	here capacity and sound judgment come in
صدای خفیفی کاملاً مغایر با آن صداها که موجب وحشتش شده بودند از وی بیرون جست.	a little noise, very different from that which was causing him so much fear.
تا آنکه نگاه سرگردانش به مجموعه تابلوهای کوچک رسید	till her wandering gaze came to the group of miniatures
دارای علف دان و آخوری بود که در امتداد یک ضلع اطاق قرار داشت.	a rack and manger, extending the whole length on one side.
ناگهان از اتاق لیزی صدای تالاپ و تولوپ بلند شد	I hear a thumping sound from her room
موجب کمال و افتخار و مباهات من خواهد بود.	I should esteem it the happiest good fortune.
با جواب دادن به سوا لش او را خجالت رهایی دادم .	I spared him from his mortification by answering his question.
ربرتا حس کرد که او نه تنها فقط اندکی از دیدنش شادمان شده است	she could feel that apart from being moderately glad to see her again
امروز صبح بنا به دلایلی باید حال بهتری داشته باشم.	this morning there were reasons why I ought to have been in a better mood.
چیزی وجود نداشت که من بتوانم بی گناهی خودم را نشان بدهم.	there was nothing I could say to clear myself.
تا بتواند به میل خود او را در اطراف سرگردان سازد.	enable it to ramble at its pleasure.
با این همه جرئت نکرد از او سئوال کند.	but he did not dare ask him a question.
مثل اینکه بیش از قاطر خود به رفتن شتاب داری.	you seem to be making more haste than suits that mule.
او باز آن کت و شلوار پرموی قهوه ای زشتش را به تن داشت و به میز بالای سرسرا چشم دوخته بود.	he was back in his horrible hairy brown suit and gazing up at the top table.
تا آمدن لاری آن را به دقت توی کشو میزش گذاشت تا نشانش بدهد.	whom she wanted as a second witness.
اما او هم دریافت که دیگر برای فرار خیلی دیر شده است.	but he could see that it was too late to try to escape.
وقتی یکی دیگرش آمد و خواست با تو عروسی کند	when the next comes and wants to marry you
باید دریافت که درحال اجرای نمایش یا جلب توجه یکدیگر هستند.	it is a powerful signal that they are making a play for one another.
من مکرر بت و گفته بودم که ممکن است این برای تو پیش آید.	I told you that this is what would happen to you.
این کارت و این مکتوب سر به مهر را به ایشان بدهید.	that card and this sealed paper
هر یک از طرفین در حال رزم و پافشاری خون خود را از دست دهد.	wounded men, each of whom, still fighting and still resisting, is expending all his blood.
اما وقتی آن را به دقت روی طومار بزرگی نوشت که خواندنش آسان بود.	but when he had copied it carefully, in a large scrawl that was easy to read
من دیروز یکی از ملازمین را به ملازمت خود آوردم	I yesterday engaged a servant
دفاتر حسابداری تم اما خط خوردگی داشت و نامرتب بود	even the parish registers were in a muddle and so on and so on, ad infinitum.
خود را بر زمین افکند و در برابر پیکر والانتین زانو زد	fell heavily on his knees before the bed.
با چنان درخششی شروع به نورافشانی کرد که چشمان او را خیره کرد.	with such strength that the light creaked like a fishing boat.
ولی الآن ساعت یک بعدازظهر است و هنوز برنگشته شاید اصلاً برنگردد	but he has never come back and now it is almost one
لیکن شاه و ملکه وی را به حضور بپذیرند و بدرود گویند	as he takes his leave of the pair
او در پاشنهٔ کشتی به نرده تکیه داده بود	was leaning against the after rail
از او بپرس آیا ممکن است من به دیدارش بیایم یا نه.	ask her if I may come.
امروز به شما ظاهر ساختم که من دلی دارم.	I showed you this morning that I had a heart, did I not, count?
مگر اینکه چندان کوتاه باشد که در دو کلمه ادا شود.	unless indeed it is short enough to be said in two words.
لکن بر اثر طپش قلب شدیدی خواب بچشم انش نرفته بود.	but could not, owing to the painful beating of his heart.
هوای عطر آمیز هم در دالان کوچک آن پر شده	the sweet smelling air stealing in at the low porch
درست مانند همان که او محتوایش را دور ریخت	just as it was when she threw the contents into the ashes.
آنگاه زنگ را به صدا درآورد و جام تازه خواست.	then, rang the bell, and ordered in another.
بنابراین بهتر است از جایتان تکان نخورید و آرام باشید.	so you may as well sit down.
کیفیت دو موردی که به من ارجاع شده بود	stating the nature of the two cases to which I had been summoned
ولو اینکه در مقابل خود دو غول دیو پیکر ببیند که سرشان نه تنها به ابر بسا ید بلکه از آن نیز بگذرد و به جای پا دو برج بلند	though he may see ten giants, that not only touch the clouds with their heads but pierce them, and that go, each of them, on two tall towers by way of legs
یکی از گل کاری ها را دور زد و با سه خیز روی یک گل فرود آمد.	circled one of the nearby flowerbeds, and made a three point landing on a peony.
تنخواهی را که کنت در زیر درختی مدفون کرده	the sum of money which he, through a sense of delicacy
اما همچنان بر جای ماند و نامه به دست اندیش ناک چشم به زمین دوخت	still sat holding his letters in his hand and looking on the ground meditatively
پهلوان با این تصمیم پیش تاخت که جان خود را به بهای زدن یک ضربت کاری به حریف به خطر اندازد.	determined as he was to venture all upon a single blow.
تو هم به خاطر او این تکه چسب را گرفتی و نگه داشتی!	so you actually put this piece of court plaister by for his sake!
در نتیجه مخفیگاه امنی برای این حیوان پیدا کرده بود.	so had found a safe hiding place for the creature.
اگه پول خوبی بهش بدم اون وقت آدم درستی هم می شه.	but he'd be honest if it paid him to be honest.
من فقط وضع موجود را برای شما شرح دادم.	I am only telling you what it is.
سر پیش برد تا پاسخ این سؤال را بشنود.	stretched his neck to hear who they were.
اگه آدم چیزی رو فراموش کرده با شه این یادآور به آدم تذکر می ده.	this tells you if there's something you've forgotten to do.
وقتی افرادی مثل تو رئیس به شن میدونم چه اتفاقی میفته.	I saw what happens when guys like you are in charge, you see.
یا دست کم یک شاهزاده خانم بود تا بتواندیک همچو چیزی را داشته باشد.	or at least aprincess, to have a thing like that.
معلوم بود که تمام شب بیدار بوده و نخوابیده است	it was evident that he had not slept.
خلاصه وقتی به خشکی اومدم ته جزیره رسیده بودم.	I 'uz mos' to de foot er de islan' b'fo' I found' a good place.
که هنوز کسی در آن ریش نتراشیده بود و یک اشرفی شیرین برای من تمام شده بود.	never yet handselled, that would fetch a crown any day.
من هم تقریبا همین قدرها در تیراندازی دست دارم.	there we are about equal
گمان کنم سفرم در حدود بیست دلار خرج برداشت.	I spent about twenty dollars on the trip, I think.
بلکه بدین سبب که امپراطور میل داشت عقایدشان را درباره اشکالات موجود بداند گرد هم نشسته بودند.	but certain persons whose opinions he wished to know in view of the impending difficulties.
من این را در نخستین برخوردی که با تو کردم فهمیدم	I see that when I set my eyes on you
او را از خانه و زمین خود برکنده بودند.	, they had taken him away from the land!
حالا آرامش بیش از معمول به آن دست داده بود.	although it was ordinarily quiet enough, in all conscience.
هر چند پرده گوشت او تقریبا شفاف شده بود.	though the screen of the flesh seemed almost transparent
از در رد شدم و آن را پشت سرم بستم.	I darted through the door, pulling it shut behind me.
اون وخ میبینین که چه طور حقتونو کف دستتون میذارم.	I'll take it an' I'll ram it up your ass
اما خاطرهء من بر سراسر آن سایه انداخته بود.	but my poor history pervaded it all.
پشت آن گارد شاهی در یک نقطه سراشیب جلگه جمع شده بود.	behind which theguard was massed on a slope of the plain.
او هرچه مورد نیاز من باشد برایم تهیه خواهد کرد.	he would furnish me with all things necessary.
چیزی جز خودستایی نیست من نیز با این مردک که شاید اصلا وجود نداشته است همفکرم.	 I agree with that good man, who never existed, perhaps.
من هیچ وقت نتوانستم یقین کنم که آنچه دیدم واقعیت بود یا رؤیا	I never could entirely settle. whether it was a reality or a dream
او را تا داخل یک کتاب فروشی دنبال کرد	followed her into a bookshop
همهء آن کسانی که دوستشان داشته بود دیگر برایش وجود نداشتند.	all those who had loved him dropped out of his existence.
اینکار خطرناک است و اگر خوب فکر کنی بسیار احمقانه است.	it is a dangerous business, and if you think about it a stupid business.
از برای فرزندی که داستان قتل پدر خود را	in hearing the son read aloud in trembling pallor these details of his father's death
که همان سال برای رفتن به انتخابات به کارش برده بود.	which he had made use that same year when he went to the elections.
این حرکات را بی وقفه و به همان ترتیب پشت سر هم ادامه داد.	so on in regular changes, without a moment's intermission.
در فکر بود که این زن را با خود ببرد یا نه.	she was considering whether she would take her with her or not.
پس از آنکه چشمم به دیدن آن موجودات کوه پیکر خو گرفته بود طاقت نداشتم که در آئینه بنگرم	I could never endure to look in a glass, after mine eyes had been accustomed to such prodigious objects
سرانجام چنین نتیجه گرفتم که چنین فکری خیال باطل بیش نیست.	I felt that last idea to be a mere chimera.
با همه معایبی که داری خدا ترا حفظ کند.	though it be with her pip, live
خرسند از آن که گمنام همراه با سنگ تراش و صیاد به یکسانت در خاک شوند.	they were content to go down into obscurity with the molecatcher and the stone mason.
پس از آن زبانش باز شد و سیلی از ناسزا فروریخت.	then words came back to him, and he broke out into a flood of abuse.
من هیچ وقت خودمو نمی دم دست شما عمل کن ین!	I wouldn't let you operate on me!
دست خودش در اثر خراش گلوله جراحت مختصری برداشت.	his own arm slightly grazed by a bullet.
پس من به هرچه او درباره تو نوشته باشد یا بنویسد اعتقاد نمایم و قول او را در حق تو معتبر بدانم	I can then rely on the notes he has left concerning you
صورت و گونه دخترک چنان به چهره کلاید نزدیک شد	her face and cheek came very close to him
تا این که بالاخره بر روی زمین سرد و مرطوب فرود آمد.	then landed on cold, damp earth.
اون موقع باهاش حرف یعنی اون روز چیزی نگفتم.	then I couldn't just tell her then notthat day, anyhow.
تنها مطالعه کردن در آن دوران بی هدفی و رکورد نبود.	it wasn't so much the books I read as the rotten meaninglessness of the life I was leading.
دکتر جوانی که تخصص اصلی او در جراحی است	the young physician, originally an expert surgeon
اما مرد خل و چل نسبتاً شوخی آمد و خیلی عجیب مزاحمم شد.	but was strangely harassed by a queer, half witted man
مانند کودکی نفس زنان به هشتی خانه دوید. طوفان هیجان و مسرت لحظه اول ملاقات فرونشست.	on arriving he ran breathlessly, like a boy, up the steps of his home.
لیکن تو خود با او صحبت بدار و علم و دانش او را بیازما و چون تو جوان باهوشی هستی	do thou talk to him and feel the pulse of his wits, and as thou art shrewd
وقتی دیگر خبری نشد او را در خم بازویش خواباند.	when nothing further happened settled her in the crook of his arm comfortably.
من منتظر لحظه مناسب بودم تا دست به کار بشوم.	I was waiting for the right moment to act.
با ضایعه وحشتناکی که گریبان گیر او شده بود این افسردگی سراسر وجود او را گرفته بود.	that to the quick, with the terrible casualty which had overtaken him.
که شاید تو بتونی این جای خالی رو پرکنی.	whether you might be able to fill.
من نمی تونم هیچ چیزی رو در مورد اون ببینم.	I can't see anything about it.
اتومبیل سرپوشیده بزرگ و سنگینی درست در برابر آن توقف کرد.	a closed car of great size and solidity stopped directly in front of it.
که هیچ تناسبی با صرف شام به اتفاق یک دوست و دیر آمدن به خانه نداشت.	quite out of proportion with the cause a late supper with bachelor friends.
چون معلوم بود که همان لحظه از راه رسیده بود.	for it was plain that he was that moment arrived that
خروجی که منفعت و شهرت بیشتری نصیب ما خواهد کرد.	which may turn out more profitable and creditable to us.
بار دیگر به نزد او بازخواهدگشت و از آنچه بین او و بانو دول سینه گذشته است باخبرش خواهد کرد.	to return and render him an account of what took place between him and her.
بی تردید یک یا دو بار برای قدردانی از دقت نظر و سخاوت او برایش نامه نوشتم.	I certainly wrote to him once or twice to acknowledge his delicacy and his generosity.
البته زمستونا که روزها خیلی کوتاهند ما نمی تونیم از فضای محوطه استفاده کنیم.	though in vinter, ve have very little daylight, so ve are not enjoying them.
ورانسکی پیغام را گرتفه و بیش از آن توجه نکرده و به اتاق خود رفته بود.	he believed what was told him, did not care to find out more, and went to his own room.
با دقت بسیار چشمان کوچک درخشانش را پیرامونش گرداند و در چند قد میش یک سر پاسبان دید که پشت به آنان کرده بود.	darted his little sparkling eyes about him with profound attention, and perceived a police sergeant standing with his back to them a few paces off.
به من گفت که از این خواسته ناشایست من حیرت زده شده.	he expressed himself shocked at my want of decency.
دختر ما با این جوان که هم شأن و همسر اوست خواهد ساخت	with him, one of our own sort
آقای شاهزاده من از آمدن شما به اینجا بسیار مشعوفم.	I am so glad you chanced to come here, prince.
برای وقوف بر استعداد عجیب او در حفظ سکوت همین بس که در سرتاسر آن داستان عظیم و واقعی بیش از یک بار به نام او اشاره نشده است.	that in order to indicate to us the greatness of his marvellous taciturnity his name is only once mentioned in the whole of that history, as long as it is truthful?
دوست دارم یک نفر شهر را به من نشان بدهد	I'm willing to be shown.
تصمیم گرفت شخصاً به این مهم بپردازد و باز به سراغ رشته افکار پیشین خود رفت	she decided, and going back to her former thoughts,
ملانی ناظر بود که چقدر لاغر شده و چشمانش گود افتاده و سیمایش چه ویران شده است .	when she could see him getting thin before her eyes, see the torment in his face?
سپس دخترش را از دفتر کار بیرون کرد و گفت رفتن یا نرفتن تو برای من یکسان است	he drove her from his study telling her that if she did not go away it was all the same to him.
بعد با لحنی آمیخته به اشتیاق و شوخ طبعی گفته بود	he had added in a tone between jest and earnest.
بلکه دوش خود را از سنگینی بار او آزرده یافته	but because it was an unbearable burden
یکی از آن تیرها از گوشه چشم چپ من گذشت.	whereof one very narrowly missed my left eye.
اما به مجرد آنکه عملی را انجام داد دیگر آن عمل که در لحظه معینی از زمان انجام پذیرفته است	but as soon as he has done it, that action performed at a certain moment in time
من به او نگاه کردم در حای که همزمان دچار خشم و در عین حال شادی شدم.	I stare back at him, feeling a breathless mixture of anger and exhilaration.
وقتی که به بدن جان برخورد کرد صدای تاک محکمی داد.	it made a solid thuk as it hit his body.
ناخودآگاه در جواب شور و شوق او لبخند زدم.	I had to smile at her enthusiasm.
تلاشش همه بر آن بود که آرامش آخرین روزهای زندگی خود را به هم نزند.	all her efforts were directed towards preserving the peace of her last months.
رون ملافه را جلوی هرمیون گرفت و تکان داد.	he yelled, shaking the sheets in her face.
زندگی پهلوانان سرگردان در معرض هزاران خطر و نامرادی است	the life of knights errant is subject to a thousand dangers and reverses
میل دارد بدون زحمت دادن به پدرش خود آن را بپردازد	his wish to meet it without troubling his father
شاید از آن رو که به اوهامی جدید دست یابم.	perhaps to acquire others
صورت اخمویش را برگرداند و نگاهی به آن دو انداخت.	cast a surly look over at the pair of them
تا ببینی که وجود ایشان چیزی بجز باد و هوا نیست	thou wilt find they have only bodies of air
درخواست نامه متواضعانه مردی که خشونت و وحشیگری کور و ابلهانه اش او را از روستایی ای صادق به یک سارق و راهزن تبدیل کرده بود.	containing the fierce and yet humble appeal of the man against the blind and stupid barbarity turning an honest ranchero into a bandit.
ترز این بگفت و زار زار به گریستن پرداخت	with this she began to weep in earnest
دور تا دستی به زیر چانه خواهرش زد و با نگاهی پر مهر به او نگریست.	touching her sister's chin, and looking at her with indulgent affection.
همان طور که میدانید این کار خیلی لازم است.	I have to, you know
من دریافتم که مقصودش خیلی بیشتر از آن بود.	I understood that he meant a great deal more than that.
که متوجه سکوتی شوند که در اتاق حاکم شده بود.	to notice the hush that had stolen upon the school
از وقتی که باکره نبود خیلی به ندرت به تنهایی در آن بستر خفته بود.	because she had rarely slept alone in that bed since the loss of her virginity.
