تازه وارد از نزدیک شدن به این جمع اکراه داشت.	the newcomer recoiled from this company.
در میوه که خود از درخت بچیند زهر خواهید دید.	in the fruit you pluck from the tree.
من اگر فرصتی گیر بیاورم موضوع را به پدرم خواهم گفت.	some time I'll tell him so.
کسی بوده است که بیشتر از من رنج برده است	there have been some who have suffered more than I have
او را برای شهادتی که در دادگاه داده بکشد.	killed him for testifying in court.
این قدر فهمیدم کهشریک دست در حنا بسیار خشمگین شده تهدید به اقامه دعوی کردهبود.	I gathered that the deserted partner was very angry and threatened proceedings.
این مرد خواهد رفت وهرکار ناشایستی را انجام خواهد داد تا از زن فرار بکند.	he will descend to the basest trickery to leave her.
قدری گریه کرد و آب دماغش را بالا کشید.	performed some affecting tears and sniffs.
منظورم این است که خیلی جدی مشغول مطالعه هستی .	I mean studying hard.
هیچ یک از کسانی که مرا از خود راندند سرزنش نکردم.	I blamed none of those who repulsed me.
امروز یه کار مهم دی گه هم باید انجام بدم.	I have important business elsewhere today
ولی تا خانه پیرزن بیش از پنجاه قدم فاصله نداشت.	but the house was at least fifty paces away.
به خاطر بقیه تجملی که او را مانده بود	the remains of luxury prevented him from sinking into his actual position
این احساس مخصوص لحظات وحشت و ترس شدید است که آدمی کام لا هوشیار است	you know the sudden feeling one has in moments of terrible fear, when one does not lose one's wits
اما نتوانسته بود آن را به خواننده انتقال دهد.	but he had failed to transmute it.
چندان عمیق که رؤیای هر یک از آن دو در رؤیای دیگری فرورفته و غوطه خورده بود.	so deeply was the revery of the one absorbed and sunk in the revery of the other.
چون بلند شد دیگر حلقه طلا بر انگشت آن دست نبود.	when he rose there was no longer a ring on the hand.
از بالای کتاب با کنجکاوی به این صحنه نگاه کرد.	was watching this performance over the rim of her book with some interest.
اجناسی با کیفیت خوب که به ازای پولی اندک از انبار حکومتی قابل تهیه بود.	articles of good quality, which could be obtained in the storehouse of the administration for very little money.
سپس هوس کرد که زودتر فارغ شود تا بداند مادر شدن یعنی چه	then was anxious to be delivered that she might know what it was to be a mother.
تقریبا قبل از اینکه بفهمم چه خبر شده است	almost before I realize what's happening.
در واقع او هنوز اطمینان نداشت که آن مرد ترشرو و سیاه چهره که لبخند استهزا آمیزی بر لب داشت پدر وی باشد.	indeed, he was not yet certain that the grim, sneering stranger was his father.
لرزان یکدیگر را بوسیدند و آنگاه از یکدیگر جدا شدند.	but they kissed tremblingly, and then they moved apart.
من اینکا رو به دلایل شخصی انجام می دم.	I do this for personal reasons.
که قطعا او وقتی خواهد رسید که کار تمام شده است.	that he should arrive after all was over.
ولی یادم میاد اونجا که بودیم یه دختری رفته بود پیش یکی از این دکترها	I did hear once of a case over there, though, where a girl went to a doctor
برای شوهر و جهیز دختر خود ثروت سرشاری بجا گذاشته است.	that he was very rich in consequence of the dowry left to him with the daughter.
از برکت ذوق و خوبروئی و ثروت خود رندانه چنانکه در خور شباب است	because of their looks, taste and means indulging themselves in phases of libertinism the proper wild oats of youth
ساختن همین خانه جدیدشان که نقشه آن طوری ریخته شده بود که در دوران خوش پیری نیز آشیانه راحتی برایشان باشد	their building of this new house,planned to comfort them through a happy old age
باید بگویم این مطلب در عمل به کار شما ربطی ندارد.	I really don't know that it is your business.
الا اینکه آشفتگی و ناراحتی تو را احساس کردم	I must have been actuated by real uneasiness
یک مرتبه احساسی کردم که از دروغ گفتن خودم بیزارم.	I was underhand.
از باری که تا به آن درجه معذبش کرده بود سبک شد.	he found himself relieved of the burden that had given him so much discomfort.
در این هنگام بود که چیزی در چشمان پیرمرد نهان شده بود	now it was that there lurked a something in the old man's eyes
از اول هفته تا حالا در حال آتیش خاموش کردن بودم.	I've been putting out fires all week.
یقین دارم که در میان ما نمک فراوان به کار بردن حاصل زندگانی پر تجمل است	I am confident that the frequent use of salt among us is an effect of luxury
اما چون یگانه مقصود من خیر و صلاح جامعه است	but as my sole intention was the public good
قرار بود که آن شب ساعت نه او وسوندرا همراه با چند تن دیگر	where at nine he and she, along with a number of others
گروه در حسرت شنیدن مابقی داستان او خواهد مرد.	as he felt the greatest anxiety to know the end of his story.
آخرین هوس جدید زایران نیز این است که به آن حوالی بروند و از او دعای خیر طلب کنند.	the last new freak is for the pilgrims to go round that way to ask his blessing.
پس بازویش را دوستانه در بازوی او حلقه کرد	so he tucked his arm companionably through hers
هرچند که این گنج بیش از یک ماه به کار شخص نباید	among others thatof possessing a treasure
حالا که بهش گفتی دوستش داری همه چیز رو بهتر درک می کنه	now she will understand better since you have told her you love her.
تا با هم یک لیوان چای خوشمزه و حسابی بخوریم.	we'll have a nice hot cup of tea.
ترکیبی نادر که یار و یاور ساعات کار باشد	adapted to supply aid in graver labors
سپس یکدیگر را بوسیدند و با چشمان گریان از هم جدا شدند.	kissed, and parted with tears in their eyes.
هوا سوت کشان از گلویم پایین رفت و گردها را به چرخشی گردبادی واداشت.	the air whistled down my throat, swirling the motes into a vortex.
شایسته این شوند که بنا به حق موروثی مشاور شاه و مردم گردند.	to qualify them for being counsellors both to the king and kingdom.
بر سر آن بودند که اگر بجنبم مرا با تیر از پای در آورند.	ready to shoot me if I should offer to stir.
این هیئت مرکب از دوازده تن بود که چهار تن از آنان کارمند دولت و دو تن کاسب و شش تن نیز روستائی و خرده مالک شهر ما بودند.	four were petty officials of the town, two were merchants, and six peasants and artisans of the town.
شخصا در این وصیت چیزی نیست که شما را دلخور نماید	this unexpected will need not personally wound you
اما راننده ی ماهر در یک طرف نشیمن نشسته بود و تیرمالبند را بالای شیارها نگه داشته بود	but the dexterous driver sitting on the box held the shaft over the ruts,
همان خونی که او خط سیرش را گرفته و به اینجا رسیده بود.	she saw the starting point of the thread of blood
حتی در حق خود نیز این ظلم را روا داشتید.	to you also.
هرگز ندیده بودم این کار به این شکل انجام به شه.	but I've never seen it done that way before.
در به روی خود ببندد و تنها بماند و امور خویش را سامان دهد	to shut himself up alone and put all his affairs into definite shape.
سپس بدون سر و صدا به سوی میز رفت	he followed him quietly to the table
که او یکباره از این همه جلال و فخامت به حیرت افتاد.	as he saw it, that he was quite stirred by the dignity and richness of it.
هم مرا در حسن انتخاب تحسین فراوان کرده بود	full of honour at my esteemed order
از او خواهش کرد که به دیدن نمایش بیاید و ضمناً تأکید کرد که آن نمایش بسیار دیدنی است.	to come and see it, for it was worth seeing.
با دقت و بدون بریدن کلامش گوش داد و به تفضیل او را راهنمایی کرد که به چه کسی مراجعه کند	heard her to the end attentively without interrupting her, and gave her detailed advice as to how and to whom to apply
درست مثل آن است که هر دومان سر از قبر درآورده و در موضعی برابر	just as if both had passed through the grave
گفتم احتمال دارد یکی دو هفته در آنجا مهمان باشم.	told her I should probably be a visitor here for a week or two
دل سرهنگ و سایر سرکردگان زیردست او را بدرد آورد.	the colonel and his officers were in much pain.
که احساس کلاید نسبت به او فرق کرده و سردتر شده است.	this time, that his mood in regard to her was different, colder.
ولی با این همه هیچ کدامشان کاری نکرده بودند.	but remaining inactive nonetheless.
ما شش نفر که در هوا بودیم چنان به هم نزدیک شدیم	we six men in the air came so nigh to each other that
حالا روی هم رفته پول من چهار هزار فلورین و هشتاد فردریک شده بود	of course, to a total of four thousand florins, eight hundred gulden
در آنجا محبوسش ساختند و در آن را نیز بستند.	there locked him up.
برای آن سومی آینده خفه شده است و آزادی در خطر.	to yet another the stifling of the future to the peril of liberty.
سپس درباریان با رعایت تشریفات کامل مهر از سرنامه برگرفتند	which was opened with great ceremony
که به عموی خود بفهماند که استحقاق کار بهتری را دارد.	that he would like to impress on his uncle that he was cut out for something better.
از کنفرانسی که در کلاس خودم داده بود هم بیشتر به آن گوش کرده بودم.	I heard more of that than the lecture in my own class.
که فوری گفت هوا خنک شده و بهتر است کمی قدم بزنند.	almost immediately say something about its being chilly and suggested taking a stroll.
چون آنان عقیده داشتند بزرگواری یک بانو به ثروت اوست نه به تبارش.	because their pretensions to gentility were based on wealth, not breeding.
ترسیدم که به مسافتی دراز در آن سرزمین پیش روم.	I was afraid of venturing far into the country.
حالا بهتر است هر چه زودتر از اینجا بروی.	now you'd better go!
اما از این بابت بمیرد بهتر است تا اینکه از خجلت و شرمساری.	but better so than die of shame
یعنی موجودی که در نردبان اجتماع هیچ گونه جا ندارد زیرا که از آخرین پله این نردبان نیز پایین افتاده است.	that is to say, a being who has not even a place in the social ladder, since he is lower than the very lowest rung.
دستی که به نظرش سر برداشت. هیکل بزرگ سیاهی کنارش راه میآمدغ دستی بزرگ بود دسته سطل را گرفته و با قوت بلندش کرده بود.	a hand, which seemed to her enormous, had just seized the handle, and lifted it vigorously.
همین طور ادامه یافت تا آن که شام روی میز آماده شد.	lasted till the venison was on the table.
چون نوبت او بود که برای بقیه شیرینی دونات بخرد.	because it was his turn to bring donuts.
اما اون چیزی درباره تغییر این یکی قانون نگفت.	but she didn't mention anything about this rule changing.
آن اینکه من بعد وقتی حضرتعالی دیوی نابکار و یا پهلوان دیگری را مغلوب ساختید	that is thinking what is to be done when your worship conquers some giant, or some other knight
فکر کردم ممکن است بیایید پدر برای همین گذاشت مش توی کیفم.	I thought you would come, father, so I put it in my bag.
از هنگام بیماری بچه همواره اضطرابی به دل داشت.	since the boy's illness she had always been anxious.
بالاخره او را بلند کردند و به تسلی وی پرداختند.	they were lifting him up and trying to quiet him.
فقط با نیروی فکر و منطق خویش این مسأله را دریافته بود	he knew it only with his intellect
تنها تقاضائی که از شما داریم اینست که خدمتی برایم انجام بدهید که هم برای شما کم زحمت است و هم باعث راحتی من.	I only ask of you a favor which will cost you but little, and be of very great service to me.
که بیش از هر کس اوست که باید همسر خویش را در سیه روزی یار شاطر باشد و نه بار خاطر.	representing that it was she of all the world who must uphold him in his misery and not augment it,
تو جالیز دو حلوایی یه سگ سیاه بزرگ نشسته.	where you will find a large black dog sitting in the pumpkin patch.
تا به وی دستور دهد که آن شب بستر را در کجا بگسترد.	show him where to set up the bed for that night.
مثل هر وقت دیگر که تحت تاثیر شراب یا عواطفش قرارمی گرفت	but moist, which always happened when he had been drinking, or when he was touched.
آن است یک صندلی که در پهلوی کوزه گل ژرانیوم است	there is one by that geranium
قلاب سنگین پیه گیری که اکنون پاکیزه و خشک بود هنوز به انتهای ابزارها بسته بود.	the massive curved blubber hook, now clean and dry, was still attached to the end.
از نگه داشتن آمار دهقانهائی که دی گه اسب ندارن برای شخم و کارهای زراعتی.	I was sick, anyway, of counting the number of horseless peasants
بعد دوباره یک مشت چیپس چپاند توی دهانش و اضافه کرد	she added, stuffing more crisps into her mouth.
ولی ما این شانس را داریم که او هنوز چیزی در این موردنمیداند.	but the chances are that he still knows nothing about it.
خانم کارکشته با یک دست محکم گلوی او را گرفت	the expert lady, clasping him tightly round the throat with one hand
من بیش از پیش در تصمیم خود راسخ هستم.	my resolution is firmer than ever.
پس از ادای این کلمات بشتاب بس وی انبار دوید و دیگران نیز در پی او روان شدند	so saying he went into the room and the rest after him
شنیدن نخستین کلماتش دریافت که این جوان به محیط اجتماعی که او خود بدان تعلق دارد متعلق است	the first words he uttered recognized him as a man of her own class
او اسنادی را برای حفاظت به شما سپرده است.	that you have even accepted papers from him for safe custody.
زیرا که این ازدواج در تصور من برای او خوب و پسندیده است.	because I consider it would be a proper and eligible match for her to make
عشقی که پیش از به دنیا آمدن او به هیچ کس احساس نکرده بود.	a love new to her, before he was born.
متوجه شد این نور و روشنایی آفتاب هم فقط برای این است که او تنهائی و تأثرات خود را بهتر ببیند.	but the light only served to show the boy his own lonesomeness and desolation
به شرافتم سوگند که قصد آزردن او را نداشتم.	ma parole, je n'ai pas voulu l'offenser.
طوری که اورسولا حاضر بود باقی عمر خودش را بدهد تا موجب تسلی خاطر او گردد.	rsula's lap and she would have sold her soul in order to comfort him.
من حاضر نیستم حتی دیناری برای خاطر او خرج کنم.	I won't spend a farthing on him.
چند بار درِ اتاقت را زدم ولی جواب ندادی.	I knocked at your door but had no answer
من بچشمان او دقیق شدم و او نیز به دیدگان من نگاه کرد و همه چیز را دریافت.	I looked into his eyes and he looked into mine
که محل بعدی کجاست و تو چه روزی باید به آنجا وارد شوی.	with the next destination and the day you have to arrive.
یادم به میز تحریر افتاد که با تمام وسایل در اتاق آماده بود.	I thought of the writing desk in the morning room, the docketed pigeonholes all marked in ink by that slanting pointed hand.
کوشیدیم که از کشتی و تخته سنگ با شتاب فراوان دور شویم.	made a shift to get clear of the ship and the rock.
ظاهرا منظورش از اظهار این سخنان بیان منافع صلح و بحث در اطراف امکان یا عدم امکان انعقاد صلح نبود	evidently no longer trying to show the advantages of peace and discuss its possibility
عده ایشان به دویست هزار نفر هم خواهد رسید.	there will be two hundred thousand of them.
همه از بزرگ و کوچک و غنی و فقیر و عالم و عامی و وضیع و شریف	extolled by great and small, rich and poor, learned and ignorant, gentle and simple
اما همیشه از این وحشت داشتم که یه روز بین کی بمی ره.	but I was obviously dreading him dying, wasn't I?
تمام مهمات را آتش بزنند و متفرق شوند و هرکس به خانه خود بازگردد.	explode the ammunition, and all return home as quickly as possible.
چگونه توانستم بیگانگانی را که به کشورهای مختلف تعلق داشتند وادار کنم که پس از زیانهائی که بر من رسیده و حوادثی که بر من گذشته بود به خدمت من درآیند و جان خود را با من به خطر افکنند.	how I could persuade strangers, out of different countries, to venture with me, after the losses I had sustained, and the hazards I had run?
راستی که با این همه زر و زیور و جواهراتی که عروس به زلف و گردن و بر و سینه خود آویخته است	for the trinkets she has hanging from her hair and neck look just like them.
آن ساق پا! غولت رین وال سر زا که تا کنون قایقی را خرد کرده آن پا را بلعید و جوید و له کرد!	it was devoured, chewed up, crunched by the monstrousest parmacetty that ever chipped a boat!
پیرتر از او نم که بتونم باریک دروغ بزرگ دی گه رو رو شو نه هام بذارم .	I'm too old to shoulder the burden of constant lies that go with living in polite disillusionment.
خیلی خوشحالم که تشویقش کردم فردا تدهین اضافی بکند.	I am very glad I persuaded him to receive extreme unction tomorrow,
قصد ازاین کار یافتن اطلاعات در مورد اوضاع درآن دیار بود	the purpose being to gain intelligence about what's really going on over there
دختر کوتاه قد و لاغری بود اما موی بور و زیبا و چشمان آبی بسیار جالبی داشت.	with fair hair, rather pretty, with wonderful blue eyes.
آن وقت سه دلیل قاطع مبنی بر موفقیت کامل را پهلوی هم بگذارد	having summed up three leading reasons for complete success
دقیقاً هی چیز خوب یا بدی در درون خود ندارد	is nothing absolutely good or bad in itself
یک داستان واقعی برای شما حکایت کنم که دلیلی باشد بر بیانات جناب آقا اشاره به کشیش و بر عرایض خودم.	tell you a true story which will confirm this gentleman's word and he pointed to the curate as well as my own.
اما اونچه که مردم میبینن فقط سحر و جادو ا.	but all people see is magic.
من می خوام ببینم که تا چه مسافتی رو می تو نه پوشش بده	I want to see how far she can extend.
گوشش را تیز کرده بود بلکه دوباره آن صدا را بشنود.	trying to catch the voice again
سپس منقارش را در جام آب پرتقال هری فرو برد و به پرواز درآمد.	dipped her beak briefly into his goblet of orange juice, then took off again
سه ساعت بعد از نیمه شب در معیت ایشان راه باران شسته پاریس را پیش گرفت.	hence he started with it on the wet, wet roads at three o'clock in the morning.
هر دفعه سعی او با همین قضاوت سطحی و بیقیدانهی کنونی روبه رو شده بود.	every time he had been confronted by the same superficiality and triviality with which she met his appeal now.
چون که در فقط یک چفت چرمی داشت و و از کردنش خیلی آسان بود	you only have to pull a buckskin latch string
از پایه ستون بالا رفت و روی آب تیره رنگ خم شد.	he climbed on the pedestal and bent over the dark water.
تا رضایت و خرسندی و عیش همگان را برهم نریزد و انتظاراتشان از وی به نومیدی مبدل نگردد.	he wished to spoil the general pleasure and disappoint everyone's expectation.
با در نظر گرفتن ثروت پایان ناپذیر ادویه و ابریشم و جواهر و کلاه و عاج که هزاران جزیره را در ان دریای شرقی غنا بخشیده است	considering the inexhaustible wealth of spices, and silks, and jewels, and gold, and ivory, with which the thousand islands of that oriental sea are enriched
خود برای آنکه چیزی نشنود هر دو گوشش را با دست گرفت.	not to hear him she stopped both ears with her hands
از هم اکنون تا قوزک پا در برف فرو رفته بود.	it was already ankle deep about his boots.
چه برای زن هر گفتاری که شوری از عشق نیافته باشد مرده است.	for whom all words are dead that are not kindled by love.
نو مسلمان ایشان را دلداری داد و به ایشان گفت که به هیچ وجه اسیر نیستند	the renegade comforted them by telling them that they were not held as captives
هر چهار نفر پتو به دور خود پیچیده بودند.	all of whom were wrapped in thick blankets.
بلکه باید با کمال تأثر و تأسف اموال خود را واگذارند و از مسکو بگریزند.	sorry as they were to abandon their property to destruction.
به هر حال انگشت سبابة دست راستش به زمین خود.	touching it with his finger.
تمنی کردم که دیگر مرا به آن لقب نخواند	I begged he would forbear applying that word to me
در حقیقت من باید این عادتم را ترک کنم.	I really ought to break myself of the habit.
من چهار هزار فلورین را که صبح برده بودیم روی قرمز گذاشتم.	but to stake the whole four thousand gulden as she had directed.
به جای آن که زنگ معمولی کلیسا را بزنند ناقوس را زدند.	the bell began to toll, instead of ringing in the usual way.
این چند تار موی او را بر است ین من یافتند.	they found these upon my sleeve.
بعد به جنگ وحشیانه خود برای غذا ادامه دادند.	then went back to their vicious squabbling over the diminishing feed.
چطور ممکن است خودم آن را روی خودم ریخته باشم!	I most certainly did not knock it over myself!
میدانم که هر چه بیشتر با او زندگی کردهای احترامت در نظرش بیشتر شده است.	I know that the longer he has lived with you the loftier you have been in his eyes.
زیرا این مأمور که به حرف آن آقای سفیدپوش زیاد اعتقاد داشت	for that functionary, on whom the prediction of the gentleman in the white waistcoat had made a very strong impression
اما قیمت اتاقی که مسافر در آن استراحت فرماید بیست فرانک است.	but a chamber in which onereposes costs twenty francs.
