روت خندان گفت این یکی را فراموش کرده بودم.	I'd forgotten that, she laughed.
خودتان از درستی و عمق فکری که اظهار داشتید آگاه نیستید.	you do not realize how profound is your thought, nor how true.
به این ترتیب اسم دومشان. دیگر شباهت بسیار به اسم اولشان نداشت.	so that the second name bore almost as much resemblance as thefirst.
عروسکی که فراموش شده در اتاق خواب افتاده بود.	now relegated forgotten to the bedroom.
به آن راه چمن زار رسید که تقریبا تپه را دور میزند	reached that turf alley which nearly makes the circuit ofthe hill
من تفصیلات را به شما میگویم تا خیالتان راحت باشد.	I give you these details, in order that your mind may be set at rest.
فکر کنم که بهتر با شه به گم در تجارت کمکش کردم .	set her up in business' is the correct term, I believe.
ژان وال ژان به نظر آورد که ممکن است خفتن در شب سرد در هوای آزاد منجر به هلاکت شود.	jean valjean remembered thatsleep in the open air on a cold night may be fatal.
این بنا نیز همچون برج و باروی فیلسوفان فرو ریخت.	this edifice crumbled into dust like the philosophers' edifices.
تا دوشی بگیرد و به او لباس دادم تا بپوشد.	for a shower and got her a change of clothes.
که ممکن نیست بتوان خصایل او را به وصف آورد.	that it's hardly possible to give him as much praise as he deserves.
لکن آنچه در اینجا اهمیت دارد اصل موضوع است و هرگاه صد و پنجاه روبل کم است این یک امر جزئی و فرعی است.	but in this case the principle is the main point, and that a hundred and fifty roubles are missing is only a side issue.
تلألؤ آن گویی سراسر آینده لایدگیت را با آفتابی ملایم روشن ساخت.	the radiance seemed to light up all his future with mild sunshine.
آنگاه وطن پرست از عیب مبرایی که از او نام رفته بود در محل شهود ظاهر شد.	the unimpeachable patriot appeared in the witness box.
در میعادگاه دیرین به دیدار یار نازنین نایل آید	sees his lady where he was wont to see her
برخلاف زن ای دی گه در مورد خودش حرف نزد.	with never a word to say for herself, like a woman should be.
میدان گرفته و نظر همه را جلب کرده بودم.	I was their chief exponent
سپس برای یک سال و شاید برای ابد در ظلمت فرو رود.	then lapse into darkness for a year or for ever.
در حالی که تفنگ را در دست داشت بیرون آمد	left it his gun in his hand
چون دیدم که بهتر از ین کاری برایم میسر نیست عاقبت به رفتن رضا دادم	I complied at last, finding I could not do better.
دیگر لازم ندیدم زحمتی به خود داده و برای دیگران تحصیل مال نمایم.	I will not be the foundation of another man's fortune.
فقط دخالت فوری و بلادرنگ یک باغبان بود که او را نجات داد.	it was only the prompt intervention of a gardener that saved her.
من از ساعت هشت و نیم در اینجا بودم	I had waited since half past eight
همسر خودش ایمانی کودکانه چون باور خود او در زمان خردسالی داشت	his wife believed as simply as he had believed in his earliest childhood
زیاده از حد دل به این استنتاج داده بود که مادرش خود مسؤول این ویرانی عظیم است.	too busy resenting the inference that she herself had made just as big a mess of things.
سخت مراقب خود بود که مبادا تیری خائنانه به رویش خالی کنند	keeping himself carefully out of the way of a treacherous shot, should any be intended.
دو تن دیگر هر یک در طرفین او مطابق مرسوم برای ملازمت ایستاده بودند.	the other two stood one on each side to support him.
اما این موارد نادر و ناچیز بود و در باور او داستانش به آخر آمده بود.	but they were few and slight, and she believed them over.
میل دارد به جایی که امکان دیدن او هست به مهمانی شام برود.	is willing to dine where he may see her again.
اما فریت که نگاهش متوجه دست من شده بود با تعجب پرسید.	but I saw him glance at my hand in surprise.
امید داشتم که پس از دویست سال بتوانم توانگرترین مردم کشور باشم.	I might reasonably expect, in about two hundred years, to be the wealthiest man in the kingdom.
فرضیة تو را دربارة این قضیه به خاطر آوردم	I remembered your theory of the affair
باور کنید هرکس قبلاً این بانو را دیده باشد و حالا باز او را ببیند دلش ریش خواهد شد.	his heart rend in twain, I trow, who saw her once, to see her now.
اما مری به چابکی از کنارش گریخت و به سمت در رفت.	but she slipped away quickly towards the door and said
چند بار از آن فتوکپی بگیر تا رد تغییر نام شرکت استخدام کننده از بین برود	have it photocopied to hide the traces of the change of name of the employing company
در همان لحظه متر بر روی زمین افتاد و به دور خود پیچید.	the tape measure crumpled into a heap on the floor.
هرلحظه فکر می کرد مالان است که آن را با زور باز کنند.	at any moment I thought they would burst it open.
من خودم هم استعدادم در یادگیری زبان خوب است	I, too, have a talent for languages.
او پس از اینکه از سر مهر شکوه و گله آغاز کرد خواهشم را به لطف پذیرفت.	after some kind expostulations, he was pleased to grant.
به همان اندازه ناممکن بود که کسی کودکی را که در آغوش دارد به زمین بی اندازد.	as impossible as to fling down a child one is carrying in one's arms.
برشتوکی را که برای صبحانه خورده بود بالا آورد	he lost the cornflakes he had eaten for breakfast
از آن پس دیگر به هیچ وجه مأذون نیستند که بار دوم هم آن را بیازمایند.	that therefore they need not try it again.
کالسکه از ساعت ده در کنار خیابان منتظر بود.	it has been waiting round the corner there since ten o'clock.
اما حالا عصبانی تر از آن است که به این قضیه فکر کند.	but she's too mad to think of it now.
تصمیم گرفت قیمت نیم تنه را به جای صد و پانزده دلار صد و بیست و پنج دلار اعلام کند.	she decided to say that it cost one hundred and twenty five instead of one hundred and fifteen.
ولی این چند سطر برای آن که موجب قبولی او شود کافی نبود.	but it was not enough to place him.
عادلانه است که شوهرش پول ثابتی در طول حیاتش در اختیار ویل بگذارد و	he should find himself in possession of a rightful income which should be paid by her husband during his life
طول آن قریب به شش گز و نیم و عرض آن نزدیک سه گز و نیم بود.	was about seven feet long, and four wide, moving upon.
زیرا که در درهای بزرگی که وسیله گذشتن از یک مربع به مربع دیگرست هرکدام به بلندی هیجده و به پهنای هفت بند انگشت است.	for the great gates, from one square into another, were but eighteen inches high, and seven inches wide.
باید راجع به موضوع جدی و دردناکی با شما مشورت کنم.	I must talk with you of a grave and painful subject.
که اگر تو او را بجا بگذاری او جان خود را بر این ساحل خلوت بجا خواهد گذاشت.	who will yield up his life on this barren strand if thou dost leave him.
حالا که قرار بود نگهبانان در اطراف مدرسه مستقر شوند	if they were stationed all around the school
اگر بروی من تمام شب را نگران و ناراحت خواهم بود و نباید راضی شوی که برای خاطر تو هم ناراحت بشوم!	I should be miserable all night, and I won't be miserable for you!
بعدها توانستند ک قایق دو پهلوی بزرگ جنگی را از وحشیان جزیره بگیرند	eventually, as it turned out, seizing a large double war canoe of the savages
زیرا من جمعیت کشورمان را با حساب کردن شماره پیروان چندین حزب سیاسی و فرقه مذهبی برآورده بودم.	in reckoning the numbers of our people, by a computation drawn from the several sects among us, in religion and politics.
بعد یک تکه از بال طیاره روی درختی در همان حوالی افتاد	left a piece of wing in a nearby tree
آرزوی سردوشی و صلیب افتخار و عنوان و مقام به دلش راه یافت.	he longed for epaulettes, crosses, titles.
که حتی جرأت ندارد این تقاضا را به کنت عرضه کند.	that he dare not even mention the matter to the count.
به فاصلهٔ یک ساعت همهٔ اسرار خود را با هم در میان نهادند.	after an hour they told each other all their secrets.
آن را در هوا حرکتی داد و بعد نگاه داشت.	poised and switched in the air.
حاضرم این وال مرده را یک لقمه کنم اگر دروغ بگویم.	I'll eat this whale in one mouthful.
طیور و حتی دام و کل اعضای خانواده کشاورز اجاره کار را پناه داده بود.	the fowls, and even the cattle, together with the whole family of the tenant farmer.
که بر آن بودم که همه چیز را فدای آن کنم.	that I determined upon sacrificing every thing to it.
سپس با لاقیدی از آنچه سر شب گذشته بود پرسید.	then asked carelessly what had happened that evening.
به زیر آب فرو رفته و سرانجام توانسته بود دوربین را بیرون بیاورد.	finally succeeded in bringing up a camera.
در آنجا مادیانی زیبا با دو کره نر و ماده دیدم که روی بوریا چم بک زده بودند	where I saw a very comely mare, together with a colt and foal, sitting on their haunches upon mats of straw
با اینکه هیچ یک از جای خود تکان نخورد	though none of them started
همین موجب شد که در دربار امپراطور برتری بسیار حاصل کنم.	which was represented very much to my advantage at court.
ولی به طور کلی باعث تغییر زیادی نمی شن	but it doesn't make any real difference
اما این لرزش از سرما نبود بلکه از نفرت و وحشت نامفهومی بود	not from cold but from a sense of disgust and horror he did not himself understand
چنانکه گویی هرگز گامی که به ن بینجامد یا انجامی دن به آن را بازدارد برداشته نشده است.	as if nothing had ever been done, or omitted to be done, that had led to it
دی گه می تونی آهسته آهسته به درمانگاه بری	just toddle up to the hospital wing
من خودم هیچ دوست ندارم جاهای دیگر شهر زندگی کنیم.	I should be unwilling, I own, to live in any other part of the town.
اما هنوز به پهلوی کشتی خود برسیده بود که فریاد وال!	but he had not gained his ship's side
نه.راضی هستم که صد بار بمیرم و چنین کاری را نکنم.	I would rather die a hundred times oh, yes, die!
هیچ یکی تا فیصله یافتن قطعی این مسئله نمی توانستند کام لا آرام بگیرند.	there was no real relief now until this problem should be definitely solved.
به عینه مثل آن است که قطره به دریا برده شود	no more than a drop of water in the ocean
دست چاقش را به سوی خانم می سون خیالی دراز کرد.	offering his fat arm to an invisible woman.
روی میزی که تازه خالی شده و پزشک یار آن را شسته بود گذاشتند.	laid on a table that had only just been cleared and which a dresser was washing down.
درمیان جانوران چگونه یکی در نیرو از او برترست و دیگری در تک و پو و این یک در تیزبینی و آن دیگر در کار و کوشش.	how much he was excelled by one creature in strength, by another in speed, by a third in foresight, by a fourth in industry.
خاله جانش در دل پیش او زانو زده است.	in her heart his aunt was on her knees to him
در کنار کارهای دیگرش به آزمایش تولید برق از طریق شیمیایی مشغول بود	just at the time when, over and above his other work, he was occupied with some galvanic experiments.
اما اگر روزی خودم به این خاطر خواستم ازدواج کنم	but when I am in need of that, I hope some one will tell me so
به علت پرده ضخیمی که وسط معبد آویخته بود ببیند.	because of the serge curtain
همان افسر سابق که پنج سال پیش وی را ترک گفته بود.	the one who threw her over five years ago,
کار ما غارت کاروان و ماسک گذاشتن و کشتن مردم و دزدیدن ساعت و پول مسافری نه.	with masks on, and kill the people and take their watches and money.
از پنجره خارج شد و از نظر ناپدید گشت.	it zoomed out of the window and out of sight.
برای روحی که از میان ما پر کشیده است	for the soul of the departed
هر چند در این اواخر مدل موی او افتضاح بود.	even if her last haircut was a bit severe.
ولی وقتی که تودهٔ مردم را در برابر خود داشت از چنین کاری عاجز بود.	but when he found himself face to face with the people, he was impotent to do anything, in spite of his good will.
از بیست و سه یا بیست و چهار سالگی امکان پذیرد.	than the age of twenty three or twenty four years.
را که بیشتر از همه در هلاک پدرم سعی کرده بود.	who had more than any contributed to the death of my father,
برکه دارای آبی شفاف و روشن و عمیق بود.	pool was very clear water and immensely deep.
که من او را چون یک پدر تربیت کردم	whom I have brought up with the love of a father
لیکن به این استناد نباید چنین پنداشت که لازم نیست پهلوانان سرگردان به همراه خود پول داشته باشند.	it was not to be supposed therefore that they did not carry them
یک روز ظهر یکی از نگهبانان شب پیش او آمد	there had come to him one noontime a man who was employed as a night watchman
زیرا از هنگامی که مرا زندانی کرده بودند چند تن از ملاحان مرده بودند.	several among them having died since my confinement.
جواب داد که برای قضاوت دربارة هر کس باید شخصاً و از نزدیک او را دید و شناخت.	he answered that one could never judge of a man without seeing him close, for oneself,
چگونه ترتیب داده تا خودش در اتاق رخت کن مخفی کند	how he had arranged to hide himself in the closet
زیرا در آن هنگام که پای جان خودشان در میان است	when their own skins were in danger
برای اثبات کاردانی و دوراندیشی و نبوغ این دو سردار جنگی محیلانه دلایل مجعولی اقامه کردند	the historians provided cunningly devised evidence of the foresight and genius the generals who
در را گشود و مادام بواری را مثل یکی از آشنایان خانواده به اتاق ناهارخوری هدایت کرد.	he came to open the door almost familiarly, as to an acquaintance, and showed her into the dining room.
که خودش هم از این دگرگونی به حیرت افتاد.	that had characterized him that even now he was ,not a little impressed by the difference
ولی تو نباید این کار را بکنی و او را نگران کنی.	I dare say, but you ought not to go and worry him.
آن را به دست گرفته و از درون آن به طرف کشتی نگاه کردم.	I took his glasses and looked at the ship.
علیا حضرت در مدت بیماری چندین بار از من عیادت کرد.	her majesty made me several visits during my sickness.
از این پس من کنیز تو خواهم بود کنیز تو تا پایان عمر.	I'll be your slave now, your slave for the rest of my life.
محتضر به وضع باشکوهی که نتیجه انجام تشریفات مذهبی بود	on which the sick man had been laid in a stately pose in keeping with the ceremony just completed.
جوف تو را کاویدم و آنچه ناشایست و بد بود از تو بیرون آورده و دور افکندم.	I have dug deep into thy very entrails to root out evil thence.
از هریت هم خواسته بودند تا آن موقع پیششان بماند تا با هم برگردند.	she was invited to remain till they could bring her back.
باید از تمام اخبار دست اول مطلع به شم.	I must know from first handall there is to know.
که همسرش به طور غریزی از این امر آگاه است	that she was instinctively aware of this
سپس علف آبشش زا را از دست دابی قاپید و در جیب ردایش گذاشت.	grabbed the gillyweed, and put it into his pocket
آن وقت با شمع علامتی گذاشتند برای راهنمایی آینده گان.	they made a smoke mark for future guidance
بلافاصله صدایش در فضای روی سطح دریاچه طنین افکند و به جایگاه تماشاگران رسید.	his voice boomed out across the dark water toward the stands.
اما نهایتا با ایقان و طمانینهء لازم سر از خواب برداشت.	but awoke gradually and surely.
اما از بیزاری و تنفر خود به شاهزاده به هیچ وجه آگاهی نداشت	with a sense of antipathy to the old prince which
که دیگر از شراب مطلوب موجود نیست در گوشش گفت که دیگر مهمات وجود ندارد.	as a butler at dinner informs his master that there is no more of some wine asked for that there were no more charges.
ده نفر بودند. بالای عرشه بیست نفری تا آن موقع بی طرف مانده بودند.	ten in number leaving on deck some twenty or more, who thus far had remained neutral.
هرکدام یک لنگه از کفهاشان را در بخاری نهاده بودند.	each of them had set one of her shoes on the hearth.
فعلاً به خورجینت نگاه کن و ببین اگر چیزی برای خوردن داری بیاور تا بخوریم	see if thou hast anything for us to eat in those alforjas
شراب میخورن.غوغایی به پا میکنن و از چپ و راست مردمو ماچ میکنن.	drinkin' and raisin' hell and screwin' around.
آرزو کرد که از این بلاها سر خودش نیاید.	hoped nothing like that ever happened to her.
ده دقیقه دیگر بقیه نان و شیر را به او بده.	in ten minutes more, give her the remainder of that milk and bread.
فقط فکر کردم شاید بخوای موقع غذا خوردن اطراف آرنجت آزاد با شه	I just thought you'd like some elbow room while you ate.
هرگاه یک مداد و یک قطعه کاغذ وجود داشت ممکن بود حساب آن را رسید.	I haven't got a pencil and paper or I could work it out.
جوان بلافاصله افراد دسته خود را رده بندی کرد و به رقص واداشت	he at once began to execute complicated figures with the rest of his comrades
کمترین شکی ندارم که هنوز به این خیال پشت گرم است که محال است	I have no doubt that he still has some comforting thoughts to the effect
بعد هم به اتاقی رفتند که قرار بود اتاق پذیرایی باشد.	afterwards into what was to be the drawing room
به یاد آورد که نا دین دفتر را دوباره زیرسنگ شومینه گذاشته بود.	remembering that she had put the ledger back under the hearthstone.
به احتمال زیاد همه چیز تا امشب موقع خواب روشن شده است.	I shall be very much surprised if it is not clear enough before we go to bed this night.
مسلم است که مقدرات من در دست شما قرار دارد.	I rest all my hopes on you, and, of course, my whole life is in your hands.
که تاکنون اطلاع از او ندارد به صدای بلند بخواند و مضطرب نشود.	which had hitherto been a mystery
در این صورت جهتی از آسایش و نیکبختی ابتدایی را یافته بود.	he would have found one of the conditions of man's primitive blessedness.
اقوام و کسان خود را مردمی حریص و طماع و فاقد احساسات بشری جلوه داد و خود را نیز چنان عاقل و دانا شناساند	made his relations appear covetous and heartless, and himself so rational
یعنی کاری که آن قدرها هم برایش مشکل نبود.	a task which she seldom found difficult.
من رو هم سوار کرد و رس وند خو نه .	he gave me a lift home.
متاسف تر از او نم که بتونم بهت به گم .	I am more sorry than I can tell you.
اما این کیفیت پیش افتاد و آن مطلب از میانه رفت	when your majesty's attention was attracted by the terrible event that has occurred in the gulf
من بر استی افراد بشر را دوست دارم. آه!	I love men genuinely
بر اثر اتفاق سعادت آمیزی اگر ذکر این کلمه در این مورد ممکن باشد	by some happychance, if that word is permissible here
با اشخاصی که آنجا جمعند از اشخاص صاحب شأن.	with that little group of great geniuses
مدتی دراز دست زنش را فشرد و لبخند زنان او را در کالسکه نشاند.	with a long pressure of her hand and a meaning smile, he put her in her carriage.
زمین آسایشگاه بیشتر از 5 تا 10 هکتار نبود.	the grounds of the loony bin weren't likely to be more than five or ten.
کار راندن گاری و تحویل الوارها به مشتریان را به او سپرد	put him to driving a lumber wagon
اگر دامن قباتان را بگیرد پای تا سرتان را در کام خواهد کشید.	if it catches hold of the skirt of your coat, you will be drawn in bodily.
قبل از رفتن به اتاق بیمار افکار خود را منظم کند.	to arrange her thoughts before going to her father.
درست به سخنان من گوش دهید زیرا ممکن است بار دیگر دچار اشتباه شوم.	follow me carefully, or I may get confused again
سعی کردم طوری وانمود کنم که هیچ چیز بدتر از آن دردنیا وجود ندارد.	I tried to look as though, to my mind, there was nothing worse in the world than that.
بعد هم بدون این که خم به ابرو بیاورد دستور اضافه شده را شنید	also received with indifference the added cruelty of a command
مطمئن نبودم که چه جوابی برای این سوال دارم.	I wasn't sure I knew.
آن جناب به یکی از خادمان خود که اسبی کرند و نیرومند و بسیار امین و نیک نهاد بود فرمان داده بود که پاسدار من باشد	his honour ordered one of his servants, a strong sorrel nag, very honest and good natured, to be my guard
هر یک به اندازه ارزش یک سر تیر یا یکی دو میخ یا پایه الوار از کشتی مالک بود.	each owning about the value of a timber head, or a foot of plank, or a nail or two in the ship.
که بسی شتاب و عجله دارم از برای آموختن علوم	I am in a hurry to begin
اگر چه این زبان با زبان مردم آن جزیره تفاوت داشت.	although it was different from that of this island.
چون اگر او را به حال خودش بگذاریم طبیعت مطمئناً بهتر از هر طبیب و دارویی عمل خواهد کرد.	nature, he was sure, would manage best, left to herself.
بهتر است به رغم میل خودت هم که شده کمی بیشتر بمانی.	you would stay a little longer than you might wish.
متوجه شد که بر پیشانیش عرق سرد نشسته است.	he felt cold sweat on his face.
در روی روپوش مخملی مطرز که روی میزی زراندود	on the velvet cloth embroidered with gold
