که سرانجام قادر به تحمل این وضع شده است	he was beginning to feel slightly sustained at least
را که به دولتی سرنگون شده وابسته بودند نجات دهد.	belonging to an overturned government.
اما کسی حاضر نشد برای دفاع مهمانخانه همراه ما بیاید.	not one would help us to defend the inn.
در حالی که آسمان را به کنت نشان داد	pointing to heaven with solemnity.
دلم خنک شد که زی لا به چیزی که حقش بود گرفتار شد.	I'm gladZilla got what was coming to her.
من خیال ندارم هیچ چیزی را از او پنهان کنم.	I'm not going to keep secrets from him.
منظورش گیر آوردن والدین و به چهار میخ کشیدنشان برای شهریه بود.	that is to say, canvassing likely parents.
چون اون یک قهرمان بود هر کس غیر از این گفت بزن تو دهنش .	for he was a hero and don't let anyone tell you differently.
آن تابلو بر روی دیوار باریک یک پلکان مارپیچی قرار داشت.	picture hung on the wall of a narrow spiral staircase.
موهای خیس و نگاه خیره و بی فروغی که حاکی از یک خستگی جسمی و تشتت اعصاب بود شد.	the hair dripping with water, the dim gaze that told of physical prostration and disordered nerves.
همه برای تماشای خوشی و شادمانی ارباب آمده بودند.	who with beaming faces had come to see their master making merry.
که به نظارت جداگانه یک دستیار زن یا مرد نیاز دارد.	department which required the separate supervision of either an assistant forelady or man.
سراپای بند من محتاج حفاظتی است که مرا از گرما و سرما مصون دارد	my whole body wanted a fence against heat and cold
دوست عزیز من بسیار میل دارم با تو صحبت کنم ولی فرصت آن را ندارم.	I should like to have a chat with you, my dear boy, but I haven't the time.
سپس نگاهش را با تأنی در اطراف سال ون گرداند.	cast her eyes slowly round the room.
دیدم چشمانم سرخ شده و دست در صورتم به حال اسفناکی درآ ده است.	to see how red my eyes were, and how sorrowful my face.
آنگاه ما بی درنگ اینجا را ترک خواهیم کرد و موضوع همین جا خاتمه خواهد یافت	we will go away at once, and there will be an end of the matter.
اورسولا از فرط حیرت و ناراحتی فقط توانست گریه کند.	rsula wept in consternation.
به خصوص به من گفتند که حضرتعالی شاعری بزرگید.	above all, that you are a great poet.
سرانجام من و مادرم بدین فکر افتادیم که با هم به دهکدة مجاور برویم و کمک بخواهیم.	at last to go forth together and seek help in the neighbouring hamlet.
زره تن این پهلوان از پوست مار و سپرش لنگه در بزرگ معبدی است	who for armour wears that serpent skin, and has for shield a gate which
به ساعتم نگاه کردم. ساعت نه و ربع بود.	I glance at my watch and see with a dart of shock that it's 9. 15.
ولی یک سانتور دیگر با مو و بدن مشکی جلو آمد	but it was only a second centaur, black haired and bodied
باد و وحشت او را از تنفس بازمی داشتند.	terror impeded her breathing.
در بعضی جاها متمایل به زرد و در نقاط دیگر بدنم روی هم رفته در حال ناپدید شدن بودند	yellowing in some places and disappearing altogether in others
برهان این مطلب این است که فامیل من به بستگی و اخلاص خود به شاهزادگان مطرود باقی ماندند و پدر تو شتاب کرد تا خود را به سلطنت جدیده بست	in proof of which I may remark that while my family remained among the stanchest adherents of the exiled princes your father lost no time in joining the new government
هر چهره که برایش آن همه عذاب و لذت بار آورده بود	every face that had given him such torments and such raptures
به دست شویی می رو مو بعد به پایین نردبان برمی گردم.	go to the toilet, then return to the base of the ladder, pick up the log and climb again.
برعکس او نان را با دست چپ خود برید و سوپ را با دست راستش خورد.	broke his bread with his left hand and drank his soup with his right.
ناپلئون ظاهرا اعتقاد راسخ داشت که این تذکر باید برای مخاطب او مطبوع باشد.	he said, evidently not doubting that this remark would be agreeable to his hearer since it went to prove his
دوست دارم در دریاهای خطرناک سفر کنم و به سواحل وحشی پیاده شوم.	I love to sail forbidden seas, and land on barbarous coasts.
اگر هم پولی کنار گذاشته مال این بود که به خودش گرسنگی داد.	if he didn't save it wi' clemmin' his own inside.
هیچ فلزی نیس که تاب این همه تک ون رو بیاره.	the metal ain't made that'll hold it for long.
چون هر قدر هم که در این مورد یک وال تصادفی خاص و ممتاز باشد	for however peculiar in that respect any chance whale may be
در نتیجه احساس کرد که انتقامش را از آن زن گرفته است.	she had the delicious pleasure of vengeance fulfilled.
اما من قضیه را به بعد موکول کرده بودم.	which I had postponed taking.
شمشیرش را در هوا حرکت داد و آزمایش کرد و آن را در غلاف گذاشت.	then he flourished the saber, tested it, and sheathed it.
بالاتر از همه به سردرگمی عظیم و عجیبی دچار شده بود.	a ghastly, all pervasive embarrassment.
ما با هم همسایه هستیم و تو نباید فکر کنی که مزاحم ما خواهی بود.	we are neighbors, and you needn't think you'd be a bother.
که دشمنانش برای رسوا کردن و حمله به مقام بلند اجتماعی او از آن به عنوان موهبتی آسمانی استفاده خواهند کرد.	which would be a perfect godsend to his enemies for calumny and attacks on his high position in society.
من می دونم که اینجا به طرز تهوع آوری ساک ته.	I know that it's awful quiet.
تا از همه بیشتر به موجودات زنده نزدیک باشد	to be as near living people as he could
یعنی توطئه ای در زندان که جان لوسی را به خطر انداخت و یحتمل جان دختر او و حتی پدرش را.	a prison plot, and that it will involve her life'and perhaps her child's'and perhaps her father's
هر کاری هم کنی من وقتی که کنار ادوارد باشم ساده به نظر می آم	I'm going to look plain next to him no matter what.
بهتر است اول همشیرهء شما را تا سر خیابان خودشان همراهی کنیم.	I propose that we first conduct your sister safely to the corner of her own street.
یکجورایی امیدوار بودم که حالا حالا هم به آن پی نبرد .	I kind of hoped it wouldn't soon.
تا حالا به کسی نگفته بودم که از پرواز وحشت دارم.	I've never told anyone I'm scared of flying.
به پادگان نظامی شهر نیز دستور داده شد تا آخرین نفس مقاومت نمایند.	the garrison received orders to resist to the end.
بیان حقیقت برای او با همان دشواری طبیعی همراه بود که ادای سخن برای شخص الکن	but it was as difficult for him to tell the truth as for a stutterer to pronounce words.
حال دیگر برای من و شما جز خوردن شراب شیرین کار دیگری باقی نمانده است.	there's nothing left for you and me but to sip sweet wine, my dear, n
روی پل مردی اسب سوار را که پاکت بزرگ و سفید رنگی در دست داشت متوقف کرده بودند.	on which they had stopped a horseman holding a large white envelope in his hand.
بچه شیرهای جنگجو اما اطاعت پیشه او گردش جمع بودند.	surrounded by his warlike but still deferential cubs.
این خطر در پیش است که قفس چنانکه درخور نزاکت و نجابت پهلوانی چون او است پاک و تمیز نماند.	the prison might not be as clean as the propriety of such a gentleman as his master required.
این شهر را کف و جوش تجارت محاصره کرده است.	commerce surrounds it with her surf.
زیرا در چنین نبردی ما به جای اینکه به هم صدمه بزنیم گرد لباس یکدیگر را پاک خواهیم کرد.	for that sort of battle will serve to knock the dust out of us instead of hurting us.
بعلاوه فقط برای مدت کوتاهی قصد اقامت در آنجا را داشتند	as they had come only for a short time
چون هم سرعتش خیلی زیاده هم پیدا کردنش سخته.	because it's so fast and difficult to see.
دلیلش این بود که ربرتا را به تخطی از اصلی فراخوانده بود	for here he was encroaching upon something t
در آن روزها وحشت از تاریکی کودکانه کمی از بین رفته بود	in those times the childhood fears of the night had faded a little
باید آن را روی سنگ حکاکی کرد تا هیچ بادی نتواند آن را پاک کند	we must engrave it in stone where no wind can ever erase it.
لذا او جین خود را در سکوت کامل نوشید	so he drank his gin and water in silence
که اگر اتفاقاً من بتوانم به نحوی به دردت بخورم	that if you should need me
در پی هم تمام دسته سگان شکاری خارج شده از همان محلی که گرگ دویده بود عبور کردند.	sprang helter skelter from the wood opposite and the whole pack rushed across the field toward the very spot where the wolf had disappeared.
او را از دو تمنای آشکار آگاه کرده بود.	made him aware of the too obvious appeal
از گناهکاری خود به وحشت افتاد و این بیم و وحشت از این جهت بود	she felt horrified at her own vileness, horrified
همه با هم برابر باشند و هر حیوانی به قدر وسع کار کند	all equal, each working according to his capacity
بلکه بیشتر به یک قطعه گوهر درخشان و نابود نشدنی شباهت دارد.	but rather the radiant resemblance of one, cut in an indestructible gem.
او را در نظر آوردم که وارد اطاق شده کارت مرا میان شست	I saw him come into the room
حدس زدم که او هم مثل من آماده است تا سریعا دست به کار شود.	I guessed that he was ready, like me, to act at a second's notice.
با این همه ذهن من به دیدن چیزهائی خو گرفته بود که از هر سوی در پیرامون من قرار داشت	yet my ideas were wholly taken up with what I saw on every side of me
هر یک آماده جنگ بودند و چیزی نمانده بود که با هم در آویزند.	just ready to engage.
او که به شما گفت از میس ایزابلا متنفر است و حالا این طور علناً با وی عشقبازی میکند.	when he told you he hated her?
قبل از این فقط یک بار دیده بودمش و آن هم فقط یکی دو دقیقه	I have only seen her once before, for a couple of minutes
اکنون خواهند دید آیا من مردی هستم که از شیر بترسم یا نه.	shall see if I am a man to be frightened by lions.
دیگر برایشان محال بود بگویند کدامین خوک و کدامین آدم است.	already it was impossible to say which was which.
اما پیش از آنکه قدم به درون خانه بگذارد محتاطانه به دوروبر نگریست.	but before doing so she looked inquiringly about her.
ولی لری متوجه شد که باهم دوست شده ان د.	but they seemed to be on good terms now.
بنابراین حتم دارم که شخض دیگری صدای ما را نشنیده.	thus I am certain that we could not have been overheard.
سخن من نه تنها یاوه و بی سر و ته نیست بلکه برعکس بسیار شایسته و منطقی است.	will not be impertinent, but, on the contrary, pertinent.
او به من نگاه کرد و انگشتانش از حرکت ایستاد.	he looked up and his fingers stilled.
که در مناسبات خود با همقطاران و افسران مافوق نشان میداد و ترس و احترام بر میانگیخت	which he showed in his relations with his comrades and superior officers, commanding both fear and respect, and also at cards,
چون دستکم چند تن از آن دخترهای خوش برو بالا بودند.	since at least a few of them were attractive.
چنان با دقت زمین را پاک کرده بودند که گرد و غبار مرا نیازارد.	care was taken to have it made so clean, that the dust was not offensive.
آری باید این مسأله را درک کرد و جنگ را بازی نپنداشت.	we ought to understand that and not play at war.
که از خویشتن اطمینان دارد و به کار خود وارد است	who knows his job does when turning up his sleeves
اما تصمیم گرفته بود که هرگز چیزی نپذیرد از مردی که با پدرش بدرفتاری کرده بود.	but he had set his mind on not receiving anything more from the man who had been unkind to his father.
مقداری نزده به منظور مسلح ساختن عوامل خرابکارتر جمع از جا کنده شد	some area railings had been torn up, to arm the more belligerent spirits
گذشته از این چیزهای کهنه و مهجور بسیاری نیز به ذهنش راه یافتند.	withal it introduced into his mind much that was archaic and obsolete.
بعد دست خود را روی کاردی که روی میز قرار داشت برد	laying his hand on a bread knife which was on the table
آمده بودکه مطمئن شود پولی را که این قدر نگرانش بود به دست آورده است.	but to make sure she had gotten the money for which she had been so desperate.
در همان جهت شروع به حرکت کردم و حدود ده متری به جلو رفتم و بعد تصمیمم را عوض کردم.	I actually started wandering along the bank in that direction, and then when I'd gone about ten yards I turned back.
آن مرحله بینایی و گذاری که عامل رشد احساس شادی و ناشادی است.	that delicate poise and transition which determine the growth of happy or unhappy consciousness.
دخترک به نوبه خود به او خیره شده بود	she in turn stood staring down at him
سایه گذشت. و رد بسیار کوچکی در خاطره باقی گذاشت	the shadow passed leaving hardly a shred of memory.
که سومین منصب والایی است که در امپراطوری وجود دارد.	which is the third place of trust in the realm.
ما را با قدرت زیاد ناشی از اشتیاقش مثل دو ماه موازی در آغوش گرفته بود.	holding us two moons in parallel orbit by the sheer force of her will.
امیدوارم آن قدر زنده بمانم که شما دو تا را دست به دست بدهم.	I hope I shall live to join your hands.
اگه لطف کنی و بیای به دفترم من تمام جزئیات ماجرا رو برات توضیح می دم.	I will explain it all to you if you will step up to my office.
از ای نرو فرزندانشان معیاری برای صرفه جویی نداشتند	so that the children had no standard of economy
اما اگه پا برهنه باشی نمیگذارن وارد کلیسا به شی.	but then, you will not be allowed to enter churches
در این موقع پیرمرد بر اثر تنه و فشار جمعیت به وسط دایره رسید	when the old gentleman was officiously dragged and pushed into the circle by the foremost of the pursuers.
برای دوشیزه فیرفاکس غصه خورد و دنبال راه گشت تا برایش کاری کند.	grieved for her more and more, and looked around eager to discover some way of being useful.
در اینجا ناچار باید از آبروی بانوئی محترم دفاع کنم.	I am here obliged to vindicate the reputation of an excellent lady, who was an innocent sufferer upon my account.
اگر کس دیگری غیر از تو آن دوروبرها پیدایش بشود.	don't you go for to bring any of them other young whelps
به اتاق او رفتم که در طبقة قبل از آخر یا یکی مانده به طبقة زیر شیروانی بود رفتم.	we went up to his room top story but one , and cried very much.
برای من مهم نیست که آن جا کی هست یا چه هست.	I don't know and don't care to know who's there and what.
احتیاج به یک دامن پشمی دارد و دست کم لازم است که مادرش ده فرانک برای این بفرستد.	that she needed a woollen skirt, and that her mother must send at least ten francs for this.
لیکن برای تفکر در این باره وقت بسیار است	but there will be time enough to think of that
به عکس دیگر نگاه کردم و ناگهان سراپا ذوق و شوق شدم	I turn to another sheet and feel a pang of excitement.
در میان آب او را تعمدا به دست مرگ نسپرده بوده است.	that he had not willingly left her to die in the water.
او کرم شب تاب پر وش داد تا به مرادش برسد.	he bred glow worms to serve his purpose.
از احکام و تصورات جدا افتاده خود انباشته و تا حدی نسبت به کلیه بیگانگان بد گمان است	was full of his insular prejudices, and rather distrustful of all aliens
مطالب دیگری نیز به گفته افزودم که آن نویسنده را قدری شرمنده کرد و در بنیان عقایدش اندک ترلزلی راه یافت	some further remarks I added to these, with which, I think, I left him rather dumbfoundered
اگر او دین خود را به تو نپرداخت باز گردم و او را ولو در کام نهنگ پنهان شده باشد پیدا کنم.	if he did not pay thee I would go and seek him, and find him though he were to hide himself in the whale's belly.
زیرا که الآن چیزی که ابدا در فکر نیستم تو هستی.	for indeed I did not think of you in the least at the moment
تکانی از روی ناراحتی خوردم و به صندلی خود تکیه کردم.	I leant back in my chair
کارهنین در پیاده شدن از کالسکه به آنا کمک کرد	he helped her to get out of the carriage,
سنگ بزرگی را که در جلو پایش افتاده بود برداشت	snatched up a stone that he found near him
سردردی که بدون شک به خاطر نیم استکان کنیا کی بود که در پایان جشن به سلامتی نوشیده بود.	that he attributed to the half glass of brandy at the final toast.
پیش از سر رسیدن مدعوین سراسر خانه و زندگی را نشانش داد.	conducted her around the premises before the guests arrived.
به او اجازه دادم از چیزی که در سرنوشتش بود منحرف بشود	I allowed her to divert from her destined path
ولی تنها چیزی که شنیده بودند تمجید از نواختن پیانو در زیر پنجره او بود و بس.	but they had heard only benign comments concerning the serenade by solo piano.
سگی بود بدخو و خویش آزما و با غرشی دائمی و نگاهی بدخواه.	sour and introspective, with a perpetual snarl and a malignant eye.
حاضرم حلقومت را بچسبم و در برابر دو پول سیاه خفه است کنم.	I'd catch hold of your throat and choke you for half a guinea.
در تمام کشو رهائی که یاهوها در آن تفوق دارند رایج است	in all countries where they preside
سماور کوچک و جامه دان خواربار و نیم بطری روم را روی آن قرار دادند	a small samovar was produced and a cellaret and half a bottle of rum
تا دو هزار دلار لازم را برای فرجام خواهی فراهم کند.	two thousand dollars or more with whichthis appeal could be conducted.
به طرف صدایی که اسمم را گفته بود برگشتم.	I turned to the sound of my name being called
گویی بیش از معمول نیاز به آماده شدن داشت.	as if she needed more than her usual amount of preparation.
دیدم که بدن او وقتی دید آن پسر منتظر اوست سخت شد	I watched her body stiffen when she caught sight of the boy waiting for her.
امیدوارم که حالا حالاها سایه تون رو سر ما با شه.	I hope we shall have you with us for a long time yet.
من خودم موقعی که این سانحه رخ داد در حال انجام وظیفه بودم که این طور.	I myself was personally on duty when the accident occurred, 'I see.
از بس شتاب زده بودم از شوربختی آن را در خانه نهاده بودم	I unfortunately left behind me for haste
او در شورای سلطنتی تصمیم گرفته بود که باید مرا بدان گونه که گفتم فرو بندد	determined in council, that I should be tied in the manner I have related
اما همین قدر شنیدم که از برای خلاصی شاه اتفاقی کرده بودند.	I only know that there was a conspiracy to rescue the king.
از پنجره یک عاقله زن و یک دختر بچه را دید که روی دو صندلی نزدیک به هم نشسته بودند	he saw through the window an older woman and a young girl sitting very close together on two chairs
با این حال تلاش زیادی کرد تا بتواند به احترام ولی نعمت خود از جای برخیزد	made an ineffectual attempt to stand up, out of respect to his benefactor
ایشان همه با هم نزدیک شدند و از او پرسیدند که علت این همه داد و فریاد چه بوده است.	who approaching asked him what was the matter with him that he shouted so.
اما این کار را به طور کامل انجام نداده است.	but not done it properly.
لباس زیر بسیار کوچک و ابری شیمی به تن داشت.	wearing a thin silk slip
در حقیقت آنچه که تو با بیانات و عبارات روستایی خود درباره مرگ میگویی	for in truth what thou hast said about death in thy rustic phrase
آن شب من یک لحظه دیده بر هم ننهادم.	I did not close my eyes that night
پشیمان شد و چنین نمود که آمده است تا قلمش را بتراشد.	changed his mind, and pretended to want a pen mended.
تنها و ساکت نشسته بیش از پیش به فکر فرو رفتم.	I sat there in my corner
بهتر آنکه این یک روز را مانند اوراق امتحانی مدارس با خط قرمز نشان کنید	had better mark it with ruddle, like the inscriptions on the walls of class rooms
با این وصف نزدیک به نیم ساعت صبر کردند	they waited about half an hour
سبحان صبحانه را آورد و نان را روی میز گذاشت	the jailer entered and placed the bread on the table
اما وقتی نگهبان از روی پاگرد سرک کشید تا ورود یک زندانی را اعلام کند او بلافاصله سر حال آمد.	but when the sentry on the landing thrust his head in to announce the arrival of a prisoner, he revived at once.
بینی پهنش مثل بینی مارها به جای سوراخ دو شکاف داشت.	a nose that was flat as a snakes with slits for nostrils
در عمرم هیچ وقت این جوری حرف نزده بودم	I've never spoken like that in my life, I say.
نخست کسانی را که در پائین بودند خبر کردند تا به کناری روند	first warning the people below to stand out of the way
اربابم که بیدار شده بود به من دستور داد بروم ببینم چه اتفاقی افتاده است	the master called to me to see what was the matter
در این موقع دو هم قطارش از جا برخاستند.	his two colleagues were already on their feet.
تا زحمت حساب کردن و دچار اشتباه شدن را نکشیم	then we'd have no blessed miscalculations
از دیدن قیافه نحس زشت و پیر سر کار آن قدر خوشحال شدم که آمدم یک چاق سلامتی یک نم.	I wasso glad to see your ugly old phiz that I just dropped in to say howdy.
که از ته و توی کارش سر درآورند و فهمیدند چه فضایل و کراماتی دارد.	before she was, by some means or other, discovered to have every recommendation of person and mind.
