پس شاهزاده عینکش را به چشم زد و به خواندن نامه پرداخت.	putting on his spectacles he began reading.
یه دفه به چشم خودم دیدم که دو تا مرد دو ساعته هفتاد و پنج تا ماهی گرفتن.	I've seen a coupla men bring back as many as seventy five fish in two hours.
من با زحمت بسیار توانستم معنی هر یک از ین کلمات را بر او بیان کنم.	every one of which terms I was at much pains to make him understand.
برای این افراد که عادت واقعاً طبیعت ثانوی شده	men, to whom custom has indeed been second nature
گانیا به عجله شاهزاده را ترک کرد و از اطاق خارج شد.	who hastily left the room
آن هم با مردی که رابطی به القابش نداشت.	even worse, with a man who was not.
امیدوار بودم تا پایان این ماجرا پیش من بمانید.	I hoped that you were going to see me through this business.
بقیه هم با این مکان فاصلهء بسیار خواهند داشت.	the rest will soon be far from here
تا به حال چیزی به این حیاتی به گوشم نخورده.	I've never heard anything so vital.
زیرا توجه داشته باشید که در غیر این صورت کار از کار خواهد گذشت.	or mind me, it will be too late!
میتواند در هر چیز ارتباطی با حال و هوای آن لحظه خودش مشاهده کند.	whatever the thing observed, one could find a connection with his experience of the moment.
باید مطمئناً بدانم که آیا باقیماندنم در اینجا مفیدتر از ترک آن نخواهد بود.	I will know for certain whether I cannot be of greater use by remaining in it than by leaving it.
آرکادیوی سوم را به عنوان فرزند خودم خواهم شناخت	I will recognize him
در یک دست خردل دان و در دست دیگر سرکه دان گرفته بود.	with a mustard pot in one hand and a vinegar cruet in the other
از کنارشان رد شدم و به اینکه حضور من را حس کنند توجهی نداشتم.	I shoved past them, not caring if they realized my presence.
راجع به این که از بدرفتاری و بی محبتی خانه فرار کند	a resolution to escape from hard usage and lack of sympathy at home
بغض کنان گفته بودند که این خانه شاید آخرین خانه هرکدام تا آخر عمرمان باشد.	chokingly they had saidthat it might be the last home either of them would ever have.
سرش را بلند نکرد ولی دستش از کشیدن باز ایستاد.	she did not look up, but her hand missed a loop in the design she was drawing, making it unbalanced.
بیا این جا و گردنبندت را به پدرت نشان بده.	come here, show papa your necklace.
پس از آنکه همه جای آن را گشتند و زیرورو کردند	rummaging it all over
در حالی که فقط پانزده لیره به من بدهکار بود.	he owed me but fifteen.
برادر این مرد خواهر مرا دید و از او خوشش آمد.	that man's brother saw her and admired her
زندگی این زن و شوهر ملایمت و آرامشی بیشتر یافت.	that their life began to go more smoothly.
تا ساعت یازده صبح در انتظار باقی مانده بود	he had waited until eleven o' clock
در این فکر فرو رفت که از تمام مردم ده فقط و فقط او تا ابدال آباد از دست رفته است.	realizing that he alone of all the town was lost, forever and forever.
آن شخص قدری سرخ شده و با تلجلجی جواب داد	replied the stranger with a slight hesitation, and blushing
مارتین پاسخ داد سلامت و قدرت تخیل را به درآمد ترجیح می دم.	I'd rather have good health and imagination, he answered.
که اسمش را با حروفی طلایی روی بدنه نوشته بودند	for its name could be seen on the poop in gold letters
درباره هیچ چیز بجز اصطلاحات پزشکی و انجام کشفیات عقاید رادیکال نداشت.	he was no radical in relation to anything but medical reform and the prosecution of discovery.
در هر یک از طرفین من پانصد تن که نیمی از آنان مشعلهائی فروزان و نیم دیگر تیروکمان داشتند به پاسبانی ایستاده بودند.	were with five hundred guards on each side of me, half with torches, and half with bows and arrows.
من بچه اولمو سقط کردم وقتی دیدم گاو یکی از سیاهامونو شاخ زد	I lost my first when I saw a bull gore one of our darkies and
وسط راه ایستادن و خستگی انداختن چه خوب است.	I must admit this is nice, to stop and give ourselves a little break from the track.
اما این داخل عمارت است که مرا مشغول دارد	I care for, it is the interior
اما آرامش فکری نداشت و دچار ناراحتی ذهنی بود.	but he had not complete freedom of ideas, because he was in an agony of embarrassment.
سپس کیف دستی را در ساحل گذاشتند تا چند دقیقه دیگر هم گردش کنند و چند عکس هم از درون قایق بردارند.	then having left the bag on shore for a few moments while they rowed out and took some snapshots in the boat
رویم را برگرداندم و وانمود کردم مشغول خواندن پوستر ایدز هستم.	I turn away and pretend to be studying a poster about AIDS.
در اولین شبی که فرصت یافتم بعد از فراغت از کارها ساعتی در اتاق بنشینم	on the first occasion of my sitting up in the evening
به خوبی از تأثیر خود بر ژنرال آگاه بود	he was well aware of his effect on the general
او را مردی پاک دل اما بسیار کودن و نادان پنداشته بود.	as a well meaning man, but of a low contemptible understanding.
مشار الیه استشمام هوای سنگین و ناسازگاری کرد و خود را در زندان دید	he air he inhaled was no longer pure but thick and mephitic he was in prison
در این احساس گیج کننده وصیت نامه دوم را یکسره از یاد برد.	possible revocation shrinking out of sight in this dazzling vision.
پنج دقیقه طول کشید تا صفحات آخر را هم خواند و آن را بست.	in five minutes more she shut it up.
بلافاصله تمام آثار شادی از صورت او محو شد	all gladness left him
امیدوارم که از طرف من جسارتی به سرکار نشده باشد.	I hope I have not hurt you!
زن پس از این که سر تا پای او را ورانداز کرد	looking at him with great complacency from head to foot
سرم رو به ابرهاست و مرد ولگرد در کنارم است.	head facing the clouds, the tramp by my side.
تا دم غار دنبالت کردم اما تا پایین نیمدم باهات. هم ون جا صبر کردم.	I trailed you to the cave, but didn't follow you down
به مدت سه روز در اطاق من جیوه بسوزانید.	burn mercury in my room for three days.
کم و بیش چون کودکی گم شده و گریان در تالاری بزرگ	almost like a lost child crying in the degraded grandeur of the noble hall
بلکه گل و لای از سر و روی خود نیز بزداید	but to wipe the mud from his face
دانست در آن گوشه جهان که ما هستیم از دست مردم چها برمی آید	in our parts of the world, is capable to perform
به اعلی حضرت امپراطور التماس کردم تا دستور دهد که هرچه زودتر آن را به من برسانند.	I entreated his imperial majesty to give orders it might be brought to me as soon as possible.
تا نفس آلوده خود را از آنان که طرف صحبتشان بودند دور نگه دارند.	to divert their polluted breath away from those whom they addressed.
اولین سؤالی رو که تو اون صفحه دیدم ازش پرسیدم.	I put the firstquestion that I came across.
برای عمل قدیم بعدها مورد دادرسی قرار خواهد گرفت.	later on he will be judged for the old crime.
اینان نیز آنچه از ربرتا دیده یا شنیده بودند به قید سوگند بازگو کردند.	each swearing to what she or he alone saw or heard.
با خود گفتم بهترست به طبقه سوم بروم و ببینم آن زن محتضر حالش چطورست.	I bethought myself to go upstairs and see how the dying woman sped
حالا هم که این سر لعنتی غیبش زده است	now this head is not to be seen anywhere about
نمی دونست کی باید ده نشو به بنده و ساکت بمو نه.	she never knew when to keep her mouth shut.
که من خودم حبوبات و سبزیجات خود را پاک و اصلاح نمایم.	to prepare my own meals
چقدر پدربزرگم خوشحال خواهد شد اگر شما دوست بدانید.	you will overwhelm my grandfather with delight if you play whist.
که برای سرو صورت دادن به این وضعیت تحمیلی	which obviously was being forced upon them and themselves
پشت سرش مرد عجیبی به درون کلبه قدم گذاشت.	he was followed by a second, very odd man.
زیرا این قسمت و آن طرف صورتش سرزمینی بود که آبیاری نشده بود	below and beyond this line there was a dark expanse of unirrigated soil
بیست جاروی پرنده در یک ردیف کنار هم چیده شده بودند.	so were twenty broomsticks lying in neat lines on the ground.
کم مانده بود که از بوی او و ملاحانش بیهوش شوم.	I was ready to faint at the very smell of him and his men.
باید یکی از ای نا نامه رو به بره.	I've got to use one of these.
ریش و موی سرش رنگی مایل به زرد گرفته بود.	yellowish beard and hair
فکر نکنم پدرم وقتی که یه نفر اینجا باشه سعی کنه بیاد تو	I don't think my dad would try to come in while someone else is here
او نم موقعی که دی گه امید ندارم دستم بهش بر سه.	maybe never have another chance.
نتوانستم در هیچ جای چشمانش اثری از خداحافظی ببینم.	I couldn't see a goodbye anywhere in his eyes.
بعدش شاید بد نباشد فکری به حال خودم بکنم.	afterwards I may probably be glad to dispose of myself.
دلیل آن هم دستپاچگی او به هنگام دادن یادداشت بود.	because of her unmistakable agitation when she handed him the note.
این صدا از زنگ معروف اوست و او مار زنگی است.	that the noise was the famous rattle.
اما پا فشاری خود او در این مورد ممکن بود حمل بر تحکم بی جایی شود.	but for her to urge this might seem an undue dictation.
بگذار فردا همدیگر را در خانه معینی ملاقات کنیم تا حرفم را قبول کنید.	let them meet at a certain house on the morrow and make a test.
همچنان که برگشتند و به سمت خانه به راه افتادند	he continued, as they turned towards the house.
مسی و آ به شما مرا از وحشت هلاک کردید.	you will make me die of fright!
اگر من کشته شدم و از من پسری ماند شما او را از خود جدا نکنید	if I'm killed and if I have a son, do not let him be taken away from you
که امروز مجلس عقد و امضا صورت نخواهد گرفت بماند به وقت دیگر.	, the affair would necessarily be deferred for some days longer
از راهرو کنار من رد شد که به سمت میز معلم برود.	walking down the aisle beside me to get to the teacher's desk.
صبر کنیم تا طوفان فرو نشیند و ما بتوانیم در خشکی پیاده شویم.	wait till the subsiding tide permitted us to land.
به هیچ ترتیب ترغیب نخواهم شد که چنین چیزی را باور کنم.	nothing will persuade me to believe in such a thing.
او هم به زودی از این کار منصرف شد.	she soon dropped off.
از آن دود آبی رنگ غلیظی به هوا رفت.	engulfed them all in a cloud of blue smoke
عزم جزم کرده بود از این پس به زنان به شیوه ای علمی برخورد کند	henceforth he would take a strictly scientific view of woman
می دونم که جسما به من وفادار بودی .	I know you've been physically faithful to me.
همیشه میل من ای نه که دخترامو با تقوی تربیت کنم.	I mean to bring them up virtuously, and they shall be honest, and nice
اعلی حضرت امپراطور که اعتماد بسیار به دلیری و نیرومندی تو دارد	his imperial majesty, placing great confidence in your valour and strength
بهتر است خداوند بزرگ همین حالا به دادش برسد.	it might come to him now
این صدا را چنان شنیدم مثل اینکه زیر گوشم گفتند.	I heard that just as plain as if the man was by my side.
به محض این که پیش آمدی شد که به تریج قبایش برخورد دختر ما را به باد فحش و دشنام بگیرد و او را پست و فرومایه خطاب کند و پدرش را دهاتی احمق و خشن و عمله بیل زن بنامد و خود او را نیز دخترک دوک ریس و بیسروپا بخواند.	would abuse her and call her clown bred and clodhopper's daughter and spinning wench.
قبلا به شما اطلاع می دم تا بدون ین.	I warn you so that you may be prepared.
رئیس پلیس انجام مأموریت خود را به عرض رساند و اطلاع داد	the superintendent of police, after reporting that he had executed the instructions he had received, informed
همهٔ آن بنای سعادت محقرشان دیگر ویران گشته بود.	all their humble happiness was henceforth disturbed.
هرکس هم یک جزء کوچیکی از این روح داره.	everybody's a part of.
باز سه گلوله دود دیگر و متعاقب آن چهار گلوله دیگر بو جود آمد	three and then four more appeared and then from each
بعد نفسی تازه کرد و از ته دل جیغی جگرخراش کشید.	gasped for breath, and let out a hoarse shriek.
آن دو از این بابت از او سپاسگزار بودند	for which they were both grateful
او پا سست کرد و مو به تنش سیخ شد.	he stopped short, his hackles rising.
وضع مضحکی پیش آمده بود و من ناچار شدم از تعاقبش دست بردارم.	rendering it ridiculous for me to pursue.
بدین قصد که آن زوبین انداز مدفون آن را به چنگ بگیرد و بدان وسیله بیرون کشیده شود.	meaning that the buried harpooneer should grasp it, and so be hoisted out.
رنج حرکت و معاینه زخم در بیمارستان سیار حاصل شده بود	the jolting while being moved, and the probing of his wound at the dressing station.
بدون آنکه کسی او را ببیند از خانه بیرون رفت.	out of the house without being seen.
آرام بودن هوا باعث شد که من از بابت سلامت و آسودگی شما در موقع سفر نگران نباشم.	the calmness of the air and sky forbade apprehensions respecting your safety or comfort on your journey.
گذاشت که حرارت تسکین بخش آب درد و رنج را از وجودش بزداید.	letting the soothing water wash away the pain.
پای عاج خود را در سوراخ مته که آنجا بود فرو کرد و با یک دست شراع را به چنگ گرفت	inserting his bone leg into the auger hole there, and with one hand grasping a shroud
پنجاه قدم سربالایی رودخانه رفتم و بعد همان راه را گرفته برگشتم همان جایی که کرجی را گذاشته بودم.	I went up the bank about fifty yards, and then I doubled on my tracks and slipped back to where my canoe was, a good piece below the house.
در همان لحظه صدای چند ضربه بر در کلبه به گوش رسید و هاگ رید با عجله به سمت در جلویی کلبه رفت.	he strode back into his cabin as someone knocked at the front door.
آشکار شد که وقایعی در جریان بوده که موجب ناراحتی روحی دختر جوان و یکی دیگر از افراد خانواده گردیده است.	it became evident that something was in progress which affected the peace of the young lady, and of somebody else besides.
کلاهش را از سر طاس برداشت و سه بار روی سینه صلیب کشید.	lifted the hat from his bald head and crossed himself three times.
وقتی به آن رسیدم آسمان در مشرق خاکستری شده بود.	when it did show it looked like it was a thousand mile off.
تا خود نزدیک کوزت باشد به هیچ چیز محتاج نخواهد بود .	so long as he had her near him, he shouldneed nothing except for her
برای یک آن همگی از تماشای جانی دست برداشتند.	the immediate attention was distracted from the murderer, although the universal eagerness for his capture was, if possible, increased.
من خیلی خوشحالم که این کار را کردید و به من هم گفتید.	I am very glad you did, and that you communicated it to me.
اما حالا خیلی مشغول است. من باید گزارش بدهم.	but all alive now, I must turn to.
آخر من که گفته بودم ما باز به هم خواهیم رسید.	I told you we should become friends
از این مرگ متعاقب و نظیر همدیگر که همه را گیج کرده	these two sudden deaths, so quickly following each other, astonished every one
احتمالاً آن طور که فکر کرده بودم واضح و خارج از کنترل نبودم.	I must not have been as transparently obvious and out of control as I'd thought.
به چشم خود امتناع او را از کمک به ربرتا دیده بود!	had seen that he had not sought to aid her!
در او اشتیاقی به تجدید ارادت نسبت به شخصی شخیص جان گرفته بود.	whether he desired to show a little attention to an eminent man
ما نمی تونیم تو رو توی دسته راه بدیم.	we can't let you into the gang
روز دیگر به دستور ملکه آن را برای شام من آماده کردند.	I had him next day for dinner, by the queen's command.
قول داد که خود او با دکتر وارد مذاکره شود.	readily undertook to hold solemn conference with the worthy doctor himself.
انرژی پر شور پسر بر ضعف اسفناک پدر چیره شده بود.	mastering the energetic spirit of the son as it had mastered the lamentable weakness of the father.
شماره تلفتش را که در دفتر ثبت نشده است برایت پیدا کردم.	I have her unlisted number for you, if you want it.
با کنجکاوی حریصانه تمام توجه خویش را به صحنه تآتر معطوف ساختند.	turned their whole attention with eager curiosity to the stage.
با محبت و مهربانی به درِ اتاق غذاخوری اشاره کرد.	she humanely pointed out the door.
بوی پرندگان و بوی اجتناب ناپذیر فاسد شدن به مشامش رسید.	the smell of fowls, and the inevitable smell of decomposition.
اما او را مجبور کرد تا اجرت سرویس او را مانند بقیه بپردازد.	but she made him pay for her services so strictly
راهی را که چوپان رفته بود در پیش گرفتیم	we followed the same road which we saw the shepherd take
امروز من او را از خانه خود بیرون کردم.	I turned him out of my house this morning.
هرچه را که میدانست به خودی خود یاد گرفته بود.	everything that he knew, he had learned by himself.
چطور است دست همدیگر را بگیریم و اندکی بدویم تا گرم شویم.	let us take hold of hands and run.
ولی هیچ انعکاسی از تصویر خودش در آینه ندید.	but see no reflection again.
اما بعداً با آقای رمزی به خوبی کنار آمده	but afterwards she got on perfectly
زیرا کامی با چنان ترشرویی و خش نونتی با او رفتار کرده است	for she had answered him so angrily and harshly
با همین معاذیر یا بهانه دیگر به اینجا نخواهد آمد	so be perwented, or anything for an excuse
ولی حواسش جای دیگری بود آنهم در این فصل از سال.	but his thoughts were elsewhere at this particular season of the year, too of all times.
هنگامی که در شورای سلطنتی در ین باره سخن رفته بود خردمندترین وزیرا با من هم رأی شده بودند.	when the matter was debated in council, the wisest part of the ministry were of my opinion.
ترسیدم که اگر آتشی برافروزم بومیان از آمدن من خبر شوند.	not daring to kindle a fire, for fear of being discovered by the natives.
من باید بروم و زود درها را ببین دم.	I must go and bar the doors quick
موهایش در یک طرف سرش فرفری و در طرف دیگر صاف بود.	her hair frizzy on one side and flat against her head on the other
از میان دو خیابان بزرگ شهر به پهلو گذشتم	sidling, through the two principal streets
از روی چهره مضطرب او کاملاً معلوم شد که واقعاً نیازمند فشار است	plainly showed, by the alarmed expression of every feature, that he did want a little rousing
اگر محکوم شود و با محاکمه مجدد او هم موافقت نکنند	he was convicted and a new trial refused then,well then
گفت که من مرد شجاع و جسوری هستم و سپس به راه افتاد.	said I was a brave fellow, and went away.
از اون به بعد دی گه نزدیک شدن به اون درخت ممنوع شد.	we were forbidden to go near it.
لیکن به عقیده من بسیار مشکل است که حضرتعالی بتوانید با او صحبت کنید	but I think it will be difficult for your worship to speak with her or see her
چنان وحشت کردم که ناچار شدند شبانگاه مرا از رختخواب بیرون آورند	I am so frightened that they are afterwards obliged to take me out of bed
به من امکان داد قدمت این سند را مشخص کنم.	enabled me to fix the date.
باز هم فقط اختیار یک سر طناب در دست من است.	I only had the management of one end of it.
ولی آخر این وظیفهٔ هنرمند است که جائی که آفتاب نیست آن را بیافریند.	but it is the artist's business to create sunshine when the sun fails.
خوب و وفادار هستم که من همان بنده درصحرا آب بوجود آورد	I am the good and faithful servant who brings water in the desert
همه به فکر جایی برای خوابیدن بودند که دیوارهای سمت چپ و راست آنان ناپدید شد.	all were thinking of a place where they could sleep, when suddenly the walls to right and left vanished.
چنان بنای ناله و شیون و زاری گذاشتم که	I raised such a lamentation that
من اول کمی نگران بودم و خیال داشتم آن را به تو بگویم.	I was worried at first and meant to tell you
در ین جا باید به زنان نیز همان حقی را داد که به مردان دادیم و خود باید معین کنند که تا چه حد زیبا و در دوخت و دوز هنرمندند.	wherein they had the same privilege with the men, to be determined by their own judgment.
محیطش هم ساکت و برای یک ادیب واقعا الهام بخش است.	the surroundings quiet and conducive to a literary life.
من دیگر میل ندارم دربارهٔ این موضوع سخنی بر لب جاری کنم.	I don't want to just now!
عاقبت مورد تعقیب قرار گرفتند و با دقت و توجه دنبال شدند	were finally gone in quest of, systematically hunted out
از حالا به بعد باید حواسمونو حسابی جمع کنیم.	we can't be too careful as to how we move from now on.
به یقین بدان که سر و کارت با خود اندوه و افسردگی است.	rest assured that it is to woe itself and affliction itself you come.
همان وقتی که شما اینجا بیمار در بستر افتاده بودید.	I was here when you were lying ill in bed
کمربند سرخ را دور کمرش بست و در کار تدارک جزئیات سفر به خانه شد.	knotted the scarlet sash about her waist, and began arranging the details of the journey home.
زمانی که پدر او به خانه رسید خیالم راحت شد.	I was relieved when her father arrived home.
