ولی به زحمت توانست تا به آخر پایداری نماید.	but he found it hard to keep himself going.
این حقیقت که موفقیت حتماً یک چیز تضمین شده نیست.	the fact that success isn't a guarantee
من به تو می گم که چی می دونم.	I'll tell you what I know
چون ممکن بود با آن به خودش آسیبی برساند	because of the possibility that the boy might wound himself.
با حرکتی سلانه سلانه که غیرقابل توصیف است از برابر پاسبان رد شد	preceded the jailer, with a rolling gait altogether indescribable
گفت که باز هم پول بیشتری در راه است	he said there'd be a lot more comtn'.
کتاب را خوب زیرورو کردم ولی چیز دیگری پیدا نکردم.	I ransacked it, but couldn't find anything else.
برای آنکه به همین زودی آن طور که ظاهر است دکتر خواهم شد و ضرورت قطعی ندارد که من با دکتر بودن احمق هم باشم.	because I am going to be a doctor, apparently it does not follow that it is absolutely necessary that I should be an imbecile.
گفتگویی با هم آغاز کردند که برخلاف مذاکرات خشک و جدی اربابان ایشان بسیار شیرین و دلچسب بود.	between them there passed a conversation as droll as that which passed between their masters was serious.
که البته به خاطر جوهر قطران موجود در رنگشان خیلی سریع و آسان گرفتند.	which, being creosoted, burned well.
کلمه ههون ههون را که در راه ادا کرده بود تکرار کرد	repeating the _hhuun_, _hhuun_, as he did upon the road
کارهایش نیز بدون هیچ نظم و ترتیبی در اینجا مانده بود.	leaving his affairs in great confusion.
با دشمن شاه درآویزد و او را شکست دهد و بر چندین شهر او دست یابد و همچنان از فتحی به فتحی بشتابد.	conquers the king's enemy, wins many cities, triumphs in many battles
که تا ارتفاع قریب به دویست گز رو به بالا انحنا یافته است.	shooting up to the height of about two hundred yards.
درست به اندازه من از این قضیه اطلاع دارید.	you know just as much about the matter as I do.
وجدانم به شدت معذب شد که به هر مستمسکی اجازه داده بودم از پیش چشمم دور شود.	my conscience reproached me bitterly for having on any pretext allowed him to go out of my sight.
سر خود را بلند کرد و دید در مقابل همان خانه و کنار در ورودی آن ایستاده است.	he lifted his head and saw that he was standing at the very gate of _the_ house.
خیلی خوب است. نزدیک است به کلی دیوانه این کوچولو شوم.	he is very nice. I am in a fair way to go out of my head over that little fellow.
ولی آنان را به سبب وحشیگری هایشان دوست نداشت.	but he disliked them for their boorishness.
به عقیده آن نماینده چون سکنه این دیار هوس کرده بودند که یاهوها را به خدمت خود بگمارند	that the inhabitants, taking a fancy to use the service of the _Yahoos_
حاضرند تا آنجا که برای آن دو میسر و مقدور باشد از دل و جان به وی خدمت کنند.	which, indeed, his personal worth and his honourable profession made incumbent upon them.
این مرد شریف و شایسته که در علم و دانش بضاعتی مزجات داشت	so this honest worthy gentleman, who had some tincture of learning
شرح حال نویس باید توجه همگان را به این نکته جلب کند که	the biographer should here call attention to the fact that
باعث شد که وی نتواند دعوتی درست و حسابی از اوبه عمل آورد	she was unable to give the full invitation she wished
بلافاصله با آرامی و صلح شترم را متوقف کردم.	I stopped my camel peaceably.
تو رنج زیادی به من دادی که تاب تحمل آن را بار دوم نخواهم داشت.	I have come, through you, to a knowledge of a pain so sharp that I do not think I could endure it a second time.
در این هنگام سری از پنجرهء کالسکه بیرون آمد	a head was put out at the window
بدین طریق رقص و نمایش به خرسندی و رضای خاطر تماشاگران پایان پذیرفت.	with this the dance wound up, to the great enjoyment of the beholders.
بدن خود را به داخل خم کرد تا کاملاً پنهان شود	leaning over the parapet the better to conceal his figure
اگر فکر کنم به خاطر از دست دادن من غمگین است هرگز خوشبخت نخواهم شد.	I should never be quite happy if I thought he was unhappy for the loss of me.
ناچار خواهی بود که در ظاهربعنوان دستیار من بیائی.	you'll have to come ostensibly as my assistant.
سپس ناگهان جستی زد و سبیل و بینی او را لیسید.	then suddenly jumped up and licked him right on his nose and mustache.
درست مثل یک قایق بادبانی که وسط دریا گرفتار طوفان شده باشد.	like a sailing ship set adrift.
ظاهرامردم در تعمیر خو نه هاشون دچار جنون شدن.	it looks like folks have gone crazy about rebuilding.
زیرا در این موقع صدای پای ناشناس روی پلکان بلند شده بود.	as a man's step was heard upon the stairs without.
که یقه هرکس را بگیرند و به بازداشتگاه بکشند چقدر احمقانه است!	whoever it might be, should be dragged to the lockup by his hair'?
هنگامی که ساکنان پانسیون پشت سر هم برای صرف صبحانه به سالن غذاخوری میامدند	when the boarders trooped into the dining room for breakfast
یا زخم برداشته و خونشان مسموم شده بود و یا به سوانح ناگوار دیگر دچار گردیده بودند.	or they had cut themselves, and had blood poisoning, or met with some other accident.
این قضیه کمی بیشتر طول کشید تا روشن بشود.	remained a little longer doubtful.
آنهم باوقار و متانت بی سر و صدائی که خاص اشخاص بسیار موفق است و بس.	singly as a rule, and with the noiselessvigor and reserve that characterizes the ultra successful.
حالا حتی یک ذرّه هم به آن چیزها علاقه ندارم.	I don't care a damn about all that.
من بسیار خوشوقت خواهم شد اگر آقایان زودتر به اینکار رسیدگی کنند	I shall thank the madg'strates to dispose of this here little affair
بی شک همان به بار خواهد آورد که در طبیعت اوست.	it will surely yield the same fruit according to its kind.
که او نیز از میان جمعیت راهی بازمی کرد تا خود را با و برساند.	as she made her way towards him through the crowd.
من انتظاری جز آن ندارم که به من اجازه داده شود بدون تا خیر به این امر برسم.	I demand no more than the opportunity to do so without delay.
ولی جلو خودش را گرفت و گذاشت قضیه فیصله پیدا کند.	but she struggled, and let it pass.
هیچ وقت مانع ورودش به خو نه خودم نمی شم.	I will not forbid him the house.
به شما هم واقعا از این بابت مدیون هستم.	I am really very much obliged to you
اگه کار ای نه بهتره آدم از گشنگی بمی ره	I ruther starve all over at oncet.
لکن در برخی از ساعات دشوار آدمی میل دارد بعضی از آشنایان در پیرامونش باشند.	but there are people whom to have near one is a blessing at such times.
برای آن نطق بلیغی و به اقناع آن بسیار کوشید.	harangued it andmade very great efforts to convince it.
از اینکه بالاخره درست حدس زده بودم خوشم آمده بود.	I liked that I'd finally guessed right.
آن قدر نزدیک که بتواند دستش را دراز نماید و آن دست عزیز را لمس کند.	, so close that he could have put out his arm and touched the dear hand.
هر دو تن برای بزرگ کردن واقعیت تخیل نیرومندی داشتند.	an equal quickness to imagine more than the fact.
پیش از آن در کشتی رنج بسیار برده و سخت خسته و فرسوده شده بودیم.	being already spent with labour while we were in the ship.
چه جور چند نفر را توی یک قایق دیده بودند	how some men came along in a skiff
مدادی برداشت و غرقه ی مطالعه ی اوراقی شد که به مشکل فعلی ارتباط داشت.	he took a pencil from a rack and plunged into the perusal of a complex report relating to the present complication.
تا همین چند لحظه ی پیش صحرا بی انتها و آزاد بود و حالا تبدیل به دیواری شده بود که نمیشد از آن عبور کرد.	the desert only moments ago had been endless and free, and now it was an impenetrable wall.
بلکه اموال و شغل خود را نیز کما فی السابق مالک خواهند بود.	but restores to him his fortune and his possessions
خودش هم برای امرار معاش مجبوره کار بک نه.	one who was compelled to work for her own living.
باید یک جوری به او کمک کنم. باید این کار را بکنم.	I must help him. I must.
که انتخاب کننده و صاحب عمارت مهتابی دار سه طبقه زیبایی است	who is an elector and the proprietor of that handsome house with a balcony
باری همین که تمام مقیمان کاروانسرا در مقابل دستگاه خیمه شب بازی جا گرفتند و بعضی نیز ایستادند	so, all who were in the inn being arranged in front of the show, some of them standing
من برای آرامش مردم یک قربانی به ایشان فدیه دادم	to appease the mob I gave them a victim
به قول خودم یخدان ترا به سوی کشتی برانند.	ordered them to tow my chest, as they called it, toward the ship.
همه چیز و به راش توضیح می دم باهاش مهربون میشم .	I'll be so good to her.
به زودی بازگشته اعلام کرد که همه جا ساکت و آرام است.	returned to announce that all was quiet.
چون مطمئن باشید که این توصیه مراعات خواهد شد.	for it shall be attended to.
صدای نواخته شدن آلات برنجی موسیقی و طبل را توأم با صدای هورای کودکان شنید.	he heard the distant brass instruments, the beating of the bass drum and the shouting of the children
که باز پایین بیاید و پرچم دیگر و چکش و میخ بر دارد و آن را به دکل بکوبد.	that perch, to descend again for another flag, and a hammer and nails, and so nail it to the mast.
پسر کلنگ برداشت و در مقابل درجدولی را که از گل پر شده و راهش گرفته بود پاک کرد.	the son took his mattock and cleared the little gutter in front of the door which the mud had obstructed.
منتظر رفتن میهمانان او شد تا سر گفتگو را باز کند.	where he was walking about waiting for his guest's departure.
به سمت انتهای راهرو دویدند اما در آن جا با یک در بسته مواجه شدند.	right to the end of the corridor where they slammed into a door ' and it was locked.
بدرودی اندیش ناک و شیرین با یک جان بدبخت بود.	it was a gentle and pensive farewell to an unhappy soul.
در برابر هر یک مرد ده تا زن وجود داره.	I venture to say there are ten women to every man.
هرلحظه منتظر بودم که صندوق من دو پاره شود.	expecting every moment to see my box dashed to pieces
او از یک خانوادهٔ نجیب است و هرگاه تصمیم گرفته بود این پول را برباید به نظرش سرقت نبود بلکه استرداد مال خودش بود.	for he is a gentleman born, and if he did bring himself to steal, it would not be regular stealing
مثل مردمی که از خستگی جانشان در رفته باشد	as people usually are who are nearly tired to death.
چون وقتی علی بابا داخل غار بود درب خودش بسته شد ولی وقتی بیرون آمد درب همچنان باز بود .	for it had shut of itself while he was within, but remained open while he was out.
در محلی که جای دو مرگ خوار خالی مانده بود ایستاد.	stopped, staring at the space large enough for two people
بی آنکه توجهی به زمان یا عوامل و شرایط دیگر داشته باشم	without any regard to time or other circumstances, while I strictly adhere to truth.
زیبارو با موهایی سفید چون مهی سیمین رنگ و ریشی اصلاح شده	handsome and pale in a silvery mist of white hair and clipped beard
جادوگر قد بلند بود و سبیل باریک مشکی داشت.	the other was tall and strapping, with a thin back mustache.
نیز در این جا مقام سلاح جنگاوران را در خواهند یافت	here you will find arms in their supreme excellence
دید که هم سفرش در کنار یک ظرف آبجو با کارگری خودمانی و دوستانه مشغول صحبت است.	he found that worthy in close fellowship and communication with a labouring man, over a pint of ale.
بر سر سفره چشم از معشوق برنگیرد و پنهان از حاضران به جمال او بنگرد	all the time he will never take his eyes off her, stealing stealthy glances, unnoticed by those present
والاّ خدمت و رفتار و اطاعت نمودن به میل و هوس خانمی جوان و خوشگل	even to gratify a pretty woman, which is
با سینی چای و مقداری کیک وارد اتاق شد.	bearing a tray of tea and crumpets.
من نیاز سریع و عجیبی به پلک زدن داشتم. مثل اینکه به خورشید خیره شده بودم.	I had an odd urge to blinklike I was staring at the sun.
حق اینست که به همه مهر باطله یا علامتی زده شود	would deserve, each of them, to have a sambenito put on it
حالا به ما کمک کنید و به این ترتیب جبران کنید.	help us now and so atone.
دو بار هم آن را روی پایش انداخت و پایش درد گرفت.	twice he dropped it painfully on his foot.
درنگ کردم.سعی داشتم راهی پیدا کنم تا چند ثانیه تنها باشم.	I hesitated, trying to think of some way to get a few seconds alone.
من در حال حاضر کمی برای جانشین پیدا کردن برای او دستم تنگ است.	I'm a bit stuck for a replacement at the moment.
دکتر که از قیافه جذاب و متین ربرتا خوشش آمده بود	pleasantly and reassuringly, impressed by her attractive
که همه را به شک انداخته بود که آن ازدواج به خاطر عشق نبوده	that it seemed as if she had done so not for love
با خشونت از وی پرسید که جزو ابو ابجمعی کدام هنگ هستی و فرمانده تو کیست	in a stern voice asked him to what regiment he belonged, who was his commanding officer
سنگ هم مثل چیزهای دیگر آفریده خیال من بود.	I dreamed about the stone, as I did all the rest.
مرد چاق و دختر کوچک بیدار و ساکت دراز کشیدند.	the fat man and the little girl lay awake in silence.
من این پا و این چشممو از دست دادم .	I lost this here leg and this here eye.
از من بشنو و باور کن که ما بهتر از شما اطلاع دایم	we are as well informed as you
من نمی تونم سنگینی بار یه هم چین مسئولیتی رو روی وجدانم تحمل کنم	I can't have that on my conscience.
عکسی که او به من داده بود نگاه کردم.	 I looked at the photo she had handed me.
بر آن تختی خوابیدم که در اتاق ته کشتی بود.	I lay down in the old little bed in the stern of the boat
اما بعد از این هم دیگر سراغی از او نخواهند گرفت	they'll ask no questions after him
تقاضا خواهم کردکه دخترم ثروتش را در جای امنی بکار بیندازد.	I will demand that her money should be invested in her own name.
همین قدر که هوای خود را داشتند بیش از توان ایشان بود.	more than enough was it for them to look to themselves.
که او در این جنگ بیست و شش اوت نشان داد	has shown or displayed in the battle of the twenty sixth
هر تیر و میله ژرخ که در هوا به حرکت درآمده ما را بسا ید.	when every flying beam, and shaft, and wheel, is grazing you.
اما باید همه چیزهای جزیی رو به من بپرداز ین.	but I must bepaid for all those little things.
به خصوص که هیچ یک از دو یار او حاضر نبود در این کار به دیگری تسلیم شود	particularly as his two comrades would not yield
چند تن از آنان شوخ چشمی را به جائی رساندند که تیر بس وی من افکندند	some of them had the impudence to shoot their arrows at me
میخ وام بهش به گم قبل از این که قیمتش بیشتر پائین به یاد همه رو بفروشه.	I am telling him to sell out at once before they drop any further.
با فروختن یکی از هفده ماهی کوچک طلایی پول کتاب را تهیه کند.	got some money by selling one of the seventeen little gold fishes left in the workshop
که مرا شتاب داد که از شما معذرت بخواهم.	which induces me so readily to excuse you
چنانکه سرانجام دوباره نیرو و سلامت خود را به دست آورد.	she began to recover physically.
زیرا مرد بازوان خویش را تنگ به گرد خود تافته داشت.	but, in vain, for he slept with his arms crossed upon him
وقتی درست حسابی کافئینه شدم دربارش بهت می گم.	I'll tell you about it once I'm properly caffeinated.
او را در قلب جنگل که ایمنی کافی دارد جا بدهم و خیالم را از بابت مراقبت دائمی او آسوده کنم.	in the heart of a wood, made my conscience recoil from the arrangement.
برای خودم دلایلی دارم که دقیقاً به فکر وضع تحصیل او باشم.	I have my own reasons for thinking her a curious study
در این مورد یکسره آن احوال و عادات را از یاد برده بود.	they were rather out, in this particular instance.
این دختر را تنها به خاطر ازدواج با مردی فقیر از خانواده و ارث محروم کردند.	to cut off the girl from the family protection and inheritance only because she had chosen a man who was poor!
نه اصلانشان داد که متوجه حضور من در اطاق شده است.	nor notice my presence in the slightest way.
او تندیس بهت و حیرت و نومیدی شده بود.	his face a perfect statue of surprise and disappointment.
با یک تکه روی پوشیده شده بود و همیشه بسته بود.	with a sheet of zinc and kept constantly closed.
همه در کنار هم و در یک طرف راهرو قرار داشتند	were all in arow and on one side only of a corridor
شاید هم امکانات کافی ندارد که در خارج شهر زندگی کند.	perhaps she may not have resources enough in herself to be qualified for a country life.
خوب کاری کرده بودم که به ان جا رفته بودم.	I was right to come here.
ناگزیر بودم که افکار او را دوباره متوجه موضوعی کنم که برای من ضرورت حیاتی داشت.	I was obliged to recall him to a theme which was of necessity one of close and anxious interest to me.
اون وقت اوقات تلخیم از می ون می ره	, it's all down again
فوراً آماده خواهی شد هر کاری که باعث نزدیک شدن تو به آن هدف است انجام بدهی.	you will be ready to do at once whatever furthers that end.
اما این پیرمرد وفادار به این نکته توجهی نداشت.	but the true hearted old gentleman never calculated about that.
صورت دخترک را در میان دو دست خود گرفت و بوسید.	he caught her face between his two hands and kissed her
حالتی شهبانووار داشت و اندیشه و دانش در نگاهش هویدا بود.	yet queenly she looked, and thought and knowledge were in her glance
تمام روز را از فک اسفل او تاب خورد.	swing all day upon his lower jaw.
بنا بر قوت مزاجی که طبیعت برای او داده بود به همین قدر قلیل از غذا تقریبا به همان حال نخستین خود برگشت و در خود دیگر ضعفی و فتوری ندید	thanks to the vigor of his constitution found himself well nigh recovered
راسکلنیکف گویی سخنان خود را از پیش حفظ کرده بود	he repeated it as though it were a lesson
وقتی پروفسور لو پین از در وارد شد همه مشغول گفتگو بودد.	were talking when he finally entered the room.
کلاید حق نداشت تعالیم دوران نوجوانی خودشو فراموش کنه.	clyde should have remembered the teachings ofhis youth.
اگه ماشیون رو طوقه هم برونم بهتر از ای نه که یه شاهی به این مادر به خطا بدم	I'll go on the rim before I'd give that son of a bitch a dime.
همین باعث شد که عصای نی ین تا چهار روز ظاهر نشود.	for which reason the reed delayed its appearance for four days
ابرهای انبوه خورشید را یکپارچه بلعید و آماده شد تا آتش آسمانی را به رزمین ببارد.	as the vast deep clouds swallowed the sun whole and prepared to spew solar fire over the earth.
زیرا که حتما کسی از طرف پلیس به او مراجعه کرده	for someone must have been to see him from the police
چنانکه از گفتار و کردارش به خوبی مشهود است	as they might perceive by his deeds and his words
بولست رود به راستی از بازگشت او وحشت داشت.	that certainty was a terror.
اندیشید که این تصمیم نهایی به شک و تردیدهای او خاتمه خواهد بخشید.	thinking that that final decision would put an end to his doubts.
ذوق و قریحه جهان داری او شایسته تحسین است	endowed with admirable talents
بدبختانه برای بسیاری زا بینواهای صنعت شیلات همین گونه هم هست	such, alas! it proves to many a poor wight in the fishery
اندکی توقف کرد و با فرمانده هنگ سخن گفت و به طرف آتشبارهای بالای تپه رفت.	halted, spoke to the commander of the regiment, and rode up the hill to the guns.
یکی از ظروف پر از کف صابون را برداشت	caught up a bowl of soap suds
به خاطر همین هم مادرم زیاد به فکرش نیست.	that she does not think much about it.
هر ناخدا یک جلد از این مجموعه در اختیار دارد.	every captain is provided with it.
جز یک راه برای نجات دادن خود و آسوده شدن ندارد و آن اینست که بندهای کیسه پولش را در اختیار زنش گذارد.	there is but one way of extricating himself from the quandry and of procuring peace, and that is to let his wife control the purse strings.
اما سه روز پشت سر هم هیچ اتفاقی نیفتاد.	but nothing happened during three days
از داخل آن یک بسته که کاغذی به اطرافش پیچیده شده بود بیرون آورد.	taking from it a parcel wrapped in paper,disclosed
من از پست امروز یک بسته شکلات داشتم و عکسی که همیشه دوست داشتم از رویش کپی کنم .	I had a box of chocolate drops, and the picture I wanted to copy,
برای من همان قدر که در اختیار تو باشم	for so long as I am thine
بعد با محبت تمام دست پسر خود را فشرد	pressing her son's hand, affectionately
زیرا برای چنین امری دو ساعت وقت کافی بوده و حال آنکه پهلوان بیش از چهار ساعت بیدار مانده است.	for all requirements were satisfied by a watch of two hours only, while he had been more than four about it.
بدن او ً آفتاب سوخته سفیدی شورت در زمینه چشم رامیزد	their whiteness was nearly dazzling against his tanned skin
اخیرا از مشایعت کاروان دولتی مراجعت کرده و خبر آورده است	had recently been away driving a government transport, had returned with news
