جوان تر ین پسر او نزد او نشسته بود	his youngest son, sat next to him
مثل این که در آن طرف اتفاق جالبی افتاده باشد و او بخواهد آن را به دقت ببیند.	if he had discovered something of interest going on in that direction.
جاذبه دل انگیز طراوت آن از بین خواهد رفت.	the sweet charm of freshness would leave it.
صورتش را به دقت دیدم و همه چیز را درک کردم.	I saw his eyes and understood all, at once
همه چیز را به دور افکنند و به هر طرف که میسر باشد بگریزند.	might have thrown up everything and run away anywhere.
یارو میاد به چادرتون سر میز نه میخواد به بینه دی گه چیزی دار ین بخور ین یا نه	he'll look in your tent an' see if you got anything lef' to eat.
قدری توتون دیگر با نوک چوب کبریت درونش جا داد و بعد کبریت کشید.	poked a few wisps back inside the tube with a match end, struck the match and lit up.
کاملاً راست نشسته و دستهای خویش را روی یکدیگر بر یکی از زانونها گذاشته بود	sitting perfectly upright, with her hands folded on one knee, and looking grimly on the speaker.
هیچ درکی از مقاومت در برابر آن نظام نبود	at the same time no notion of trying to resist.
که پدرش با تمام وجود آرزو داشت آن را پاره کند و پرت کند به صورت رؤسای جمهور	which his father desired ardently to tear and fling into the faces of presidents
که این دویست هزار نفر با هم پیکار خواهد کرد.	the thing is that these two hundred thousand men will fight
هرچند که رفتن هنری از نظر او هیچ لطفی نداشت.	however disagreeable to her his going.
روی خود را به پنجره که حاشیه سفیدی از یخ داشت کرد.	with his face turned to the frosted window.
او تحمل راه انداختن یک زندگی با مسئولیت در یک شهرستان کوچک را نداشت	he couldn't stand a decent respectable life in a little country town
تابوت ساز که دوباره عازم فرار بود گوشه کتش را گرفت.	catching at the undertaker's coat, as he once more moved towards the door.
اما با چهارده تا می تونی یک لیوان نوشیدنی شکلاتی داغم بخوری.	but for firteen you get 'ot chocolate
کاغذی مچاله شده را از جیب شلوار جین ام که از دیروز در ان جا بود در آوردم و نشانش دادم	I pull the crumpled ad out of my jeans pocket, where it's been since yesterday.
چمدانم که شب قبل آن را به آنجا آورده بودند طناب پیچ شده و در کنار در بود.	my trunk, which had been carried down the evening before, stood corded at the door.
شیر نر در قفس جلو ارابه است و شیر ماده در قفس عقب	the male is in that first cage and the female in the one behind
صورتش را با شال پوشانده بود تا کسی نه از او سؤالی بکند و نه از شوهرش.	her face covered by a mantilla to avoid questions for herself and her husband.
خشم شعله کشید و از ظلم زندگی به شدت مغموم و دل شکسته شد.	anger flamed in her at the unfairness of life.
با نهایت خونسردی خانم سرپرستار را در آغوش گرفت.	deliberately kissed the matron.
تا صبح روز بعد آن را برای آقای کازوبن بفرستد.	he might send it in the morning.
از ایشان نیز هر یک نزد آن دیگران معمایی چنان سر به مهر بود که گریی در کالسکه شش شصت اسبه دیگری نشسته است	they were mysteries to one another, as complete as if each had been in his own coach and six, or his own coach and sixty
با قیافه پرمعنی و بی اعتناء از برابر در گذشت و نگاهی به داخل اتاق پذیرایی انداخت	passed by it with a dignified and indifferent air, glanced into the little drawing room.
هر دو دستم را در موی او دفن کردم.	I buried both my hands in his fur.
اما شراب و عرق نیشکر و کنیاک و لیکور در میخانه بویی تند تر از طعم خود داشت	but the stock of wine smelt much stronger than it ever tasted,so did the stock of rum and brandy and aniseed.
به همین خاطر بود که دفعه قبل متوجهش نشده بودم.	which is why I didn't spot it during my previous visit.
بی آنکه لذت گرفتن دنبش را میان پاهایش حس کند فرار خواهد کرد.	he'll sneak off without the poor satisfaction of feeling his tail between his legs.
سپس چون تشخیص داد که به قدر کافی او را به خاطر جنایات مرتکبه تنبیهش کرده	having, by this time, inflicted as much punishment as she deemed necessary for the offence
من دی گه از این جا دربیا نی سم.	I ain't ever going to shake them any more.
از آن پس چون بنابر عقیده مردم متعصب کانون کفر بشمار رفته بود.	was, according to the zeal of those people, looked upon as profane.
این وسیله دور خودش می چرخه و چراغش روشن می شه.	it's supposed to light up and spin.
تا بتواند جواب منفی بدهد و بگوید که همه چیز خاتمه یافته است.	so that he could tell her no, that everything was over
به این نتیجه رسید که احتمال زیاد دارد برای پیدا کردن آبجو برای جو سفری طولانی بود.	but the half mile walk down to the village to find out seemed a long journey to him.
به نظرم دنیا به خیلی چیزها بیشتر از تابلوی نقاشی احتیاج دارد.	it seems as if there were so many things which are more wanted in the world than pictures.
شماها بروید توی حیاط و تا موقع زنگ سر خودتان را یک جوری گرم کنید.	I think you'd all better go out to the playground and amuse yourselves until the next lesson.
در نقاط مختلف همان حول وحوش مخفی شده بودند.	in hiding in different places round about
ولی بهر حال امکان داشت به همچنین روزی گرفتار آیم	but that I might have done so
روی چرخ دستی خم شد و شروع به دویدن کرد.	leaning forward on his cart, he broke into a heavy run
در هیچ جای کشور مثل اینجا مردم کوته فکر نیستند	there is no part of the county where opinion is narrower than it is here
من منتظر طبیعی هستم که بدانم پدرتان زنده خواهد ماند یا نه.	I am waiting till the doctor comes to know if there is any hope of your father's life.
بعد نیز پوست و استخوانی بیش از او باقی نماند.	then her bones were starting through the skin.
تا همه مردم از آن محظوظ و مستفیض گردند!	for the universal entertainment of the people!
اما هر لحظه امکان داشت دوباره حواسش متمرکز شود	but it was quickly getting over that
مسیو مورل مخارج تکفین و تدفین او را متحمل گردید و مختصر قروضی که ایام بیماری به هم بسته بود از کیسه خود داد	MMorrel paid the expenses of his funeral and a few small debts the poor old man had contracted
شوهر ظاهرا برای تبرئه خویش در مقابل مرد بیگانه آهسته به همسرش	said her husband to her in a low voice, evidently only to justify himself before the stranger.
بار دیگر از تپه پایین آمد تا از آن پس خود را وقف بازسازی کند.	he strode down hill again resolved henceforward to devote himself to the furnishing of the mansion.
البته رضایت جیم را با دادن چند گیلاس آبجو به دست آورده بود.	the latter's consent being obtained at the expense of several glasses of beer.
فقط امروز بود که برای اولین بار دیدم ممکن است بتوانم تنها با او صحبت کنم.	it was only today for the first time that I saw a chance of having a few words with her alone.
به کشتی آمد تا با فانوسی غنایم جنگی را بازرسی کند.	came to check the booty alone with a lantern.
طولی نخواهد کشید که به اندازه خود من قوی و کارآمد خواهی شد و به کمک من احتیاجی نخواهی داشت.	soon you would be as strong and apt as myself, and would not require my help.
گویی چون نوری متحرک به او منتقل شده است.	it looked as though it had passed like a moving light, from him to her.
لوسیند نیز با هزاران قسم و غش و ضعف این قول را تأیید کرد.	she confirmed it with vows and swoonings unnumbered.
ما به این جهت این سخن را به خود گفتیم	we said so because we had nothing to fight for there
به شرط آن که حاضر باشید مبلغی برای جبران خسارت به من بپردازید.	if you are in a position to pay the indemnity stated in the contract.
زن پرستار تا دو ساعت بعد هنوز نفهمیده بود که او مرده است.	that her caretaker did not realize she was dead until two hours later.
که بسیار روشن بیان شده و بعلاوه تهدیدی هم هست که اگر من بیایم او فوراً خواهد رفت.	put in very significantly and plainly, and there is besides a threat that he will go away at once if I am present.
روی تخت دراز کشیدم و قضیه را چندین و چند بار در ذهنم مرور کردم.	I lie in bed, my heart hammering, going over it again and again.
همه فهمیدند که او از اهالی خود آن شهر نیست	no one doubted that he came from far away
تا اینکه اندکی بعد در آهسته باز شد و پیشخدمت وارد شد.	until after a while the door of the room opened softly, and the butler came in.
مگر اینکه قبول کنید با آرامش به خانه برگردید	but to submit quietly and return home
سپس به پشتی تکیه داد و چندین نفس عمیق کشید.	leaning back he drew several deep breaths.
که چگونه مطلب مهمی را که باعث آمدنش به اینجا شده بود عنوان کند.	how to broach the so much more important matter that had brought him here.
یک بار مردی که چاقو خورده بود با کاردی در پشت از اتوموبیل در حال حرکت به بیرون پرت شد.	once a man who had been stabbed, ejected from a moving car with a knife in his back.
سروان تر نر اخمی کرد و گفت مایلم با برقکار ی که روز قبل از حادثه به ان خانه رفت صحبت کنم.	I'd like to talk to the electrician who went out there the day before the fire.
دستی مثل آهن سوزان بر وجودم چنگ انداخته بود.	a hand of fiery iron grasped my vitals.
که غیرمترقبه آن خبر را شنیده بود مثل همیشه لباس پوشیده بود.	he was dressed just as he had been when he first heard the news
در این صورت چکش تنها بدرد متلاشی کردن مغز من خواهد خورد.	I should only smash my skull with the hammer!
کاری نکن که بار دیگر متوجه وجود نحست بشوم.	don't remind me of your existence again.
من می خوام بدونم موضوع چیه تا بتونم در این بحث شرکت کنم.	I want to know so that I can argue with these thoughts.
حاکی از نفرت و تمسخر است و دختر میکوشید از روبهرو شدن با او بپرهیزد.	expressed a feeling of hatred and contempt, and she tried to avoid meeting him.
از افسر دیگر به سبب مستقیم نبودن صف ایراد گرفت و قرق رکنان به گروهان سوم نزدیک شد.	at another because his line was not straight, he reached the third company.
نتوانسته بودند مرا که تا سینه در آب فرو رفته بودم تشخیص دهند	could not discern me, who was up to my breast in water.
اما دلیل وجود ندارد که وی زندگی خود را تباه کند و به خاطر یک زن بد و بیایمان شخصاً رنج ببرد.	but there was not, and there could not be, any sort of reason that his existence should be troubled, and that he should suffer because she was a bad and faithless wife.
که از آن زمان تاکنون کتاب را در همان جا نگه داشته بود یا جای دیگر!	whether she had kept it there ever since
به طوری که چون به دربار پادشاه بزرگی در آید قبلاً با کارهای خود شناخته شده باشد	such that when he betakes himself to the court of some great monarch the knight may be already known by his deeds
با خوش خویی و دل زندگی او ارتباط داشت	was as kind and hearty
نفس عمیقی کشیدم و به وی او را استشمام کردم.	I took a deep breath, pulling in her scent.
زن تناردیه به وی غرولند کند و کتکش بزند.	theThenardier would scold and beat her.
اما وقتی حرف بزند بهتر آن است که خوب گوش کنی.	but, when he does speak, then you may well listen.
اما به گمان من دلیل دیگرش بهبود وضعیت خودش بود.	but also, I suppose, to better himself.
شایعه پیشنهاد خواستگاری برادر زن تو از او یا موضوع دیگری نظیر آن به گوش من رسیده است.	have heard reports of your brother in law having sought her hand, or something of that kind.
من با احتیاط لباسا رو بین دندونام گرفتم آه و او نا رو بین درختا بردم.	I took the clothes gingerly between my teethughand carried them back to the trees.
زیرا خوب میدانم که او احتیاج به پشتیبانی شما داد گول زده است	he evidently needs support, I quite see that! .
با چه توجیهی گذاشتی اون دختر در قعر دریاچه بمو نه	how can you justify your leaving that girl in that lake
نیاکانشان با کار و کوشش و عادات نیک اجتماعی آنجا را به زیباترین شهر در استان تبدیل نموده بودند.	with their work and their good habits, had transformed into one of the finest towns in the province.
با چشمانی پر اشک پیپ خود را زیر لب گذاشت.	resumed his pipe with tears in his eyes.
به تصور اینکه تمام ملاحت گفته او در آن یک کلمه نهفته است آن را آهسته برای یکدیگر تکرار کردند.	the one coarse word she had used, supposing the whole sting of her remark to lie in that word.
با نگاهی حریصانه میهمان نور رسیده را جستجو کرد.	eagerly sought thenew comer with her eyes.
آن گاه از کاری که کرده بود به وحشت افتاد.	was appalled at what he had done.
عقیده دارم حتی ممکن است مرا هم دوست بدارید.	I think you ought to love me
چنانش سخت و محکم به باد کتک گرفت که وی را با وجود سلاح رزم برتن مانند گچ کوبید.	notwithstanding and in spite of his armour, he milled him like a measure of wheat.
چهار نفری خودشان را به پشت در اتاق نشیمن رساندند.	all four of them crept towards the dining room door
تا وقتی به یه نخ دی گه نیازمند به شم همین یکی کافیه.	one is enough till another is wanted.
دستم لرزید و گیلاس از دستم افتاد و شکست و شیر بشکه را غلطی چرخاندم	I broke one glass and fouled the tap
تا به امروز این لفظ را در سلاطین شنیده بودم.	I thought, sir, that it was kings alone who abdicated!
معناً بیشتر ستایشش میکرد و سعادت خود را بیشتر ارج مینهاد.	morally bowed down lower than ever before her, and prized more highly than ever his undeserved happiness.
در برابر این تصمیم او نه تعجبی از خود نشان دادم و نه کوشیدم که او را از آن کار منصرف کنم.	I neither expressed surprise at this resolution nor attempted to dissuade her from it.
زیرا اکنون مراقبت او به من محول شده است.	because I wait upon him alone in his room now.
وقتی پا به این سرزمین گذاشت فقیر بود ولی از فقر هم نترسید.	when he come to this country and was pore, that didn't scare him a mite neither.
توقع نداشتم که تمام این پول را تو به رام تهیه کنی.	I didnt expect that you could get it all for me
امیدوارم در سپردن مدیریت بیمارستان جدید به دست ایشان محق باشم.	I hope to find good reason for confiding the new hospital to his management.
با فروتنی آن را به روی زانو نهاده بود	white hands meekly folded on his knees
به این دلیل حال که پیدا بود مشکلی پیش آمده است درمانده بود که که چه رفتاری در پیش بگیرد.	he was puzzled as to just what attitude to assume in a situation where obviously something was wrong.
قسمت عقبی کشتی را به صورت زرادخانه کشتی درآوریم	to make a garrison of the stern part of the ship
به طرف حمام رفتم تا نگاهی به خودم بیندازم.	I walked to the bathroom to check for myself.
من هیچ گونه رحم و انصافی درباره اش ندارم.	he has no claim on my charity
اگه بلد بود چه جور باید آب بارون زیگیلشو خوب کنه	if he'd knowed how to work spunk water
منم کردم و بعد هر سه نفری راه افتادیم.	I done so, and then we all three started on again.
که به ویژه در پرورش کیش نسبت به پیروان خود به شدت خشمگین شده باشد	especially in inculcating the religion of rowing.
خیلی چیزها را از دست داده بود و اگر شوکه شده بود اصلا تقصیر او نبود.	to cry for the things he had lost, that he had a right to be in shock if that was what this was.
آن گاه از جایش برخاست و دنبال مدیر هتل از سالن غذاخوری بیرون رفت.	standing up quickly and following her from the dining room.
مبلغ یک صد هزار فرانک زیادی طلب شما ماند.	there is still a sum of one hundred thousand francs?
زمانی که پیرمرد از من خواست تا پدرخوانده باشم	when you old man asked me to be a godfather
زیرا در دنیا کارهای آبرومندتر و پردرآمدتری از قبیل بنائی وجود دارد.	while there's an honest trade to be learnt, or brick making to turn to.
آن را نیافت. بار دیگر نومیدانه عقب آن گشت و آن را یافت.	she searched for him where he was not, she searched again without hope, and she found him
که در این سرداب بیست و پنج میلیون وجه نقد تمام طلا بود	the pouches contained 25,000,000 of money in gold
این را به خود قول داد و کوشید تا قولی مردانه باشد.	he vowed, and hetried to make it valiant.
چون به عادت همیشگی آماده خنده و مسخرگی بود	embracing him as he had done before
زیرا به اندازه کافی سر ما شلوغ هست که نگو و نپرس	for our places are hard enough.
جی رینگ جی رینگ به در و دیوار خورد.	pinged off the walls
دست راست وی همیشه به قنداق آن چسبیده بود	his hand, which was always on the butt of the pistol
تا چنانچه ناگزیر شود از آن سگ استفاده کند	so that, in case he was driven to use the dog
زیرا کسی این برج را تمام خواهد کرد که به آنان غذا بدهد	for he finishes the building who feeds them.
که تا سخن دوستش به پایان نرسید لب از لب نگشود.	that, except to say what has been already mentioned, he did not open his lips until the other had finished.
باز خو به تو خوابت ای نا یادت بود.	I'm glad your dreams could take even that much trouble about us.
اما تو اگر شتاب در دیدار ایشان نمایی بهتر است	but you were right to return as soon as possible my boy
آب سرد را تا آخر باز کرد و بعد مشتی آب به صورتش زد.	ran the cold water on full, and then splatted cupped handfuls against her cheeks
کارگر جوانی در کارخانه سه چهار ماه بعد از ازدواجش همسر خود را باردار کرده	that he had been approached by a young working man in the factory, newly married, who
باز او موظف است زیر لب سخنانی زمزمه کند	he is bound to say certain words between his teeth
او با خضوع و خشوع تمام در برابر اربابش به زانو درآمد و خواست تا دست وی را ببوسد.	who came in very humbly, and falling on his knees begged for the hand of his master
اما تردیدی نیست که خندید و سرخ شد و سپس فریاد زد	but certainly she laughed and blushed and then cried out
گذشته از این ما دو متحد نیرومند هم داشتیم که یکی آب بود و دیگری هوا.	besides that, we had two able allies rum and the climate.
ولی قبل از او عدهٔ کثیری داخل تالار شده بودند.	but a number of men had already made their way in, and met him.
خود را در نیم تنه پوست پیچیده روی زین نشسته بود	glittered more than usual, and as he sat in his saddle
شما برده موهومات و شهواتید و هرگز سایه یک فکر شخصی در ذهن یا قلب شما مشاهده نخواهد شد	you have no chance of ever fathering the pettiest idea of your own.
همه چی سرش ون می شه اما هیچ وقت بروز نمی دن.	they know things'jus' don' let on much.
واقعا حماقت به خرج داده که به این شکل به فکر کمک به دیگران آنهم یک کارگر کارخانه افتاده است.	was foolish to be helping anybody else in this way particularly a working man.
بعد دست خود را در برابر نور شمع حایل ساخت	shading the flame of the candle with his hand
چیزی را به دهان نگذارد مگر این که او قبلاً قسمتی از آن را خورده باشد	not to eat anything he had tasted
گو اینکه برف تمام زمین را مستور کرده باشد	if the snow was on the ground
ظرفی به سوی دیگر پرتاب شده بر مغز شخصی تازه وارد فرود آمد.	flung it full at that young gentleman.
یکی دو تکه از آن را بریده بودند .	only one or two slices had been cut from it.
صاحب جریب در جریب زمین سبز که در جلوی چشمانش گسترده شود.	he wanted to see his own acres stretching green before his eyes.
به خاطر همین بهتر از آن چیزی بود که اِما انتظار داشت.	therefore better than she had expected.
من برای تو شرح خواهم داد! همه چیز را خواهم گفت.	I'll explain it, I'll explain all to you.
به اضافه یک پاداش 5000 دلاری برای اولین محموله که به فاصله ده هفته از حالا خواهد بود.	plus a five thousand dollar bonus for the first shipment, which is due ten weeks from now.
که فراخوانی نشست ویژه مانع از آن خواهد شد	that the calling of a special term was likely in any wayto prevent
تصمیم گرفتم خانم دانورس را تنبیه کنم به همین سبب مداد قرمز را برداشتم و سراسر صورت را خط زدم.	I put a pencil through the list.
باز پیش رویش انسانی بود دردمند و شاید استخوان شکسته.	in front of him, also, was a human creature, in pain and perhaps with a broken bone.
تا باران چنین مهری را از دستهاشان به یکدیگر انتقال دهند.	soak it in through every pore.
البته از لحاظ نسبت این رقم بسی ناچیز است ولی از جهات دیگر اهمیت خاصی دارد.	a relatively insignificant number, no doubt, but remarkable enough from another point of view.
ژول ین در کنار او خوابید و او را در آغوش گرفت	he took him into his bed, held him in his arms
دیگر هیچ نیرویی قادر نبود از نومیدی مطلق بیرونش بکشد.	there was no power on earth that could raise him from his prostration.
اگر پای مقایسه با آقایان متشخص به میان بیاید	when he came to be contrasted with gentlemen
تا شنل او را از دوشش بردارند و عصا و کلاهش را بگیرند.	to help him off with his cloak and take his hat and stick.
من از شنیدن این جور خبرها خیلی ناراحت میشم	I always hate to hear of anything like that
