باورم نمی شه بازی شب پیش رو از دست دادی فقط واسه اینکه خوابیدن یه نفر رو نگاه کنی.	I can't believe you missed the game last night just to watch somebody sleep
مطمئن باش که شد.	I assure you she did.
همه مجبور شدند منتظر من بمانند.	I made us all late
دکتر گلن حالت روحی ربرتا را در آن هنگام که به مطب او رفته بود شرح داد	to describe the state of mind in which she hadapproached him
با تعجب و تاسف دیدگان او را لبریز از اشک یافت.	she was surprised and saddened to see that there were tears in his eyes.
ما مو ندیم و بقیه رفتن.	we stayed behind
در مواقع ضرورت با صاحب نظران و مردان کار مشورت کند	consulting experienced theoreticians and practical men where necessary
از روی مطالب مختلفی یادداشت برداشتم	various subjects for annotation have presented themselves
راننده ماشین راننده شخصی نبود بلکه پاسبانی بود که با غرور تمام اونیفورم به تن داشت.	driver not achauffeur but a policeman proud in uniform
با حالت خشکی گفت	he said coldly
که با من سابقه آشنایی دارد	e, who is under some obligation to me
معمولا من روزی ده تا ایمیل داشتم	I normally get about ten emails every morning, if that.
سوای جنگ دو خاطره داشت	out of the war he carried two memories.
زن جوان خیلی جذابی است.	a very pleasing young woman.
اما به کاری دست نبرد.	but, no more was done.
تا پیشنهاد رفع اختلافی را بدهد که در یک مسأله بسیار مهم فلسفی بین آن دو پیدا شده بود.	to clear up a difference that had arisen between them on a very important philosophical question.
اما هیچ یک از ما آن را در غالب کلمات پیش نکشید.	but neither of us put words to it.
نفس در سینه نگاه دارد	hold our breath
پاکتی چرکین و نگشوده را پیش روی او گذاشت	laying a soiled and unopened letter before him
پیرمرد انگشت بر لب نهاد	he laid his finger on his lip
من یک هفت تیر در دستم هست!	I old a pistol in my hand!
صفحه و همه چیز دارن.	have pages and everything.
وقتی گفتم خودم را نشناختم.	I didn't recognize my voice when I answered.
او به یک جست از روی قربوس زین پریده و بر پشت مادیان جا گرفته است	she cleared the back of the saddle in one jump
در را باز کنید.	open the door!
ناگزیر تصمیم گرفتند که آرام بگیرند	so they thought it best to allow themselves to be pacified
من هم دوست نداشتم.	I didn't like it, either.
کتابهائی را می خونم که ممنوعه.	I am reading forbidden books.
البته با مغز سالم.	with a sound mind.
برای انجام مأموریت جدیدم به راه افتادم.	drove off upon my new quest.
من هم پسری دارم	I have a son too
این خوشی است	that is joy
شعورش فقط به اندازه یک مرغه.	for she hasn't the sense of a guinea hen.
عظمت این سپر انداختن خود را در حالت نشستن او نمایاند.	the enormity of her relief showing in the way she sat
حال باید بیهوده در میان دشت بایستیم.	now here we stand in the middle of a field without rhyme or reason.
تا این که یک روز در رستوران هتل میز مجاور ما. برای اولین مرتبه پس از سه روز خالی بودن. اشغال شد	I saw that the table next to ours, left vacant for three days, was to be occupied once more.
که رنگش پریده	, during which his face became pale
لابد دلتان برایش خیلی تنگ شده!	how you must miss her!
له و بی دل و دماغ یواش	crushed and crestfallen.
به قفس خود برگرد.	shut yourself up again.
که عقدنامه را امضا کند	to sign the contract
این بار دیگر آواز نبود	not this time singing
از اتاق بیرون آمدم و در را بستم.	I was and shut the door behind me.
چشمان را با دست گرفته بود	shading his face with his hand.
کسی چیزی از تو نخواست.	I don't want you to do anything
مصمم بود که هیچ محلی به پشیمانی باطنی خاله جانش نگذارد.	he was morosely gratified by the consciousness of it.
ولی دنیا پراز چاقوئه و خیلی راحت یکی دیگه میتونه پیدا کنه.	but the world is full of knives just lying around waiting to be picked up.
اما این مرگ مرا تکان داد.	but her death shocked me terribly.
هنوز خون پدرم در پیشانی تو نمایان است.	you have still on your brow your master's blood!
گرچه نباید از تو نزد خودت شکایت کنم و باید شکایت تو را نزد شوهرت ببرم.	as it is of no use complaining to you. I mean to complain to your husband.
بذارین فکرها شو بکنم.	I'll think the thing over
صرفا اینکه طرف نامه او را دریافت داشته است و خواهد آمد.	that he has received the letter, and will come.
یک بانوی بزرگ بود.	was a very great lady.
سر خم کرد و لب لب را یافت.	he bent his head, groped with his mouth for hers, found it.
خیلی کثیف بود!	it was nasty!
سعی کردم قلبم را حس کنم. سعی کردم پیدایش کنم.	I tried to feel my heart, to find it
زودتر برو مشغول شو.	you can go and get on with it
همه نشتند و مشغول شدند	they were all seated and busy
در تمام مدت ناهار بیش از پیش به هیجان آمده بود.	that all through dinner she was more agitated than ever.
به بیچارگی ایشان نظر کنند نه به اعمال بدشان.	having regard to their sufferings and not to their rascalities.
سمت آشپزی داشتم	I was cook in.
شما خود تفحص مستحق ین نمایید	, but you have only to search for yourself
آن وقت از وحشت موهای تنم سیخ شد.	then my blood crept cold through my veins.
تویی که هم مهربان به طایفه بشری	, thou art indeed man's father in heaven
خرج گزافی نبود.	are not too much
دوباره آن صدا را شنید	when he heard it yet again.
کهنه حرامزاده محکوم خواهد شد.	the old scamp will be condemned.
چشم به خاطر خواهم آورد.	I will remember it, said the young man
پیچید و دوباره به سوی شرق پیش رفت.	turned and went due east again.
او بیدار نشد.	didn't wake up.
این استان را در ماتم و اندوه فرو برده است.	has cast a gloom over the county.
لذا به دیدار دیوانه رفت و بیش از یک ساعت با او حرف زد.	obtaining access to the madman conversed with him for an hour or more
ولو پانزده هزار میل یا بیشتر تا جایی که کشتی دنبال وال خواهد گشت فاصله باشد.	even though she may have fifteen thousand miles, and more, to sail ere reaching her proper cruising ground.
من یک ماه صبر کردم	I waited a month
خیلی امید داشت که به شه اونها رو رام کرد	he was hopeful that they could be tamed.
اما یک کلمه از سخنان همدیگر را نفهمیدیم.	but neither of us could understand a syllable.
فکر بکری به ذهنم رسید.	I have a totally brilliant idea.
من می دونم که دوستت دارم.	I know I love you.
از خاک بیرون بیایند	coming out of the earth
همه بوی مرغ را شنیده بودند	all of them smelling chicken.
البته اگر بخواهی او را ببینی.	if you ever want to see him at all.
من شماره دیروز را دریافت داشتم و بی درنگ آن را مطالعه کردم.	I got the paper and read it yesterday.
راننده حرکت کرد.	the chauffeur drove on.
ما از آن به بعد دیگر هرگز او را ندیدیم	after that we saw him no more
گذاشتم غرایز طبیعی کار خودشو نو بکنن تالیا هم همین احساس و داشته با شه.	I let the practical instincts take over, letting her feel that, too.
اما آن استاد ما را مطمئن کرد که اگر این عمل با زبردستی انجام گیرد بهبود و شفای آن دو تن قطعی است.	but the professor assured us, that if it were dexterously performed, the cure would be infallible.
چون معشوقش دچار توهم شده و عقل خود را از دست داده است.	her bedazzled sweetheart must have lost his mind.
طبیعیدان را دیدم که جلو در یک اتاقک انباری در گوشة باغ میوه ایستاد.	I saw the naturalist pause at the door of an out house in the corner of the orchard.
می خوام بدونم چرا باید به خاطر تو دروغ به گم	I want to know why I'm lying for you.
گفت حرف خوبی زده است	declared he had said a very good thing.
کسی جرأت نداشت که به آنجا نزدیک شود.	no one ever dared go inside
سپس تصمیم گرفتم که هرچه زودتر فرار کنم.	I decided that I must escape at once, if ever.
کارم خیلی زیاد بود.	I had to work.
بعلاوه پنجاه درصد 14400 دلار کمتر از آن بود که به خاطرش ناپدید شوند.	besides, 50 per cent of $14,400 was too small a sum to disappear for.
این خود او بود.	but it was she.
من جرأت ندارم اصرار کنم.	I dare not insist,
هر سلاحی را که فرا چنگشان بود برمی گرفتند	caught up what arms they had
پلنگی ماده یافت که زخمی شده بود.	he found a wounded panther
ولی من اجازه نخواهم داد این جا توسط زندانیان اداره بشود.	but I can't allow the inmates to run this prison.
که گفتی قصد دارد مغز آن را از هم بپاشد.	as if she knocked its brains out
یا به نحوی شگفتی انگیز از وال گیر مجربی تعلیم گرفته است.	or else marvellously tutored by some experienced whaleman.
این موضوع را به وضوح میدانست.	she felt that clearly.
اما دقیقا یادم نم یاد.	I don't really remember.
مطمئنم که من و تو می تونیم با همدیگه راه بیائیم.	I know we're going to getalong.
ناخدا لختی خاموش ماند	a flea in his ear, as the saying is.
یعنی محیط آن تقریباً شش فرسنگ و نیم است	about twelve miles in circumference
به خانه بازگشتم	I returned home
این برای من مسلم است.	I am perfectly aware of it.
ناخودآگاه کنجکاویم را بر زبان آورده بودم و حالا برای پس گرفتن آن حرف دیر شده بود.	I voiced my curiosity impulsively, and then the words were out, and it was too late to recall them.
به همین یک دلیل اکتفا نداشته و تا محقق نکند از اتاق بیرون نشد.	to be convinced by a single proof.
اسب را به حرکت آورد تا بار دیگر در طول خط زنجیر هوسارهای خود گشتی بزند.	touched up his horse to ride once more round his hussars.
من نمی دونم.	I don't know.
بنابراین وقت یا جرات نکرده که بیشتر و واضح تر از این بنویسد.	so that he had no time or did not dare to write anything longer or plainer.
بعد همه با هم با دادوفریاد و سرو صدا راه افتادند و هرچه طناف رخت پهن کنی سر راهشان دیدند پاره کردند و همراه بردند که یارو را با آن دار بزنند.	so away they went, mad and yelling, and snatching down every clothes line they come to to do the hanging with.
که برای ناهار نتوانستم به منزل بیایم.	that I didn't come home to dinner.
مچ ظریف او را برای یافتن نبض در دست فشرد.	taking the frail wrist between his fingers, feeling for a pulse.
نزدیک قطار در حال عبور ایستاد .	stopped quite near the approaching train.
نشاط خاصی به او داده و سبب شده بود که آن شب شنگول و تر دماغ به سوی خانه بشتابد.	cheered him and caused him to step along most briskly and gayly.
واقعة بهجت اثری که پیش آمده بود ناگهان به یادشان آمد و جملگی به صوی چراگاه دویدند.	suddenly remembering the glorious thing that had happened, they all raced out into the pasture together.
چه وقار و هیبتی!	a most worthy old man, and what dignity!
اما حال دیگر او این دو ایالت زیبا را نخواهد دید.	now he won't have those splendid provinces.
که کنار قبره.	that's on the edge of the grave.
منتظر اوامر او ماند.	awaited his directions.
با اکلیل آراسته شده بودند	beaded round with gilt
نفس عمیقی کشیدم تا کمی خودم را آرام کنم.	I took a deep breath, willing myself into composure.
شب سوم برای این که مجبور نباشد نزد من بماند از درد سر شکایت کرد و به اطاق خودش رفت.	on the third from recovering my company she complained of a headache, and left me.
دی گه تم وم شده	now it's done.
گویی مرد محبوب خود را از دست داده یا فریب او را خورده است.	like a girl who has either lost the man she loved or been cruelly deceived by him.
باید تمام حقیقت را بت و بگویم	I must tell you the truth.
بلکه اصلاً روحشان خبر ندارد که باید چه چیزی ابراز کنند.	haven't the faintest idea what there is for them to express their will about.
با آتش ترساندمشف و ذره ذره داستان واقعی را با یک عالمه غرغر و گریه و زاری از او بیرون کشیدم.	I put the fear of fire on him, and wrung the true story out of him, bit by bit, together with much snivelling and snarling.
ابروهایش را تا آخرین حد ممکن کشید	his brows contracted to their utmost limits.
مانند غاری که بخواهد از زیر در بگذرد خود را خم کردم.	I bent down to go in, like a goose under a gate
لبه تخت را گرفت و شکمش را تو کشید.	bracing herself and catching firm hold of one of the bedposts.
با من حرف زد.	he was, spoke.
از این گذشته اطمینان داشته باشید که من از این به بعد جز برای تکریم شما ارباب واقعی و طبیعی خود لب از لب نخواهم گشود	but you may be sure I will not open my lips henceforward to make light of anything of your worship's
انتظار دارم که شما هم گاهی در فکر من باشید.	I should like you to think sometimes of me.
حتی اگر تنها برای دو دقیقه باشد.	even if it was only for two minutes.
اما خبری نشد.	but nothing happened.
از راه همان عادات و حرکات به صورت دیکتاتوری غیرقابل مقاومتی درآمد.	through those forms that same sultanism became incarnate in an irresistible dictatorship.
ما با هم خواهیم ماند.	we will stay together.
از همان جا برگشتم به طرف مرداب.	I struck through the woods and made for the swamp.
وقتی هم تمومش کرد دی گه نمیخواد این ور اون ور آویزونش کنه.	when he's through,he don't want no pig hanging around.
دیگه خطری مارو تهدید نخواهد کرد	I'll be safe
اکنون غرق در گل و شکوفه بودند	now flourished thick with flowers.
ولی همیشه اوضاع به همین منوال بوده است.	but they have been that way always.
ولی نه صورتش و نه من افسر کونیگ هستم.	but neither his name nor his face looked particularly familiar to me.
چنانش تنگ در بغل فشرد	he clasped him in his arms so closely
زیرا به آرامی در کنجی خزید	for he coiled himself up in a corner very quietly
از تصادف با هم وطن خود بسیار خرسندم.	I am delighted to meet a compatriot.
تا اینکه نوبت به ارباب من رسیده بود و او تدبیری را که به خاطرش رسیده بود به مجلس پیشنهاد کرده بود	when my master proposed an expedient to the assembly
ولی چنین کاری نخواهم کرد.	I will never do that.
رنده را پاک کرد و آن را در کیسه چرمی کنار ماشین انداخت و نزدیک میز رفت و دخترش را به حضور طلبید.	dropped it into a leather pouch attached to the lathe, and, approaching the table, summoned his daughter.
به محض شنیدن تکان مخصوصی که به در ورودی باغ داده شد	hearing the well known shaking at the garden gate.
علامات به کلی مخالف در دو تلگراف	for wrong signals to be made as they were in the last two telegrams
سرمای آن سکوت ناگهانی و آزاردهنده.	the chill of that sudden, hurt silence.
از آنجا که به کار بستن روش نخستین بوسیله هر دولتی عین ستمکاریست	as it was tyranny in any government to require the first
اصلا خوشم نمی یاد با هم جر و بحث و دعوا کن ین.	I don't like to see you quarrelling.
بیایید به ایشان بپیوندیم و سرهای خود را پهلوی هم بگذاریم.	let us join them, and lay together our own.
من به این دلیل این کار را انتخاب کردم چون تنها فرصت و وسیله رفتن به شهربود.	I just took that because it was the only chance I saw of getting up to town.
سخن مرا قطع نکنید!	don't interrupt me
وقتی آن را برداشتم	as I held them up
این نامه در او اثر عجیبی بخشید.	which letter put her into the greatest good humour.
کسانیکه لایق و شایسته شنیدن آن بودند ناچار باید نزد کنتس که نامه را از دست رها کرد بروند.	those who were considered worthy to hear it had to come to the countess, for she did not let it out of her hands.
رفته رفته دریافتن این نکته شروع شده است	if there can be force in a boiler
هیچ تاثیر بدی روی زندگی تو نگذاشتم.	I shall not have made any difference to you.
روز اول اشتباه ناجوری کردم.	I made an awful mistake the first day.
بایستی زنده بمانم	should be alive
به انتظار بخشش بنشینم.	therefore I shall confess and await forgiveness.
به این دلیل تمام لوازم خود را در آن زورق گذاشت.	he took all of his belongings with him in that boat.
با صدایی ملیح و ضمن ادای احترام.	in her most civil tones, and dropping a curtsey as she spoke.
گفت که لابد مردمی پرخاشجوئیم	that certainly we must be a quarrelsome people
مادر رو به او کرد.	the woman turned her head
شخص پدر که به قدر کفایت جزع و ناله خود را کرده	the father has mourned sufficiently
ده سر اضافه هم غنیمت است.	ten more heads are worth having.
دوستان بی شمار و فرزندان نیکو و بسیار داشته باشد.	in those of fortune, in having many friends, and many and good children.
باید یه چیزی رو برات ون تعریف کنم.	you wait 'til you hear this
شیشه را به لب خویش نزدیک ساخت.	held the vessel to his lips
بسیار زود به ناتوانی او در حفظ منافع مالی خود پی برده	she had very early made up her mind to his incapacity of minding his own interests
واسه اینکه کاری نکرده بودم.	seeing that there was nothing against me
هنوز برای قضاوت زو ده ولی میتونیم جمع بشیم و دوباره امتحان کنیم.	it very much remains to be seen but at least we can get together and try.
درست قبل از باز شدن در اتاق خود را روی تختخوابش انداخت.	just as the door handle turned.
چون از روی اسم ناخداهایشان میدانست که باید سوابق مشکوکی داشته باشند.	because he knew from the names of their skippers they must have suspect backgrounds.
رینگ رونگ دی لو!	ring a dong dillo!
آن بازگشت به زندگی	that sudden flare
همه افراد به سر کار خود بازگشتند	all hands were turned to
ناچار بودند تندتند راه بروند تا عقب نم آنند.	jogging to keep up with their enormous strides.
آقای کازوبن از من و مادرم خوب مواظبت کرد.	my mother and I were well taken care of.
جمعیت به فریاد خود ادامه داد تا رفته رفته به خواست خود خاموش شد.	until they left off, of their own will.
دوباره شماره را گرفتم.	I dial it again.
چه قدر تکرار هر صحنه موذیانه است	so insidious is the repetition of any scene
بلکه از او تضمینی کافی خواهد خواست	he must have solid guarantees of some sort.
سوزنش به قدری در دستش کشیده شد که کم مانده بود نخ از سوزن بیرون آید.	with her needle drawn out to its thread's length.
زیرا که مشارالیه رأی درست دارد.	you know he always has wise advice to give.
برای تنبیه کردن همیشه وقت خواهد بود و این کار بسته به اوست.	it rested with him to punish them and there would always be time for that.
من جا خورده بودم.	I was startled.
حال به مرخصی شما اکنون که شما را دیدم و از تندرستی شما مطمئن شدم و دانستم که احتیاج به چیزی ندارید	now I have seen you and know you are well and have all you require
عاقبت به گذرگاهی رسیدم که پر بود از رد پای انسان و چندین جای پای گاو	I fell into a beaten road, where I saw many tracts of human feet, and some of cows
چهارمین دولت ظرف شش سال	the fourth in six years
من و او دایه خانه را ترک گفتیم.	she and I left the nursery.
وضعیت این یکی و طرز حرف زدن آن یکی اصلا طوری نبود که هیچ زن با حجب و حیایی بتواند اجرا کند.	the situation of one, and the language of the other, so unfit to be expressed by any woman of modesty,
صدای غمگینی آهسته سلام گفت.	a strange little voice said hello.
حدس زدم که باید 65 سال داشته باشد.	I suppose he would be about sixty five
حتی نفوذ ملانی هم دیگر قادر نبود این رشته گسسته را دوباره پیوند بزند .	bound her to the old days, to old friends.
او جوان پاکی است.	that the fellow is innocent
کشتی چرخید و دوباره جهشی کرد	she filled on the port tack and was off again
در این موقع صداهایی شنیدم	we heard voices already
تمام اعضاء و اندام ما به هم شبیه بود بجز اختلافی که از حیث پرموئی و رنگ داشتیم به شرحی که گفتم.	the same in every part of our bodies except as to hairiness and colour, which I have already described.
لیکن اکنون بفرمایید که چه کسی اول بار در دنیا پرش کرد و در هوا معلق زد.	but now tell me, who was the first tumbler in the world?
من تو را بدبخت دیدم بدبختی تو به من اثر کرد دلم به حال تو سوخت خواستم بلکه کاری در حقت نمایم	I saw you were unhappy and your unhappiness interested me
به هیچ وجه گناه از جانب او نباشد	nor be to blame
شک داشتم توضیح مناسبی برای این یکی به ذهنم برسد.	I doubted I could come up with the appropriate analogy to explain this one.
بگذار او در بوسه پیش قدم شود.	let her want to be kissed, first.
استهزاء تلخ و جانگزای موی خاکستری!	bitter, biting mockery of grey hairs
رالف توانست خوب براندازش کند	he could gaze down upon her whole person
حرکات سالیانه و روزانه خورشید و زمین را با جریانات اتفاقی باد تلفیق کند و تطبیق دهد.	by adjusting the annual and diurnal motions of the earth and sun, so as to answer and coincide with all accidental turnings of the wind.
مطیعانه چشمش را به زیر انداخته از اتاق بیرون رفت.	went out of the room with meekly downcast eyes.
با تأیید ناظران به طبع رسیده	with the approbation of those to whom they have been submitted
قبلا اینو دسته بندی کرده بودم.	I'd already catalogued this one.
