امیدوار بودم به قدری ناراضی نباشد که از خیر سوا لاتی که منتظرشان بودم بگذرد.	I hoped she wasn't so dissatisfied that she would skip the questions I was waiting for.
اما من دویدم و به تنه درختی پناه بردم	but I ran to the body of a tree
بر سنگ قبر کشیشی که چندین سال پیش درگذشته و بر اثر زهد و تقوی شهرت فراوان کسب نموده بود نشسته است	itting on the tombstone of a monk who had been famous long ago for his saintliness.
اگر خواننده تمام هوش خود را یک جا به ما بدهد	if the reader puts all his intelligence at our service
حی علی الفلاح.	come to security.
به او علاقه بسیار پیدا کرد.	took great interest in him.
بابتش پنجاه دلار پول داده بود.	it cost fifty.
از بالای دیوار دشت سمنتی گسترده و یکدست را مشاهده کرد.	peered over the wall to the broad smooth plain of cement.
تا اینکه تقریباً با تأخیر چهل ساله به اهمیت ساده زیستن پی ببرد.	in order to discover the privileges of simplicity almost forty years late.
اما زنگ ساعت خبر خوشی برای ما بود.	but the news was good
من چشم بسته راه میرم.	I could shut my eyes an' walk right there.
بارها و بارها دیدمش.	I see him from time to time.
ما در کشتی کهنه فلینت که وال رس نام داشت مانده بودیم	us standing off and on in the old WALRUS.
استیرفورث هم اطاعت کرد و روی صندلی نشست و پشتش را به میز چسباند.	who, accordingly, sat himself down, with his back to the table
مردی با صورت اصلاح نشده و کثیف با شمشیر و نیز صلیبی کوچک که با نخ سفید به سینه چپ اونیفرم ستوانی اش دوخته شده بود	some unshaven, dirty man, girt with a sword and with a tiny cross embroidered in white cotton on the left breast of a lieutenant's uniform
کریستف دل تنگ بود که چرا اینک که آن دیگری مرده رو زا همچنان زندهاست.	he hated her for being alive while the other was dead.
اما به نظرم میاد که این جور ادما بدون خرد کردن افراد دی گه نمی تونن به جایی بر سن.	but it seems to me these guys don't get to the top without trampling over a few people on the way.
من گفتم نه.	I said no
این خنده طنین دار وزیر و رجل سیاسی تأثیر عجیبی در وی کرد.	this ringing, high pitched laughter from a statesman made a strange impression on him.
تمام شب را به میگساری پرداخت و آنقدر در صرف نوشابه افراط کرد تا به دست خود رشته حیاتش را برید!	he has spent the night in drinking himself to death deliberately!
چشمش به دو رشته گیس زرد افتاد	he saw two long tails of yellow hair
اما چون وکیل پادشاهی غایب است مکتوب رسیده به کاتب اسرار ایشان که اذن باز کردن مکاتیب را دارد	but that gentleman being absent his secretary by his orders opened his letters
من وقتی دیدم	when I heard
که نزدیک یک ربع ساعت در کالسکه نشسته بود.	who had been seated a quarter of an hour on his box
آنا وقتی او را دید تلوتلو خوران جلو آمد و خود را در آغوش او انداخت.	as she saw him, she staggered forward, and half fell into his outstretched arms.
پس از حمله فقط هیجده نفر باقیمانده بود.	only eighteen were left after the charge.
عاشق دریا و عاشق عشق بود.	he loved the sea and love
جزوه کش را در بغل خود محکم کرده و خفت.	placing his pocketbook under his pillow.
خیلی دوست دارم.	I do like it so very much.
من توانستم اطراف آن را که با چندین سلسله راهرو و پلکان محاط شده بود و در فواصل معین ممکن بود که از یکی به دیگری فرود آمد بنگرم.	I could see the sides of it encompassed with several gradations of galleries, and stairs, at certain intervals, to descend from one to the other.
یادآوری اندوه گناه نیست.	it is no sin to remember a grief.
دوتاشون زوار دررفته	two layers of fabric worn through.
کورمال به طرف اطاق رفت	went in the darkness
بلافاصله به عنوان یک اشراف زاده منفور به من حمله کردند	I was set upon at once as a hated aristocrat
زیرا با اینکه پتو مانع دیدن بود	for though it was covered up
کشته خواهد شد.	that man's dead.
شما دو تا باید بدوئید	you two need to run.
ولی من اجازه نمی دم از این کارها به کن ین.	but I won't have you do this sort of thing.
حتما خود او این تقویم را روی دیوار کنده است.	it was he, without doubt, who scratched a calendar on this stone.
قلب پلاگه شروع کرد بآرامتر زدن.	her heart began to beat more lightly.
به ساختمان خانه خیره مانده بود	his eyes fixed on the house.
12 نسبت به درماندگان بسیار مهربان و دلسوز است	12. he is kind and compassionate to the poor and weak persons
کاری کن که از این وصلت راضی باشد.	incline him to be satisfied with the match.
می دونم خانم	I know, ma'am.
شعله جلویی را روشن کردوقهوه را روی آن گذاشت.	lit the front gas ring, and put on the coffee.
از صمیم قلب دوستتان دارم.	I love you dearly.
در این قایق هیچ جای ترس نیست.	there is no room for fear on this lighter.
نوبت بدبختی فرارسید.	then unhappiness came.
زیرا رفیقش هنوز بیهوش بر زمین افتاده بود	for the carrier still lay senseless
با تعداد صفحاتی که شب قبل پس از مرخص شدن از نزد او موفق شده بود بنویسد.	as many pages as he had written since his farewell to her.
پس شاید تمهید شر و فسادی درباره شما کرده باشند.	it was, perhaps, some plot against you.
نیز نوعی نا آسودگی خاطر در عشق هست.	it has in it a certain diffidence.
که این حرفه را انتخاب کردهاند و تصدیق میکنید که هر شغلی جنبههای منفی هم دارد.	who have chosen that career, and one must allow that every calling has its disagreeable side.
این یک قهرمان بزرگ است!	he is a hero!
به طرفش رفتم و کنارش زانو زدم.	I went and knelt beside him.
این رنگش را ندیده بودیم!	but this beats everything.
این بار واقعا از ناراحتی به گریه افتاد.	she cried in real anxiety and burst into tears.
کشف کردم که از چه چیز ساخته شده است.	I discovered what it was really made of.
شمارو می گم!	that you are not!
آنقدر بزرگ شده بودم که لذت تنها بودن را احساس کنم.	I was just old enough to know that it's good to be alone occasionally.
از حل این مشکل که شعر چیست و حقیقت چیست نومید شد و در افسردگی ژرف فرو رفت.	he despaired of being able to solve the problem of what poetry is and what truth is and fell into a deep dejection.
من قبل از ناهار این اتاق را با دقت گشته بودم.	I searched this room carefully before lunch.
خانه آتش گرفت و از بین رفت.	the house had burned down
موجب جذب بهترین مواد غذایی از سراسر آن مناطق گردید.	attracted the best qualified gluttons from all along the coast.
بستگی او را با خود تایید کرد.	has acknowledged the relationship.
که او در حال حرکت بود	who was directing his steps
ناچار بود ردایش را بالا جمع کند.	he had to hoist up his robes
که معمولی و گذرا نباشد.	but what was very moderate and very transient.
او بارها با زبان رسا ثروت و صاحبان ثروت را محکوم کرد	who again and again, in the most explicit language, denounced wealth and the holding of wealth
چوب زیر بغلش را انداخت	threw over his crutch
چه عرض کنم!	I'm ignorant of it!
گرچه از روی احتیاط آن را زیر پیراهن خود پنهان نموده بود.	but he was careful to hide it under his shirt.
هری پاتر باید بیدار به شه!	he must wake up!
تا نگاهی بیندازم.	so I entered to see.
به راستی هم چنین بود.	so indeed it was
توی قطار هاگوارتز خونده بودمش.	I read it on the train coming here
منم هیچی ندیدم	I didn't see anything either
در آن به صراحت اعلام کرده بودند	had stated quite clearly that
باید کمکشان کرد.	we ought to support our cossacks
اوه ماکزیم! این طور حرف نزن!	I think that's very unfair,' I said.
شاید آن ماجرای بزرگ خودش هم خوابی بوده.	the great adventure itself must be a dream!
بی آنکه مدلی انتخاب کند یا درباره آن جر و بحثی بکند.	without choosing or discussing anything.
حتم داشته باشند جامهاشان تهی نباشد.	make certain that their glasses were full.
کسانی هم در زندان بودند که حاصل یک لحظه خشم و عصبانیت زود گذر بود.	others were in prison because they had committed crimes of passion or succumbed to a momentary temptation
حسابی قاطی کرده بودم.	I completely messed up
مادیانش را با اشاره چشم به او نشان داد	pointing to his mare
سال بعد و که ازت نگرفتن	next year 'll do.
در حقیقت پای سیاست گاه است.	at the foot of the scaffold
ناگهان عظمت خطر را دریافتم.	of a sudden, I began to comprehend.
تو وقتی از شکم مادرت بیرون آمدی حاکم نبودی	you came out of your mother's womb without a government
عروسک حسابی به خود ندیده بود قابل تحسین نباشد.	who hadnever had a doll in her life, a real doll
حیف که پاک شد!	the more's the pity!
از آنان خواهش کردم که ورود مرا به یکی از منشیان دربار خبر دهند	desired them to signify my arrival to one of the secretaries
نخستین قسمت عمرش یکسره صرف دنیاداری و زن دوستی شده بود.	the whole of the first portion of his life had been devoted to the world and to gallantry.
که طبیب مخصوص مادر من هم هست.	who attends my mother
اون وقت جارو جنجال راه میندازن و خیال میکنن کشته شده	then they raise hell an' figger he been killed.
هر چند شک نیست که نام همچو چیزی را هم هرگز نشنیده بود.	though no doubt he had never heard there was such a thing as that.
تازه همه چیز بسیار شفاف بود	NEWEverything was so clear.
کاغذها و این چیزها شو اون مینویسه.	writes the warden's letters and stuff like that.
نفس شوم خود را در کلاس شلوغ و خوابگاه آن دمید	breathed typhus through its crowded schoolroom and dormitory
آخر خیابان بند آمده بود.	for the street was blocked.
من او را دیدم.	I saw him
کاش می تونسم حالا بهتون نگم	I wisht I could wait an' not tell you.
من ممکنه سرما بخورم	I might get cold.
با دیوارهای بزرگ و زرد و سفید صومعه های متروکه اش پشت ردیفهای سروهای سبز تیره که ماهیتی بسیار مدرن دارند	with the great yellowy white walls of abandoned convents behind the rows of sombre green cypresses, that fact very modern in its spirit
خوش داشت که حساب مرا چنین بنامد.	as he was pleased to call it.
باز چند ثانیه گذشت.	a few more seconds went by.
دست یکدیگر را گرفتیم	lay hold of each other
حرارت خشم من تو را بر افروخته و گداخته کرده!	my heat has melted thee to anger glow.
گاه چند تکه نقره شش تا در ته تور است.	sometimes there's an inch of silver six words in the bottom of the net.
امیدوارم به کارهای غیرقانونی متوسل نشده باشین	I hope that you didn't do anything illegal
به هم می گه باید بذارمشون راحت با شن و خودم برم	I got a feelin' I oughta go away an' let 'em be.
از آن پسرک واکسی هم چیزی دستگیرم نشد.	I could get no sense out of the chap who cleans them.
این معجون باید خوب بجو شه.	this potion needs to stew before it can be drunk
وقتی که بتواند دوباره از او جویا شود	when he should again interrogate her
عینکش را تا روی پیشانی بالا زد	he pushed his spectacles up on his forehead
باید یواش قدم بردارند	they must go softly
جبهه به امن احتیاج دارد.	I am needed.
هم ون طور که خودت گفتی.	just like you said!
او محبوب و مخدوم پهلوانی چون شخص حضرتعالی است.	she is loved and served by such a knight as your worship seems to be.
آیا انتظاری غیر از این داشتند.	whether they expected to.
به نظر من ناقابل تر از این هستید که از افتخارات وطنتان دفاع کنید.	a man who does not even know how to carry his breeding.
اما چون دیده که جسد طفلی است	, but, perceiving his error
شوخی خطرناکی که با زندگی و همه چیز من بستگی داشت.	the best of them all.
شاهدی احضار شد تا متهم را شناسایی کند	a witness was called to identify him
مال خود شه.	it belongs to him.
در واقع در آن حد که مربوط به یکی دو خاصیت عجیب و بسیار جالب توجه در عادات وال سر زا باشد	indeed, as indirectly touching one or two very interesting and curious particulars in the habits of sperm whales, the foregoing chapter, in its earlier part
اگر من هر شش تن را بر زمین نزدم	if I do not knock them head over heels
کار خیاطی را که دستش بود از سر گرفت.	resuming her work
ناشناس نیز سخت برآشفته و غضباناک بود.	that the latter was in a state of considerable irritation.
موهایش مثل سایه یا مثل ابر بی فروغی بود که توفان یا نیروی شدید آذرخش آن را از هم گسسته باشد.	the hair streamed shadowy, like a beamless cloud torn by storm or by electric travail.
آنگاه او یک مرتبه به سوی چپ ساحل رودخانه پیچید.	then turned suddenly down a bank upon the left.
دوباره امتحان کردم.	I tried again.
دهانش مانند فنری فشرده بسته شد.	her mouth tightened like an overwound spring.
کتش را درآورد و از طرف چرمش روی زمین انداخت تا بتوانند رویش بنشینند.	taking off his coat and spreading it lining side up on the ground so they could sit on it.
سی ساله شده بودم.	I was thirty.
امکانش هست پیش شما بیایم و ببین متان	I wonder if I could come and see you?
که جرئت نداشت برای خود تفسیرشان کند.	that she did not dare to decipher.
لبخند آبنبات فروش هم شبیه لبخند پادشاه پیر بود.	that smile had also been like the old king's smile.
برای ایشان باید مثال های ملموس و آسان	but must have examples that are palpable, easy,
اندیشید که شاید سرما خورده باشد.	reflected that he might have a cold.
در این موقع دو زن و مردی که کلاهی سفید به سر داشت از طرف خانه اربابی به سوی افسران آمدند.	two women and a man in a white hat were seen coming toward the officers.
اون توی جنگله.	he's in the forest
که نفوذی علیه من به کار نبرید.	as to urge no influence against me.
البته این در موقعی بود که دیگر اوقاتش به وضع توصیف ناپذیری تلخ شده بود.	but this was carrying out his virtuous precepts to an unusual extent.
به دور و برم نگاه کردم	I look around
آنگاه ماجرایی وحشتناک و دور از عقل و خرد بر سر دن کیشوت آمد که شرح آن خواهد آمد.	to whom there fell a terrific and desperate adventure.
ولی حال به همان منوال نماند	but not for long
پس اگر او را کشتم	if I am victorious
من عقیده داشتم	I had quite made up my mind
تصور بسیار نامشخصی داشت	he had a very indefinite notion of what it consisted in
اگر من هم متقابلاً احترام خودم را به شما بدهم دیگر مدیون هم نخواهیم بود.	if I give you mine in return, that debt will be quit.
در این در!	take this door!
بی آنکه لکه بر جامعه نظامی او برسد	without some stain of infamy or blood to soil the uniform of the soldier, or the gown of the magistrate
بهترین پیشنهادی که به ذهن کلاید رسید آن بود	the best he could suggest was that both were to try
. از نارنجک دستی که به کمربند او آویخته بود	where a hand grenade was fastened to the belt
موجب شود که بتوانند نقایص کار مرا جبران کنند.	will be curious and able enough to supply my defects.
قصدم همین بود.	I wanted to,
با صدایی زیر و گوش خراش فریاد زد	crying in a hoarse sort of screech
بار دیگر به آن چیزی فکر کرد که همسرش از آن واهمه داشت.	he began to think again about what she had feared.
گویی سعی داشت مطلبی را به خاطر بیاورد.	as though he were going to pick something up.
اگر اشتباه نکنم یک نامه برای یکی از افسرهای تو دارم.	here is a letter for one of thy officers, if I mistake not.
سعی داشت آسودگیش را در دل نگه دارد	trying to smother his relief.
فکر کردم اون مرده که عینکش شکسته و عقاید عجیب داره به طرفم میاد.	I thought you were probably the man with the broken glasses and the queer philosophy.
به سمت من نگاه کرد.	glanced towards me.
بازمانده آن بناهای عالی که به سالیان دراز برافراشته بودند از ویرانی برکنار ماند.	the rest of that noble pile, which had cost so many ages in erecting, preserved from destruction.
بعد پایین آمدم .	I came down again.
ولی اگر شما نتوانید بر خودتان مسلط باشید و در هم بشکنید ما میتوانیم ضرر	but if you can't keep up your end, we will stand our loss, of course,
ولی مادرم او را از این کار بازداشت و بر سر میز نشاند.	but my mother wouldn't let her do it, and made her dine with us.
وود منتظر جواب هری نماند.	then, without waiting for an answer
احساسات و رنج و شرمساری و پشیمانی او را درک کرد.	he understood her feelings, her sufferings, shame, and remorse.
پنهان داشتن نام واقعیش تنها شرط پدر او برای ازدواج ایشان بوده است	his concealment from herself of the name he had relinquished,was the one condition'fully intelligible now'that her father had attached to their betrothal
من محصل فقیری هستم و با ید در فکر تهیه پول وزندگی باشم.	but I am a poor student, and I have my way to make.
از آن به بعد من با خودم عهد کردم که حالا که همچی شد دیگر دست به پوست مار نزنم.	I made up my mind I wouldn't ever take a holt of a snake skin again with my hands, now that I see what had come of it.
به این ترتیب سیر و سلوک خود را در خانه آغاز کرد	so began a perambulation of the house
جانش در خطر بود.	was in danger
سعی کردم لبخندی زورکی بزنم اما نتوانستم.	I try to smile, but my face won't quite do it.
شرمندگی مورد نداشت.	there was nothing shameful.
برای ابد از نظر ناپدید شده بود.	or anywhere else ever again.
با این همه خود را محکم به تنه درخت چسباندم و از آن بلا جان به در بردم.	however, I escaped pretty well by sticking close to the stem of the tree
دردمند و وامانده بود.	most of it grief and pain and hunger.
چون دوستش در پی افسانه ی شخصی خودش به این سفر آمده بود	his friend was in pursuit of his destiny.
تا برای آخرین بار خانه را تماشا کند.	for a last look at the house.
قانون قانون است.	law is law.
به چرخاندن آن ادامه داد.	continued to turn it.
تردید نیست که در گفتار خویش صادق بود.	I have no doubt she did.
به زودی برای من روشن شد که	indeed, it was soon plain to me that
خیال داشت این کار را ولو اینکه موجب خفه شدن او گردد انجام داده	at the risk of being stifled
چون کلاه خود پهلوان را که به ضرب چوب خرد شده بود از سرش برداشت	relieving him of the visor, already battered to pieces by blows
پیر مرد عصای خیزران خود را به دست گرفته	fumbling about him for his cane
من همه موارد ممکن را بررسی کردم.	I checked them all out.
خیلی شانس بیارم چند دقیقه دی گه زنده می مو نم و نه بیشتر.	I'll last a few more minutes with luck, but not much longer.
بعد باز به طرف من آمد و شروع کرد به تحقیق و فحش دادن.	then he turned to me, scolding and questioning me.
من دیگر جگرگوشة زیبایم را نخواهم دید.	I never shall see my pretty darling again.
روح یک سرباز هنگام یکه یک ارتش دارد	or as if the soul of the warrior, when he has an army
تا موقعی که این کار انجام نگیرد	until that was done
لحن صدایم را آهسته و ملایم نگه داشتم	I kept my voice light.
مسیو نوارتیر خادم را پایید تا بیرون رفت	MNoirtier looked after the servant until the door was closed
من در این باب فکری خواهم کرد.	I will reflect.
این نکات هر چند ممکنست که در نظر عوام کالانعام سخیف آید	however insignificant they may appear to groveling vulgar minds
اما من گنج را پیدا کردم.	I found the treasure.
آینده جز بر شکست دلالت نداشت.	we had nothing before us
ای کاش می تونستم اون ابله گنده پشمالو رو موقع دفاع از خودش ببینم که می گه	I really wish I could hear that great hairy moron trying to defend himself
بلوزها را نیمی در اندازه بزرگ و نیمی در اندازهٔ متوسط بگیر.	get the blouses half in large size, half in medium.
این بود که هنوز چیزی نگذشته به کلی لخت شدند	so it was not long before they were stripped
تا اینجا آمده باشد و باز گردد!	should he retreat after going so far?
چقدر ناپسند است.	it's very unbecoming.
که به جای کلاه کوچک یا شاپو دو شاخ عظیم برسردارد.	that, instead of a cap or hat, he has two immense horns on hishead.
من قابلیت این کار را ندارم.	I am incapable of doing so, he said.
خودش نیز از جرئت و جسارت خودش تعجب کرده بود.	horror struck by his own daring
اما با بسیاری از همنوعان خود در سفیدی و نرمی پوست خود تفاوتی عظیم دارم.	but that I differed very much from the rest of my species in the softness, whiteness, and smoothness of my skin
شاید عملا نوعی ضعف بر او مسلط شده بود.	perhaps some faintness actually attacked her.
سفر دریائی من پانزده روز ادامه داشت	spent fifteen days in the voyage.
فقط از آن جهت است که فهرستی خسته کننده است	it is only that the catalogue is tedious
طوری نیست که سرما بخورم.	it is not the sort of thing that gives me cold.
چون سه چهار بار گفته بود که اگر باهاش عروسی نکنم خودشو میکشه.	because shehad said three or four times that if I didn't she would kill her self.
دکتر لاریویر با وجودی که به این قبیل مناظر دردناک عادت داشت نتوانست از افتادن قطره اشکی روی تور پیراهنش جلوگیری کند.	this man, accustomed as he was to the sight of pain, could not keep back a tear that fell on his shirt frill.
